품종,성별코드,주진단명코드,병원,SE,기타진단코드,기타증상코드,주진단명,질환,증상명,주증상명,len,diags_small_id
Yorkshire Terrier(요크셔 테리어),MN,2170,D_VIP,s 통증 목부위를 만지면 아파하는것 같다고 함 식욕도 약간 떨어짐 우측 하악부위 촉진시 통증반응 심함 구강관찰시 출혈있음 혈액검사 특이소견없음 흉부방사선상 특이소견 없음 치과치료의 필요성 안내드림 이번주 day time 로 예약함 스켈링 치아방사선 및 발치 모든이를 다 발치할수도 있다고 안내드림. 정확한 비용은 그때 가서 알려드릴수 있음 day 오후 time 치과치료 ,,, 치주 질환 / 치주염 (젖니 유전자 좌로 유래하는 것 포함),치아 및 구강 질환 ,,,207,6
K.C(Korean Cat),MN,2170,B_W,치주염이 의심이 되어 내원함 month 전부터 이전 먹은 사료를 먹지 않음 사료를 먹지 않아 새로 사료를 사주었는데도 먹지 않음 예방접종은 어릴때 하고 이후에 하지 않음 소변을 보지 못해서 처치를 받음 현재 소변은 정상적인 상태임 month 전부터 먹는것이 줄어서 변양이 불어 들었음 오른족 뺨을 만지면 아파함 오르쪽 뺨을 대고 냄새를 맡으면 썩은냄새가 남 pcr검사 결과를 보고 보호자님과 치주염이나 구내염 virus관련 부분을 상담할 예정임 ,,4, 치주 질환 / 치주염 (젖니 유전자 좌로 유래하는 것 포함),치아 및 구강 질환 ,통증,통증,249,6
Schnauzers( 슈나우져),F               ,2116,H, cc 오른쪽 뒷다리 딛지 못함 검사 위해서 내원 history day 부터 갑자기 오른쪽 뒷다리를 딛지 못하고 아파서 그런지 잘 일어나지 않음 산책 시에만 배뇨를 하는 아이라 산책을 못시켜줘서 그런지 day 부터 배뇨 관찰되지 않음 구토 설사 는 없었음 기력이 감소함 다리가 아파서 잘 움직이지 않아서 그런지 밥을 잘 먹지 않아 어제는 소고기를 구워서 주었더니 잘 먹었음 유선 종양 부위가 더 부은 것 같음 수술 여부는 모르겠지만 그래도 검사는 해봐야 할 것 같아서 왔음 environment indoor 동거견 연령 슈나우저 food 사료 간식 등 vaccination deworming 어렸을 때만 접종 사상충 매달 구충 systemic gen mental alret skin nrf nervous nrf eent nrf res nrf cv heart base murmur gi nrf ns rt.poplitear ln enlargement cm t r panting p.e. mm pink crt sec bp time hg cuff rt.fl rt. hindlimb lameness bw kg 체중 감소 dehydration 혈액검사 elevated alp increased crp 방사선 흉부 흉부 복배상에서 우측 후엽 원형 크기 lxw mm 의 폐결절 의심 좌측 전엽 타원형의 폐결절 의심 크기 lxw mm 폐전이 의심 복부 하복부 복측 복벽 복측으로 불균질한 연부조직 밀도의 피하종괴. 유선 종괴 요추 번 복측으로 타원형의 연부조직 밀도의 종괴. 요추하 림프절 비대 흉추 번 요추 번 사이 척추체 endplate 불균질한 골증식 퇴행성 변화 무릎관절 무릎관절 전후측상에서 우측 대퇴골 medial epi condyle 국소적으로 미약한 골밀도 감소. bone cyst metastasis 복부초음파 요추하 림프절 비대 metastasis 유선종괴 저에코성이며 분엽화 되어 여러 종괴 관찰됨. 악상 피하 종괴 의심 양측 부신 비대 뇨 검사 비중검사 하루 정도 소변 참은 것으로 생각됨 스틱검사 mild proteinuria 응고계 검사 nrf 유선 종양 악성 가능성 높음 의 전이 가능성 폐 rt. hindlimb 심장 ar 전이 여부 평가를 위해 ct 촬영 필요함을 설명하였으나 보호자 남편 분이 더 이상의 처치나 검사는 원치 않음 호스피스 관리 원하고 있어 내복약만 일주일치 처방함 보호자 아내 분이 남편가 상의 더 해보고 추후 일정 정하기로 함 ct or 약만 처방 comments 수술 여부를 결정하기 위해서는 ct 촬영이 반드시 필요함을 언급하였으며 전이가 확인되었을 경우 수술보다는 호스피스 관리가 더 나을 것이라고 말씀드림 전이가 되지 않았을 경우에는 수술 및 항암처치 등이 필요함을 언급하였음 tx cephalexin time kg bid po famotidine time kg bid po piroxicam time kg sid po 저녁약 ,,, 유선 종양 / 유방 종괴 , 생식기 질환 ,,,1438,3
Shih Tzu(시추),FS              ,2275,F_센트럴,c.c 교통사고 승용차가 밟고 지나감 쇼크 저혈압 ray 골반골절 좌측 고관절 탈구 chemistry 혈소판 감소 백혈구 감소 ,,"0,77", 사고 (교통 사고 포함) ,전신성의 질환,"기타 증상,골절",기타 증상,71,8
Yorkshire Terrier(요크셔 테리어),MN              ,2185,D_VIP, 전신상태 nrf mild 탈수 bcs alert no murmur no crackle p 안과 os 홍채변성 및 렌즈와 유착 plr 시력 망막 관찰 어려움 stt 안구위축 안압os 이전 포도막염에 속발되어 홍채의 변성 및 각막궤양 동반됬을 가능성 존재 우측 핵경화증 stt 안압od 양측 각막형광염색 근골격계 신체검사상 좌측 상완 견갑 관절통 초음파 방광벽 비후 심하지 않음 좌측 상완 견갑부위 tenosynovitis 예상 소염제 처방 필요할 것으로 예상 슬개골탈구 비뇨기 소변검사 채취시 혈액혼입 결석성분 관찰 어려움 적혈구만 다량 관찰 rad 작은 좌측 신장 결석 방광결석 존재 초음파 방광벽 비후 심하지 않으나 슬러지형 결석 신장에 결석 소량 존재 신우부분에 존재하진 않음 이전 결석 ca oxalate 관련하여 지속적 관리 필요 초음파 소견 다 적혀있어서 따로 안적을게요 현아 치과치료 money 스켈링 마취 치과방사선 진행 예정 ,2092,23, 슬개골 (아) 탈구 ,근육 골격 질환 ,"보행이상, 파행(전지, 후지)","보행이상, 파행(전지, 후지)",471,7
Bichon Frish(비숑 프리제),MN              ,2133,H,어제저녁부터 후지마비 내츄럴 코어 연어 사료 먹임. 바우와우를 사료에 섞여서 먹였음. 배뇨곤란으로 방광염이 심하게 발생하여 출혈이 있음. 방광염 치료 해야함. deep pain 좌우 모두 있음. ct. 부토판 앰플 미다졸람 time 프로포폴 time 진통수액 케타민 time 요추 ivdd 수술실시 url 파열된부위 수술을 함께 함. ,,, 상기에 해당하지 않는 신경계 질환 , 신경 질환 ,,,187,5
Schnauzers( 슈나우져),F,2092,D_VIP, cc 혈뇨 피부질환 hpi 약 두달전에 생리함 생리 끝날무렵 미용함 이후 피부에 각질 유사 피부증상 보임 약 한달반전부터 엉덩이 주변 핥고 뇨에 피가 섞임 month 전 로이동물병원 방문하여 별다른 검사 없이 생리에 대한 잔여 영향으로 섞여 혈뇨인것같다라고 들으심 당시 피부 이전에는 피가 조금씩 묻어있는 양상이었지만 어제는 다량의 혈뇨 관찰됨 뇨량 오줌이랑 전반적으로 섞여있는양상 배뇨 자세를 여러번 보이고 화장실을 자주 왔다갔다하며 안절부절 못함 증상 보이는 시점 주변 특별히 잘못먹은건 없음 심장사상충 예방 안하심 호흡은 다소 양호한편이나 간헐적인 켁켁거리는 증상 보임 평소 뇨를 참는 성격아님 항문낭 평소에 잘 안짜주심 phi med month 전 로이에서 피부약 처방받음 sur tru vac 기초 boosting diet dog 랑 month 전에 사료 변경 피부 저알러지사료 eh indoor with 마리 푸들 사이 좋지않음 systemic gen 활력 및 식욕 양호 음수력 양호 skin 지루성 피부질환 들으심 nervous eent 눈은 평소 안좋음 res cv gi ur for this symptom rep 생리 한달반전 종료 뇨검사 염증 세포 및 구균 확인됨 복부초음파 full scan imaging dx ddx renal cyst urolithiasis cystitis comment 우측 신장의 . time 크기의 낭포 확인됨 그 외 신장의 크기 모양 피질에코 양호 방광 벽 비후 time 및 방광 내 다수의 거대 결석 확인됨 radiologist 이현아 dvm ms cystitis urolithiasis 혈뇨를 주증으로 내원한 환자로 금일 영상 검사상 방광내 큰 크기의 결석 개 관찰되며 현재 폐색을 유발하지 않음 방광벽 심한 비후 확인되었음 뇨 검사상 다수의 염증세포 및 구균 확인되었음 수술적 제거로 방광염의 원인인 방광결석 제거 필요 안내드렸으나 보호자님 심한 비용 부담으로 내복약 처치만 원하심 방광염에 대한 대증처치 처방함 보호자님 상태 모니터링후 재내원 예정 ,방광염,8, 방광 결석 , 비뇨기과 질환 ,혈뇨,혈뇨,1010,1
A.Cocker Spaniel(아메리카 코커),F,2126,C_잠실ON,새벽 두시에 시골길에서 발견해서 집으로 데려옴 사료를 먹지않아서 설탕물 먹임 기운없이 늘어져있어서 내원 혈뇨 방광염소견. 내강에 슬러지 확인. status epilepticus 내원후 경부터 발작 시작. 집에서부터 전조증상 있었음. time 이상 멈추지않고 지속. tx dz time kg im 회 이후 propofol cri cepha sc tramadol iv 수액 d vitb vitc taurin 보호자 상담 용 . mri는 보류해놓은 상태. 정확한 진단이 나지 않은 상황에서 위험성을 안고 치료하고 있음 고지. 경기도에서 발견하여 데리고 오셨으며 법적 절차 문제로 해당 시 군청에 유기견 신고를 해 놓고 치료할것을 권해드렸으나 보호자분 원치 않으셔서 책임하에 치료 해달라고 말씀하심. 정오부터 propofol cri로 들어가고 있으며 속도 time hr 로 조절중. 중간중간 포폴 스톱하여 보았으나 증상 개선되지 않아 유지 중. 금일 밤 time 경 다시한번 항경련제 끊어볼 예정. tx. mpss time kg tid. mannitol kg sid cepha enro. time 경 통화 시도 하였으나 보호자분 통화 안됨. ,,16, 경련 발작 (원인 미정) , 신경 질환 ,발작,발작,579,4
K.C(Korean Cat),MN,2133,D_VIP,s 배뇨는 가능하나 배변은 힘듬. 정상배변 어제 소량 식욕부진 time 부터 다리가 불편하기 시작하여 어제는 매우 심해짐. 다리를 쭉 펴고 보행. 항생제 진통제 처치에도 반응 없이 더 악화됨. 차 접종만. 다 잘먹는 아이. bt positional reflex 반응없음 반사감소 정상 preprioception fr fl rr rl anus reflex 애매함. deep pain 촉진시 매우 아파함 사지 냉감 없음. 오히려 열감 양안 통증 있음. iop odos felv fiv neg. fcov pos. cbc mild leukocytosis chem nrf elect mild hyperkalemia saa normal range 방사선 nrf 복부초음파 full scan by joohee findings 복막염 소견 확인되나 복수는 확인되지 않음 혈관반응이 없는 hypoechoic foci가 비장 내에 산재되어 있음 양측 신장 에코 상승 확인되며 우측 신장의 아주 소량의 perirenal fluid 확인됨 불규칙한 방광벽 확인되나 벽 두께는 양호함 우측 요추하 림프절이 중증도 비대 확인됨 time . 이외에 미약한 복강 내 림프절 비대 imaging dx ddx peritontitis fip dry type systemic infection lymphoma lymphadenopathy nephritis perirenal fluid cystitis ddx. 신경계질환 뇌 척추 fip mri 검사 진행 안내드렸으나 일단 보류하고 치료먼저 진행해보기로. 신경증상 진행속도가 워낙 빨라 내복약 복용하면서도 발작 등의 더 진행된 신경증상 발생 가능성 있음. 너무 좋지 않을 경우 퇴원 또는 안락사 진행도 상담드림. fip 신경계질환에 준한 치료 pds 진행. saa 신경계검사 ,,23, 상기에 해당하지 않는 신경계 질환 , 신경 질환 ,"보행이상, 파행(전지, 후지)","보행이상, 파행(전지, 후지)",889,5
Dachshunds(닥스훈트 ),F               ,건강검진,G_부천이지, month 가출 후 오늘 찾음 건강상태 확인 원함 보호자분 요청으로 병리학적 검사 진행 혈액검사 상 이상소견은 없음 검이경 상 검은색의 귀지 확인 위 내 다량의 고밀도 물질 확인 집에서 닭발간식을 먹였다고 함 베아제 처방 심한 결막염 맥시트롤 하루 회 rx 베스타제 반알 맥시트롤 하루 회 락토믹스 하루 회 분배 담당자 분배 방법 수동 복약 지도 주의사항 담당의 지도 e 혈액검사 및 영상검사 상 건강상의 큰 이상소견은 없음 금일 과량의 음식을 갑작스레 먹은 점이 확인되어 이에 대한 소화흡수 기능장애가 나타날 수도 있으니 관찰 필요 구토 설사 식욕부진 문제 시 내원 ,,,,,,,319,9
Mixed(혼합),MN              ,건강검진,E_24시아이, 건강검진 보호자 주 호소사항 눈꼽이 자주껴요. 귀를 긁어요. 집근처 병원에서는 약만 주고 별다른 설명이 없어요 stt test 양측 모두 time 정도 검안경 각막 정상. 특이사항 없음. 귀도말검사 검이경 이도 정상. 심장사상충 검사 음성 혈액검사 모두 정상 주인이 번바뀐 상태. 이전까지 사료가 아닌 사람음식을 먹고 생활했음. 현재도 사료 잘 안먹음. 육식에 치우치 영양 불균형이 발생하면.소양감을 동반한 피부병이 발생할수 있습니다. 현재 보호자 노력으로 식단이 많이 개선되기 했으나.육륫섭취는 더 줄이는게 좋겠습니다. 귀 청소시.면봉 쓰지 마세요. 안약은 month 간 사용후 눈꼽개선되면 끊이시고.다시 재발하면 재진 하겠습니다. ,,,,,,,356,9
Pomeranian(포메라이안),F,2185,B_W,rt hindlimb pain bi mpliii 오늘 통증이 있는지 집에서 나오지 않음 현재는 촉진시에 통증을 많이 느낌 금일 bi mpl수술을 진행함 tx s pain control ketamine time kg lidocaine time kg maintenous fluid cefradine time kg tid cimetidine time kg tid tramadole time kg tid enrofloxacin time kg bid taurine time head sid methocarbamole time kg tid vita b.c 각 ample head ,2158,, 슬개골 (아) 탈구 ,근육 골격 질환 ,,,318,7
친칠라,MN,2095,C_잠실ON,cc month 전 부터 urinary incontinance. dribbling. 식욕저하. 활력저하. ,,9, 고양이 하부 요로 질환 FUS · FLUTD , 비뇨기과 질환 ,배뇨실금,배뇨실금,59,2
Maltese(말티즈),MN,2126,B_W,hx month time 전신 발작 증상으로 춘천 현대 동물병원 입원 항경련제 항생제 스테로이드성 소염제 등 투여하며 입원 치료하다가 month time 퇴원 퇴원 후 집에서 빙글빙글 돌고 머리를 벽에 부딪치는 행동 보여 항경련제 증량 month time 전신 발작 증상 재발하여 다시 춘천 현대 동물병원 입원 이후 발작 증상은 없었으나 잠을 많이 자고 목적 없이 앞으로 걸어가는 행동 보임 오른쪽 눈 안구건조증 및 각막미란 관련 안약 투여 어제 보호자가 본원으로 진료 문의 한만길 원장님 전화 상담 후 오늘 본원으로 이동 본원으로 이동 전 소리지르고 흥분하여 춘천 현대 동물병원에서 diazepam acepromazine 투여 후 이동 hct month time month time month time month time plt month time mcl month time mcl month time mcl month time mcl wbc month time mcl month time mcl month time mcl month time mcl bun month time month time month time month time month time crea month time month time month time month time month time ip month time month time month time alt month time month time month time month time ast month time month time month time month time month time alp month time month time month time month time month time pe mentation stupor hr bpm rr time pm bt sbp time hg severe dental tartar gingival recession bloodwork cbc anemia hct thrombocytopenia mcl leukocytosis mcl rpi non regenerative chemistry increased alt ast alp amyl lipa ip and ck decreased alb and ca normal ionized ca electrolytes mild hypernatremia and hypokalemia increased na ratio blood gas ph pco hco etc. crp reference range coagulation profile dimer reference range fibrinogen reference range aptt reference range pt reference range x ray vhs increased radiopacity of the lung fields radiopaque calculi in the left ureter urinary bladder and urethra echocardiography mitral valve degeneration mitral regurgitation mr pgmax time hg tricuspid regurgitation tr pgmax time hg mv epss time lv fs increased lvidd time lvids time la ao ratio pv pgmax time hg a ratio abdominal ultrasonography hyperechoic lesions in the splenic parenchyma hyperechoic round mass in the hepatic parenchyma echogenic bile in the gall bladder lumen hyperechoic material with acoustic shadowing in the left ureter hydroureteronephrosis due to the left ureterolith hyperechoic materials in the urinary bladder lumen length of the kidneys left time right time diameter of the adrenal glands left time right time ophthalmic exam stt time min od time min os fluorescein stain test positive ou 보호자 상의 후 마취 위험성 있으나 진단 위해 내일 mri 및 ct 촬영하기로 함 tx fluid therapy with nacl dextrose kcl time eq ornipural taurine vitamin vitamin fr time kg hr phenobarbital time kg bid iv slowly cefazolin time kg tid iv slowly cimetidine time kg tid iv slowly sodium hyaluronate eye drops h ou serum eye drops h ou tobramycin eye drops h ou acetylcysteine eye drops h ou ,"2092, 2137","4,16", 경련 발작 (원인 미정) , 신경 질환 ,"통증,발작",통증,2526,4
Shih Tzu(시추),FS              ,2133,F_센트럴, 사경 안구진탕 아침엔 별 이상없었는데 밤에 귀가하여 보니 증상발현 작년에 중성화 양측 외이도 만성염증 vestibule synd. 발생 원인 확인 위해 mri 촬영 권장 익일 오후 time 경 이안 mri 촬영 보호자 동반 예약 보호자분 mri 촬영 취소 증상이 완전히 해소되지 않을 수 있음을 고지 증상 호전 시까지 최소 month 소요 각막궤양 및 기저질환 발현의 가능성 고지 말초성으로 준하여 치료 시행키로 ,,"40,0", 상기에 해당하지 않는 신경계 질환 , 신경 질환 ,"신경증상(이상행동),기타 증상",신경증상(이상행동),232,5
Maltese(말티즈),FS,2275,B_W,집에서 부부싸움과정에서 집어던졌다고함 내원시 두경부에 혈액이 묻어있었으나직접적상처에 의한 출혈이 아니고 보호자의 혈액인듯함 처음내원시 약간 흥분 약간 공격적이었으나 좀뒤에는 얌전해짐 일단 입원치료하면서 지켜보기로함 방사선상과 외관상 신체검사시 특이소견은 관찰되지 않음. dimer만 상승. 전반적인 상태양호. 내일 오전에 dimer와 전해질 재검하고 퇴원 고려. ,,15, 사고 (교통 사고 포함) ,전신성의 질환,출혈,출혈,203,8
Mixed(혼합),MN,2092,D_VIP, refer. 주호소 방광결석 현증경과 의뢰병원에서 방사선 검사상 방광 요도내 결석 발견. 핍뇨 빈뇨 혈뇨 오래전 관찰되기 시작했고 최근 혈뇨 심해짐. 구토 설사 증상 없음. 알러지성 피부염 있어 알러지 사료 급여중. 고구마 양배추 브로콜리 정도 급여중. 예방접종 부스팅 접종 되어 있지 않음. 사상충예방 안되어 있으심. 사료 연어사료 one 신체검사 mental alert hr min bcs mmc pink crt 탈수평가 혈액검사 chemistry alt mild elevated cbc nrf hw negative 영상검사 cxr nrf axr 방광내 결석 약 개 요도내 개 관찰됨. 복부초음파 by hyuna findings 양측 신장 실질 양호 다발성 미세 결석 방광 벽 비후는 심하지 않으나 time 방광 배쪽벽에서 다수의 폴립 관찰됨 방광 내 다수의 결석 관찰됨 최대 time imaging dx ddx urolithiasis polypoid cystitis dx ddx urolithiasis 결석제거 수술 내일 예정. 결석제거 수술시 방광 mass 체크하여 필요시 조직검사 예정. 결석성분검사 진행합니다. rx 식이 d can bid tx 수액처치 ns 유지 주사제 cephalexin time kg iv bid famotidine time kg iv bid tramadol time kg iv bid 내일 수술 진행. ,요도 결석,"902,901,8", 방광 결석 , 비뇨기과 질환 ,"핍뇨/무뇨,배뇨장애(통증, 곤란), 빈뇨, 이소배뇨,혈뇨",핍뇨/무뇨,693,1
Chihuahua(치와와),MN              ,2170,D_VIP, 적립금 모두사용 money 식욕 활력 양호 배변 배뇨 양호 금식완료 혈액 검사 정상 흉부 방사선 상에서 심장 la 약간 비대 확인 청진시 심잡음 확인 bp time hg 심장초음파 by hyuna findings mv remodeling moderate mr moderate to severe la 확장 기능저하 압력 증가 등은 관찰되지 않음 ddx degenerative mirtal vlave disease comment mr 있으나 cardiac remodeling 관찰되지 않습니다. 치과치료 by 최이돈 원장님 치주염에 의한 발치 money money money 좌측 상악 송곳니 palatal side 치조골 depth 손상 amox cla time kg strepto time kg bid days 불린사료 month 동안 일주일 후 치아 재진 month 뒤 심장 초음파 재진 ,2001,15, 치주 질환 / 치주염 (젖니 유전자 좌로 유래하는 것 포함),치아 및 구강 질환 ,출혈,출혈,443,6
Pekingese(페키니즈),MN,2092,C_잠실ON, 혈뇨와 관련하여 방광결석이 혈뇨의 주 원인일 것으로 판단. 요도안에는 아직 없으나 방광내 요도쪽으로 가득 차있어 수컷인 점을 감안 빠른 수술적 교정이 필요할 것으로 보임. 방광결석 제거 수술 time 가량의 결석 개 방광 중간에 위치한 것만 제거 못함 보호자 결석이 상피세포와 붙어있을 가능성이 있고 제거하려고 했지만 잘 안되었다. 더이상 건들면 방광벽 파열 등의 차적인 문제가 발생할 수 있으므로 그냥 남겨놓을수 밖에 없었다,,8, 방광 결석 , 비뇨기과 질환 ,혈뇨,혈뇨,239,1
K.C(Korean Cat),MN,2170,A_라라,s 좌측 하악 송곳니 상악 하악 어금니 우측 상악 하악 어금니 치은염. forl 가능성 설명 마취전 검사 진행하고 day 에 스켈링 잇몸 치료 방사선 검사 후 필요하면 발치 발치의 조건 흔들린다. 치아가 녹고 있다 구강 문제 day 에 내원하여 치료 진행할 예정임. 오전에 아드님이 오셔서 맡길 예정이고 오후에 보호자님 오실 예정 되도록이면 발치 원하지 않음 sdma 검사도 해야 함 ,,4,,,통증,통증,215,6
Boykin Spaniel(보이킨 스파니엘),M,2170,B_W,금일 ct검사를 진행하기 위해 내원함 month 후 내원하여 귀.코.치아 관련하여 수술을 진행하기로함 ,2164,61, 치주 질환 / 치주염 (젖니 유전자 좌로 유래하는 것 포함),치아 및 구강 질환 ,구내염,구내염,57,6
Maltese(말티즈),MN,2170,C_잠실ON,금일 검사상 우측 상악 작은어금니 흡수성 병소 보이나 치아뿌리가 양호하여 유지시킴 내복약 month 복용하기로 하였으며 주기적인 관리 안내드림 ,,, 치주 질환 / 치주염 (젖니 유전자 좌로 유래하는 것 포함),치아 및 구강 질환 ,,,80,6
Shih Tzu(시추),MN              ,2133,F_센트럴, history 심장약 투약 중 최근 실신 혹은 경련 증상 반복 모견 경련 후 사망 소견 이후 선회 및 peddaling 증상으로 미루어 신경증상 의심됨 month 전부터 설사 혈액성 설사 오렌지 동물병원에서 심인성 폐부종으로 판단되어 이뇨 처방 계속 받고 있음 objective no pulmonic edema astasia recumbency stupor mental plr tactile severely elevated liver enz. hyperphosphatemia elevated renal enz. ce mortality rate 이상 dnr ,,"40,1601,33", 상기에 해당하지 않는 신경계 질환 , 신경 질환 ,"신경증상(이상행동),실신,떠는 증상, 경련 또는 미진",신경증상(이상행동),312,5
K.C(Korean Cat),MN              ,2095,D_VIP, money 결제완료 효정 폐쇄형 방광염으로 인해서 동사병원에서 요도개통이후 소변을 조금씩 보다가 다시 소변을 잘 못보는것 같다고 하셔서 본병원으로 내원주셨습니다 영상검사 심한 방광팽만 결석없음. 초음파상 슬러지는 그다지 많이 보이지않음 뇨검사 약간의 혈뇨 세균 크리스탈등은 보이지않음 혈액검사 신장수치 상승. 염증수치 상승 flutd중 fic로 확인됩니다. 완치가 아닌 관리의 질환이고 만약 증상이 반복해서 일어난다면 요도구 성형술이 필요할수 있습니다. 주사마취하 요도캐통 및 카테터 설치 입원치료 진행합니다. 매일 신장수치 평가 및 요도플러싱 진행 day 까지 입원후 개통여부 평가후 퇴원여부 결정할 예정입니다. ,,901, 고양이 하부 요로 질환 FUS · FLUTD , 비뇨기과 질환 ,"배뇨장애(통증, 곤란), 빈뇨, 이소배뇨","배뇨장애(통증, 곤란), 빈뇨, 이소배뇨",345,2
Old English Sheepdog(올드 잉글리쉬 쉽도그),MN,건강검진,C_잠실ON,특이소견 치아 에나멜 결손 어릴적 걸렸던 홍역 원인으로 판단됨 우측 후지 고관절 이상소견 보행 이상여부 체크하시라고 설명드림 ,,,,,,,70,9
