품종,성별코드,주진단명코드,병원,SE,기타진단코드,기타증상코드,주진단명,질환,증상명,주증상명,len,label_id
Schnauzers( 슈나우져),F               ,2116,H, cc 오른쪽 뒷다리 딛지 못함 검사 위해서 내원 history day 부터 갑자기 오른쪽 뒷다리를 딛지 못하고 아파서 그런지 잘 일어나지 않음 산책 시에만 배뇨를 하는 아이라 산책을 못시켜줘서 그런지 day 부터 배뇨 관찰되지 않음 구토 설사 는 없었음 기력이 감소함 다리가 아파서 잘 움직이지 않아서 그런지 밥을 잘 먹지 않아 어제는 소고기를 구워서 주었더니 잘 먹었음 유선 종양 부위가 더 부은 것 같음 수술 여부는 모르겠지만 그래도 검사는 해봐야 할 것 같아서 왔음 environment indoor 동거견 연령 슈나우저 food 사료 간식 등 vaccination deworming 어렸을 때만 접종 사상충 매달 구충 systemic gen mental alret skin nrf nervous nrf eent nrf res nrf cv heart base murmur gi nrf ns rt.poplitear ln enlargement cm t r panting p.e. mm pink crt sec bp time hg cuff rt.fl rt. hindlimb lameness bw kg 체중 감소 dehydration 혈액검사 elevated alp increased crp 방사선 흉부 흉부 복배상에서 우측 후엽 원형 크기 lxw mm 의 폐결절 의심 좌측 전엽 타원형의 폐결절 의심 크기 lxw mm 폐전이 의심 복부 하복부 복측 복벽 복측으로 불균질한 연부조직 밀도의 피하종괴. 유선 종괴 요추 번 복측으로 타원형의 연부조직 밀도의 종괴. 요추하 림프절 비대 흉추 번 요추 번 사이 척추체 endplate 불균질한 골증식 퇴행성 변화 무릎관절 무릎관절 전후측상에서 우측 대퇴골 medial epi condyle 국소적으로 미약한 골밀도 감소. bone cyst metastasis 복부초음파 요추하 림프절 비대 metastasis 유선종괴 저에코성이며 분엽화 되어 여러 종괴 관찰됨. 악상 피하 종괴 의심 양측 부신 비대 뇨 검사 비중검사 하루 정도 소변 참은 것으로 생각됨 스틱검사 mild proteinuria 응고계 검사 nrf 유선 종양 악성 가능성 높음 의 전이 가능성 폐 rt. hindlimb 심장 ar 전이 여부 평가를 위해 ct 촬영 필요함을 설명하였으나 보호자 남편 분이 더 이상의 처치나 검사는 원치 않음 호스피스 관리 원하고 있어 내복약만 일주일치 처방함 보호자 아내 분이 남편가 상의 더 해보고 추후 일정 정하기로 함 ct or 약만 처방 comments 수술 여부를 결정하기 위해서는 ct 촬영이 반드시 필요함을 언급하였으며 전이가 확인되었을 경우 수술보다는 호스피스 관리가 더 나을 것이라고 말씀드림 전이가 되지 않았을 경우에는 수술 및 항암처치 등이 필요함을 언급하였음 tx cephalexin time kg bid po famotidine time kg bid po piroxicam time kg sid po 저녁약 ,,, 유선 종양 / 유방 종괴 , 생식기 질환 ,,,1438,8
Shih Tzu(시추),FS              ,2275,F_센트럴,c.c 교통사고 승용차가 밟고 지나감 쇼크 저혈압 ray 골반골절 좌측 고관절 탈구 chemistry 혈소판 감소 백혈구 감소 ,,"0,77", 사고 (교통 사고 포함) ,전신성의 질환,"기타 증상,골절",기타 증상,71,5
Turkishangora(터키쉬 앙고라),FS              ,2091,H,혈뇨 배뇨장애 소변흘리고다님 어제 아침에 배뇨 장애 확인 주말에는 정상 배뇨 확인 어제 퇴근 후 혈뇨 지속적으로 배뇨자세 취하려고 소화기 증상 확인 동거묘 마리 잘 지냈는데 month 전 막내 입양 막내가 좀 귀찮게 하는 경향 소변 보고 있을 떄도 괴롭히 year 전 쯤 명절에 탁묘 하셨음 다른 고양이들과 방사 스트레스 많이 받았었음 year 에 한번 정도 특발성 간질 의심 증상 확인 최근에는 없었음 tonic clonic paddling salivation 살 반 정도 이후 발작 증상 확인 청진 상 특이사항 없음 치석 심하지 않음 mm pink crt 혈액 검사 cbc nrf 복부 방사선 특이사항 없음 복부 초음파 심한 방광염 및 sludge 확인 p 요도 폐색의 가능성은 낮은 것으로 평가 심한 방광염 오후 소변 검사 예정 소변 검사상 단백뇨 및 방광염 확인 struvite 결정 확인 세균 의심되는 병변 확인됨 세균 배양 검사 의뢰 혈뇨 및 배뇨 장애 지속적으로 확인 필요 특이사항 없을 경우 day 오후 퇴원 예정 ,,, 방광염 , 비뇨기과 질환 ,,,520,4
Yorkshire Terrier(요크셔 테리어),M               ,2091,E_24시아이, 어제 오후부터 소변에 피가 보였음. 혈괴 중성화 안했음. month 전에 구토해서 병원 간적 있고 주사 맞고 좋아졌음. 식욕 좋고 설사 없음. x ray 초음파 결석은 보이지 않음. 소변직접도말검사 슬러지 많음. 요스틱 ph높음 마취 후 방광플러싱 실시 수컷중성화 졸레틸 timeinj ce 결석이 관찰되지는 않지만 추후 방광결석이 생길 가능성이 높습니다. 후처치 회 수납완료 내복약 month 분 보호자분 사료 사신다고 하면 유리너리 o로 ,,8, 방광염 , 비뇨기과 질환 ,혈뇨,혈뇨,248,4
Bichon Frish(비숑 프리제),MN              ,2133,H,어제저녁부터 후지마비 내츄럴 코어 연어 사료 먹임. 바우와우를 사료에 섞여서 먹였음. 배뇨곤란으로 방광염이 심하게 발생하여 출혈이 있음. 방광염 치료 해야함. deep pain 좌우 모두 있음. ct. 부토판 앰플 미다졸람 time 프로포폴 time 진통수액 케타민 time 요추 ivdd 수술실시 url 파열된부위 수술을 함께 함. ,,, 상기에 해당하지 않는 신경계 질환 , 신경 질환 ,,,187,6
A.Cocker Spaniel(아메리카 코커),F,2126,C_잠실ON,새벽 두시에 시골길에서 발견해서 집으로 데려옴 사료를 먹지않아서 설탕물 먹임 기운없이 늘어져있어서 내원 혈뇨 방광염소견. 내강에 슬러지 확인. status epilepticus 내원후 경부터 발작 시작. 집에서부터 전조증상 있었음. time 이상 멈추지않고 지속. tx dz time kg im 회 이후 propofol cri cepha sc tramadol iv 수액 d vitb vitc taurin 보호자 상담 용 . mri는 보류해놓은 상태. 정확한 진단이 나지 않은 상황에서 위험성을 안고 치료하고 있음 고지. 경기도에서 발견하여 데리고 오셨으며 법적 절차 문제로 해당 시 군청에 유기견 신고를 해 놓고 치료할것을 권해드렸으나 보호자분 원치 않으셔서 책임하에 치료 해달라고 말씀하심. 정오부터 propofol cri로 들어가고 있으며 속도 time hr 로 조절중. 중간중간 포폴 스톱하여 보았으나 증상 개선되지 않아 유지 중. 금일 밤 time 경 다시한번 항경련제 끊어볼 예정. tx. mpss time kg tid. mannitol kg sid cepha enro. time 경 통화 시도 하였으나 보호자분 통화 안됨. ,,16, 경련 발작 (원인 미정) , 신경 질환 ,발작,발작,579,0
K.C(Korean Cat),MN,2133,D_VIP,s 배뇨는 가능하나 배변은 힘듬. 정상배변 어제 소량 식욕부진 time 부터 다리가 불편하기 시작하여 어제는 매우 심해짐. 다리를 쭉 펴고 보행. 항생제 진통제 처치에도 반응 없이 더 악화됨. 차 접종만. 다 잘먹는 아이. bt positional reflex 반응없음 반사감소 정상 preprioception fr fl rr rl anus reflex 애매함. deep pain 촉진시 매우 아파함 사지 냉감 없음. 오히려 열감 양안 통증 있음. iop odos felv fiv neg. fcov pos. cbc mild leukocytosis chem nrf elect mild hyperkalemia saa normal range 방사선 nrf 복부초음파 full scan by joohee findings 복막염 소견 확인되나 복수는 확인되지 않음 혈관반응이 없는 hypoechoic foci가 비장 내에 산재되어 있음 양측 신장 에코 상승 확인되며 우측 신장의 아주 소량의 perirenal fluid 확인됨 불규칙한 방광벽 확인되나 벽 두께는 양호함 우측 요추하 림프절이 중증도 비대 확인됨 time . 이외에 미약한 복강 내 림프절 비대 imaging dx ddx peritontitis fip dry type systemic infection lymphoma lymphadenopathy nephritis perirenal fluid cystitis ddx. 신경계질환 뇌 척추 fip mri 검사 진행 안내드렸으나 일단 보류하고 치료먼저 진행해보기로. 신경증상 진행속도가 워낙 빨라 내복약 복용하면서도 발작 등의 더 진행된 신경증상 발생 가능성 있음. 너무 좋지 않을 경우 퇴원 또는 안락사 진행도 상담드림. fip 신경계질환에 준한 치료 pds 진행. saa 신경계검사 ,,23, 상기에 해당하지 않는 신경계 질환 , 신경 질환 ,"보행이상, 파행(전지, 후지)","보행이상, 파행(전지, 후지)",889,6
Maltese(말티즈),M,2181,B_W,변을 잘 못봐서 아버님께 혼났는데 채인것 같다고 하심 맞고 나서 time 정도 지나면서 계속 뒷다리에 힘이 없는 듯한 증상을 보임 체온 도 우후지 mono paresis proprioception 감소 lumbar lesion back pain 혈액검사 ck 증가 외에 특이소견없음 과거 ivdd 병력이 있던 환자로서 외상에 의한 ivdd 발생가능성이 높음 익일 mri 촬영 예정 mpss 고용량 요법 항산화제 fluid 진통 항생제 ,,4, 추간판 탈출증 ,근육 골격 질환 ,통증,통증,243,9
친칠라,MN,2095,C_잠실ON,cc month 전 부터 urinary incontinance. dribbling. 식욕저하. 활력저하. ,,9, 고양이 하부 요로 질환 FUS · FLUTD , 비뇨기과 질환 ,배뇨실금,배뇨실금,59,1
Maltese(말티즈),MN,2126,B_W,hx month time 전신 발작 증상으로 춘천 현대 동물병원 입원 항경련제 항생제 스테로이드성 소염제 등 투여하며 입원 치료하다가 month time 퇴원 퇴원 후 집에서 빙글빙글 돌고 머리를 벽에 부딪치는 행동 보여 항경련제 증량 month time 전신 발작 증상 재발하여 다시 춘천 현대 동물병원 입원 이후 발작 증상은 없었으나 잠을 많이 자고 목적 없이 앞으로 걸어가는 행동 보임 오른쪽 눈 안구건조증 및 각막미란 관련 안약 투여 어제 보호자가 본원으로 진료 문의 한만길 원장님 전화 상담 후 오늘 본원으로 이동 본원으로 이동 전 소리지르고 흥분하여 춘천 현대 동물병원에서 diazepam acepromazine 투여 후 이동 hct month time month time month time month time plt month time mcl month time mcl month time mcl month time mcl wbc month time mcl month time mcl month time mcl month time mcl bun month time month time month time month time month time crea month time month time month time month time month time ip month time month time month time alt month time month time month time month time ast month time month time month time month time month time alp month time month time month time month time month time pe mentation stupor hr bpm rr time pm bt sbp time hg severe dental tartar gingival recession bloodwork cbc anemia hct thrombocytopenia mcl leukocytosis mcl rpi non regenerative chemistry increased alt ast alp amyl lipa ip and ck decreased alb and ca normal ionized ca electrolytes mild hypernatremia and hypokalemia increased na ratio blood gas ph pco hco etc. crp reference range coagulation profile dimer reference range fibrinogen reference range aptt reference range pt reference range x ray vhs increased radiopacity of the lung fields radiopaque calculi in the left ureter urinary bladder and urethra echocardiography mitral valve degeneration mitral regurgitation mr pgmax time hg tricuspid regurgitation tr pgmax time hg mv epss time lv fs increased lvidd time lvids time la ao ratio pv pgmax time hg a ratio abdominal ultrasonography hyperechoic lesions in the splenic parenchyma hyperechoic round mass in the hepatic parenchyma echogenic bile in the gall bladder lumen hyperechoic material with acoustic shadowing in the left ureter hydroureteronephrosis due to the left ureterolith hyperechoic materials in the urinary bladder lumen length of the kidneys left time right time diameter of the adrenal glands left time right time ophthalmic exam stt time min od time min os fluorescein stain test positive ou 보호자 상의 후 마취 위험성 있으나 진단 위해 내일 mri 및 ct 촬영하기로 함 tx fluid therapy with nacl dextrose kcl time eq ornipural taurine vitamin vitamin fr time kg hr phenobarbital time kg bid iv slowly cefazolin time kg tid iv slowly cimetidine time kg tid iv slowly sodium hyaluronate eye drops h ou serum eye drops h ou tobramycin eye drops h ou acetylcysteine eye drops h ou ,"2092, 2137","4,16", 경련 발작 (원인 미정) , 신경 질환 ,"통증,발작",통증,2526,0
Poodles(푸들),MN,2274,B_W,새벽 time 에 진돗개에게 물림 급하게 응급처치만 받고 오심 항생제 처치는 받지 않으심 물고 흔드는 장면을 목격하심 ,,"4,15", 교상 (bite wound),전신성의 질환,"통증,출혈",통증,66,2
Shih Tzu(시추),FS              ,2133,F_센트럴, 사경 안구진탕 아침엔 별 이상없었는데 밤에 귀가하여 보니 증상발현 작년에 중성화 양측 외이도 만성염증 vestibule synd. 발생 원인 확인 위해 mri 촬영 권장 익일 오후 time 경 이안 mri 촬영 보호자 동반 예약 보호자분 mri 촬영 취소 증상이 완전히 해소되지 않을 수 있음을 고지 증상 호전 시까지 최소 month 소요 각막궤양 및 기저질환 발현의 가능성 고지 말초성으로 준하여 치료 시행키로 ,,"40,0", 상기에 해당하지 않는 신경계 질환 , 신경 질환 ,"신경증상(이상행동),기타 증상",신경증상(이상행동),232,6
Maltese(말티즈),MN              ,2031,F_센트럴,cc 바른 동물 병원에서 폐수종 refer year 전에 심장병 진단 받으셨으나 치료는 하지 않음. 금일 미용 하면서 상태 악화 되어 검사 실시 하였으며 폐수종 진단됨 심원성 폐수종에 준하여 치료 하였는데 경과 좋지 않아 refer. 방사선 검사 상 폐 종양 가능성 의심되며 심장 확장도 심함. 혈액 검사 상 염증 수치는 양호. 우선 심원성 폐수종에 준하여 치료 예정이며 예후 불량 가능성 높음 고지 드림. ,,2222, 폐수종 (원인 미정) , 호흡기 질환 ,폐부종,폐부종,228,10
Maltese(말티즈),FS,2275,B_W,집에서 부부싸움과정에서 집어던졌다고함 내원시 두경부에 혈액이 묻어있었으나직접적상처에 의한 출혈이 아니고 보호자의 혈액인듯함 처음내원시 약간 흥분 약간 공격적이었으나 좀뒤에는 얌전해짐 일단 입원치료하면서 지켜보기로함 방사선상과 외관상 신체검사시 특이소견은 관찰되지 않음. dimer만 상승. 전반적인 상태양호. 내일 오전에 dimer와 전해질 재검하고 퇴원 고려. ,,15, 사고 (교통 사고 포함) ,전신성의 질환,출혈,출혈,203,5
Miniature Schnauzer(미니어쳐 슈나우져),MN,2244,D_VIP, refer.서울종합 의뢰병원관련 진료전 전화완료 진료후 전화완료 금일 진단결과 안내드림. 원장님 요청사항 주호소 당뇨평가 체중감소 식욕부진 식욕은 있으나 먹지 못함. 구토 기력저하. pupd 현증경과 눈꼽이 자꾸 끼고 어제부터 구토 보임. 식욕은 있으나 구토 때문에 먹지를 못 함. month 간 안약 넣을 땐 눈꼽 안 끼나 중단하면 다시 눈꼽 낌. 그래서 month 전 재내원하였고 혈액검사 하고 주사 맞고 내복약 처방받음. 다음 날부터 구토 보이고 밥도 더 못 먹고 기력 매우 떨어짐. month 정도 기력 떨어짐. 잠만 많이 잠. pupd 심함. 물 매우 급하게 먹음. month 사이 체중이 조금씩 빠짐. 원래 kg 되던 아이. month 사이 급격히 체중감소 더 심함. 배변상태는 양호함. 관리 받는 질환은 없음. year 부터 키우심. 예방접종 어릴 때만 진행. hw 먹는 제제 간헐적으로 사육환경 indoor. alone. 사료 일반사료. 요근래 table food 많이 먹어서 편식 약간 하는 편. 신체검사 mental alert. hr rr bp bcs mmc pink crt 탈수평가 dehydration. delay skin turgor. no murmur no crackle. 혈액검사 cbc c hyperlipidemia 내원 시 혈당 전해질 fructosamine sdma 영상검사 방사선검사 imaging dx ddx hepatomegaly comment 간의 심한 종대 확인됨 복부초음파 full scan imaging dx ddx hepatic lipidosis secondary to diabetes peritoneal effusion peritonitis acute pancreatitis gastroenteritis comment 간의 전반적인 비대 및 에코 상승 환자의 연령을 고려할 때 당뇨 원발성 지방간의 가능성 높음 간 지방 사이의 미량의 복수 관찰됨 담낭 내 점액성 슬러지 관찰되며 담낭벽의 점액 축적은 미약하나 추후 점액종으로의 발전 가능성 있으므로 초음파검사로의 추적관찰 추천됨 췌장 우측엽의 에코 저하 및 비후 time 는 심하지 않으나 중상복부의 복막염이 중등도 이상으로 확인되며 복압 항진에 의해 췌장 좌측엽 관찰이 불가하므로 혈액검사 등으로의 췌장염 감별 필요 방광목 근위요도 위치의 소량의 고에코 슬러지 관찰됨 방광벽은 양호 위 및 소장의 운동성 저하 관찰됨 위내 다량의 액체 저류 췌장염 복막염에 의한 차적 염증성 변화의 가능성 있음 radiologist 이현아 dvm ms vip동물의료센터 영상의학과 과장 direct tel 내선 mail vip radiology vipah.co.kr 요검사 usg money ketone glu rbc 요침사 상 nrf dx ddx diabetic ketoacidosis protein losing nephropathy diabetic nephropathy susp. chronic kidney disease pancreatitis cholestasis dka 확인되어 입원 하 처치. pancratitis도 의심됨. 췌장염에 의한 형당뇨 가능성도 존재함. 향후 수치 및 증상 모니터링하며 지켜 볼 예정. dka의 경우 예후 불량할 수 있음을 고지함. rx 식이 d 소량 식이test tx 수액처치 plasma solution kcl time eq taurine ornipural vit vit fold. time hr 주사제 regular insuline iu kg im iu kg sc famotidine time kg bid iv metocloramide time kg bid iv maropitant time kg sid sc tramadol time kg bid iv metronidazole time kg bid iv 입원 하 당곡선 체크 예정. ,"췌장염, PLN","27,28,1,10", 당뇨병 ,내분비 질환 ,"체중 변화, 체중 증가, 체중 감소 ,기력저하,구토(급성/만성),다뇨/다발(다음)","체중 변화, 체중 증가, 체중 감소 ",1880,3
Shih Tzu(시추),MN              ,2133,F_센트럴, history 심장약 투약 중 최근 실신 혹은 경련 증상 반복 모견 경련 후 사망 소견 이후 선회 및 peddaling 증상으로 미루어 신경증상 의심됨 month 전부터 설사 혈액성 설사 오렌지 동물병원에서 심인성 폐부종으로 판단되어 이뇨 처방 계속 받고 있음 objective no pulmonic edema astasia recumbency stupor mental plr tactile severely elevated liver enz. hyperphosphatemia elevated renal enz. ce mortality rate 이상 dnr ,,"40,1601,33", 상기에 해당하지 않는 신경계 질환 , 신경 질환 ,"신경증상(이상행동),실신,떠는 증상, 경련 또는 미진",신경증상(이상행동),312,6
K.C(Korean Cat),MN              ,2095,D_VIP, money 결제완료 효정 폐쇄형 방광염으로 인해서 동사병원에서 요도개통이후 소변을 조금씩 보다가 다시 소변을 잘 못보는것 같다고 하셔서 본병원으로 내원주셨습니다 영상검사 심한 방광팽만 결석없음. 초음파상 슬러지는 그다지 많이 보이지않음 뇨검사 약간의 혈뇨 세균 크리스탈등은 보이지않음 혈액검사 신장수치 상승. 염증수치 상승 flutd중 fic로 확인됩니다. 완치가 아닌 관리의 질환이고 만약 증상이 반복해서 일어난다면 요도구 성형술이 필요할수 있습니다. 주사마취하 요도캐통 및 카테터 설치 입원치료 진행합니다. 매일 신장수치 평가 및 요도플러싱 진행 day 까지 입원후 개통여부 평가후 퇴원여부 결정할 예정입니다. ,,901, 고양이 하부 요로 질환 FUS · FLUTD , 비뇨기과 질환 ,"배뇨장애(통증, 곤란), 빈뇨, 이소배뇨","배뇨장애(통증, 곤란), 빈뇨, 이소배뇨",345,1
Dachshunds(닥스훈트 ),FS,2031,D_VIP,s 어제밤 산책하고난 후부터 호흡곤란 month 전부터 기침 가끔 함 aus no murmur crackle sound bt rr ray 전반적인 폐침윤 tx cefa furo iv 심질환과 폐질환 감별위해 추가적인 검사 필요하고 입원처치 필요하나 비용적인 부담과 살만큼 살았다고 생각하시기 때문에 더이상의 검사및 처치는 원치 않으시고 약만 좀 달라고 하심 ,,14, 폐수종 (원인 미정) , 호흡기 질환 ,호흡곤란,호흡곤란,200,10
Mixed(혼합),F               ,2091,D_VIP,기절 구토 외음부 삼출물 며칠 전 보호자분 몸살로 앓아누웠을 때 부터 계속 잠만 잠 이틀 전 새벽에는 놀다가 기절했음 의식 없었으며 외음부에서 노란 삼출물이 나왔음 전조증상 모호하며 금방 깨어나서 잘 다님 이후로 위액성 구토 회 있었으며 식욕 떨어져서 간식만 먹음 어제 정상변 본 이후 변은 없음 이물 가능성이 크지는 않으며 변 교육때문에 식초를 뿌려둔 적이 있었음 접종 예방 완료 alert vital sign 양호 mm pink dehydration no murmur crackles 혈액검사상 alkp 상승 두드러지며 crp 중등도로 높음 영상검사상 위벽의 두드러진 비후와 경미한 위확장 확인됨 간 실질 nrf 소장 nrf 복강 림프절 경미하게 종대됨 방광 내 다량의 슬러지 확인됨 질 도말검사상 다량의 염증세포 비각화상피 세균 확인됨 소변검사상 심한 세균성 방광염 확인됨 p 위염 세균성 방광염에 준해 내복약 처방합니다 위염 개선되지 않으면 조영검사 내시경검사 고려 세균성 방광염과 관련하여 항감수 의뢰중 방광염의 기본 치료기간은 month 이며 컨트롤 되지 않는다면 구조적 이상 확인 필요 기절 간수치상승 기절은 단회성의 이벤트이고 증상 모호해서 모니터 하기로 합니다. 간수치는 모니터 하되 개선되지 않으면 간기능검사 필요함 재발시에는 pss 배제 위한 ct 고려중 약 먹으면서 증상 개선 없다면 상위검사 및 입원관리를 위해 내원해주세요 재검 목 간수치 위벽비후 crp 리첵 의뢰병원 통화 완료 by 윤 ,"위염, 간수치상승","1601,1,24", 방광염 , 비뇨기과 질환 ,"실신,구토(급성/만성),삼출물, 분비물, 농루",실신,735,4
K.C(Korean Cat),FS              ,2091,D_VIP,루비 순해요 호비 발톱날카로움 진료시 문다고합니다 미냥 발톱날카로움 리온 순해요 예민해서 체중은 안쪽에서 체크해주세요 퇴실시간 오후 time 사이 time 이전까지 오셔야 하는것 안내드림 구강검사 치석은 그다지 많지는 않음 혈액검사 진행 ,,, 방광염 , 비뇨기과 질환 ,,,133,4
Mixed(혼합),MN,2244,C_잠실ON,s cc 몇개월 전 타병원에서 종합검진시 혈당수치가 높게 나옴 month 전 소변검사에서도 당이 검출됨. 집에서 처방식 사료로 먹이고 계심. 인슐린처치는 하지 않음. 최근 감기걸리는 등 컨디션 저하 식욕도 떨어짐. month 일정도 전 시작 현재 타병원에서 내복약 관리중. ,,, 당뇨병 ,내분비 질환 ,,,153,3
Mixed(혼합),FS,2116,D_VIP, money 결제하심 미리 특이사항 없음. chem nrf 전해질 nrf cbc nrf crp normal range cxr nrf 복강내 매스 음영 살짝 보임 초음파 자궁확장 방광벽비후 난소낭종 자궁은 현재점액종 상태로 보이며 축농증으로 발전 가능성 있습니다. 자궁적출술 진행하고 양측 전적출대신 좌측 편측 전적출로 진행하고 lumpectomy 진행 예정. sx 마취 불안정으로 자궁적출 및 편측전적출만 진행 우측 종양제거는 진행못함. 합병증 없으면 총 비용은 에 맞춰주기로함. 췌장염 혈전증 패혈증 등의 합병증 발생시 비용 추가 발생 안내드림. 주치의 부재로 김혜정선생님께 인계 안내드림. crp 혈압 모니터링. ,,221, 유선 종양 / 유방 종괴 , 생식기 질환 ,"종괴, 혹, 낭종","종괴, 혹, 낭종",345,8
Maltese(말티즈),F,2133,B_W,비명소리가 들려서 가보니까 대소변을 보고 쓰러져 있었음. 그상태에서 바둥거리고 있었음 이후에 약을 먹고나서 안정을 찾음 신부전관련한 약을 먹이고 계심 중성화수술을 하려고 검진과정에서 신부전이 확인됨 year 전에 급성췌장염 회 작년에 급성췌장염이 다시 재발하였음 중성화수술은 못시키심 plr 정상 원내에서 신경증상 관찰되지 않음 us end stage kideny gb sludge hydrocephalus upc bun crea pi 임상증상의 원인으로 intracranial disease가능성이 높음 익일 azotemia개선 여부에 따라 mri 촬영 예정 tx nac tathione ,"2087, 2121",, 상기에 해당하지 않는 신경계 질환 , 신경 질환 ,,,330,6
