품종,성별코드,주진단명코드,병원,SE,기타진단코드,기타증상코드,주진단명,질환,증상명,주증상명,len,label_id
A.Cocker Spaniel(아메리카 코커),M               ,2275,G_부천이지,일주일 전에 층에서 층으로 가다가 떨어진것 같음 층이 높다고 하심 머리쪽을 다침 빙빙돌고 앞이 안보이는것 같음 경련도 일으킴 다른 병원에선 눈엔 이상없다고 하심 병원 군데 갔는데 ct촬영하라고 한 곳도 있었고 mri 촬영하라고 한 곳도 있었다고 함. time time 으로 예약 잡으심 pe 좌측 눈 공막 출혈 ataxia 흉부 복부 두개부방사선 검사 심장 크기가 흉강대비 작아보이고 폐 혈관 얇아보여 저혈량 또는 탈수 고려됨. 복부방사선상 간 크기 정상. 두개부 dv상에서 양측 zygomatic bone fracture 관찰. 중앙에 십자가 형태로 관찰되는 저밀도 선은 어린 개에서 보일 수 있는 suture line으로 생각됨. 번 경추의 dens 음영은 정상적으로 관찰되나 정확한 평가 위해 ct 검사 추천. 복부초음파 검사 간내 문맥 혈관은 정상적으로 관찰됨. 복강내 소량의 복수 관찰. 그 외 특이소견 없음. 기본적인 검사에서 pss 의심 하지만 주는 뇌 신경계 질환 의심 내일 헬릭스에서 mri 촬영시 병변 발견되지 않을경우 ct 추가 촬영 권유 내일 헬릭스 time mri 촬영예정. ,2133,"40,1303,16", 사고 (교통 사고 포함) ,전신성의 질환,"신경증상(이상행동),운동실조,발작",신경증상(이상행동),559,5
Maltese(말티즈),FS              ,2031,F_센트럴,c.c 호흡 빠르며 청색증 증상 접종 이력 전혀 없음. 처음 내원 시 혈압 락테이트 로 확인 흉부 방사선 경미한 t.c 심 비대 경미한 폐수종 관찰 입원 하여 하루 안정화 후 심장 초음파 검사 추천 드렸으며 입원 위해서는 전염병 검사 키트 검사 필요 고지. 홍역 인플루엔자 항원 항체 보호자 분이 비용 부담 크셔서 입원 없이 약 처치만 원하심. 우선 응급 조치 위해 furosemide time kg iv 이후 약 급여 혈액 검사는 특이 소견 없음 약 급여 time 후 혈압으로 확인 되어 심장 초음파 검사 실시. la ao이상 이며 심근 보상능력이 떨어지는 단계로 판단 이뇨제 높게 처방 다음 내원 시 상태 확인 하여 tapering ce srr 체크 필요 현재 응급 상황 생길 수 있으므로 이상 행동 보이면 바로 내원 필요 고지. ,,"19,1401", 폐수종 (원인 미정) , 호흡기 질환 ,"청색증,빈호흡",청색증,411,10
K.C(Korean Cat),M,2274,B_W,s 내원 time 쯤 전 외출했다가 앞다리 교상 입은 상태로 귀가함 내원시 심한 출혈은 없는 상태 양측전지 심한 염증소견 발열 발적 부종 환자 예민하여 혈액검사 후 마취하여 처치 진행 cbc wbc 상승 적혈구 관련수치 mild한 상승 전해질 na chem glu tp glob 프로포폴로 마취 유도되지 않아 dz im 양측전지에 특히 교상 다발적으로 존재 몇군데는 근손상 확인 필요 피부박리된 부위 여러곳 있으며 다른부위는 피부층만 손상된 것으로 판단됨 턱의 교상이 특히 깊음 후두부 및 어깨 등쪽에는 발톱에 긁힌 양상의 상처 tx 주사마취 후 상반신 클리핑 세척 소독 밴디지 등의 긁힌 상처에 네오시덤 도포 주사 cepha ampi cime buto enro taurine 수액 h kcl taurine vit c 유지속도 아이스팩 처치 체온 모니터링 보호자님 내일 오전 time time 재내원하실 예정 외과 주치의님께서 교상부위 확인하시고 보호자님과 추후 치료방향 상의해주세요 ,,15, 교상 (bite wound),전신성의 질환,출혈,출혈,495,2
Maltese(말티즈),F               ,2116,F_센트럴,cc 유선종양 수술내원 pex 좌측 번 종양 번째 time 이내 우측 번 time 이내 개 tx 좌측 번 제거 우측 번 근처 mass 만제거 마취간 도블럭 아트로핀 iv이후 정상화 butorphanol amp propofol time ,x,221, 유선 종양 / 유방 종괴 , 생식기 질환 ,"종괴, 혹, 낭종","종괴, 혹, 낭종",131,8
Yorkshire Terrier(요크셔 테리어),M,2244,B_W,이주전부터 살이 빠지는 것을 느끼심 한달 전보다 최근에 먹는 사료와 물을 먹는 양이 늘어났음 사람먹는 음식도 주고 계심 pu pd가 있었음 오늘 오전에 검사를 받음 재채기가 있음 이전 증상 예전에 disk 증상이 있었음 올해 병원을 간 적이 없음 예방접종 심장사상충만 꾸준히 하고 있음. 다른 접종은 안한지 좀 되었음 month 에 한번정도 구토를 함 노란 위액 가끔 사료가 나옴 요즘 형태가 있고 끝은 물러짐 청진상 심잡음 bcs mmc pink 치아는 어금니만 남아있고 치석이 심함. 다른 치아들은 발치되어있음 뒷다리에 힘이 들어가는 것이 적음 fructosamine 흉복부 ray 복부 초음파 요검사 upc 당뇨 전신고혈압 만성신부전 기로 판단됨. sdma 결과에 따라 mvi tvi 폐성 고혈압 관리가 필요함 nhp sc 내일 어머니와 함께 내원하실 예정 혈당 곡선을 그리면서 치료를 할 계획을 생각하고 있음 한만길 원장님께 인수인계를 진행할 예정 ,2001,"27,10,39", 당뇨병 ,내분비 질환 ,"체중 변화, 체중 증가, 체중 감소 ,다뇨/다발(다음)","체중 변화, 체중 증가, 체중 감소 ",479,3
Maltese(말티즈),MN,2091,D_VIP,s 건강검진 혈액검사 alp 수치 정도로 약간 높은것 이외에는 특이소견없음 pcv . 미약한 빈혈 있음 복부초음파 full scan by hyuna findings 방광벽의 미약한 비후 time 외 nrf imaging dx ddx cystitis sdma 검사 의뢰함 신장질환 평가 month 뒤 검사결과 통보 ,,, 방광염 , 비뇨기과 질환 ,,,175,4
Pug(퍼그),MN,2244,B_W,기침은 감소하였음. month 전부터 pu pd 발생. 체중 감량. b.a.r. good app. 관절사료 먹이고 있음. 불포화지방산과 글루콘 투여 중. tx ns 유지 배. vitamin c kcl time time 부터 투여. 저녁 때 전해질 측정 후 유지속도로 전환. nebuli 벤토린 매시간 혈당 측정. regular insuline cri 오후 time 까지도 혈당이 이상이면 혈당 수치에 따라 수액속도 조절. 수액속도는 조절하지 않음. metronidazole time kg bid iv cefa cime tramadol bid iv taurine timesid iv 사료 diabetic건사료 하루 g. g씩 하루 회 급여 초음파상에서 양측 부신종대. 간내 종괴 관찰 췌장부위의 경미한 종대. 당뇨성 케톤증. 췌장염. 전해질 불균형만 관찰됨. ,"2082, 케톤증",10, 당뇨병 ,내분비 질환 ,다뇨/다발(다음),다뇨/다발(다음),424,3
Pomeranian(포메라이안),M               ,2048,G_부천이지, c.c 구토 및 설사 hpi month 전 month month 분양받으심 애견샵 분양 받고 month 째부터 month time 설사 month 째 month time 부터 구토 시작 방사선 전염병 검사에서 모두 음성 day 에 전염병 검사 금일 방사선 검사 정장제 먹이던 중 괜찮아지는 것 같았는데 다시 심한 구토 식욕은 계속 있으나 먹고나서 time 이내에 구토함 활력 점차 안 좋아지는 것 같음 설사 하던날 실온에 오래있었던 상한 물을 먹였는데 그게 맘에 걸린다고 하심 그 외 특별하게 먹은 것 없음 o. 원내에서도 수회 토출 방사선 위내 조영제 계속 내려가지 않음 그 외 nrf 초음파 장무력증 혈액검사 대사성산증 a. 토출 심한 장무력증의 원인 현재 알수 없으나 대증처치에 반응한다면 식중독 등의 가능성 있고 반응 없거나 추후에도 반복된다면 중증근무력증 등의 다른 질환 가능성도 생각해볼수 있음 금일 입원하여 대증처치 진행 오후관리사항 food 식사종류 양 식욕상태 급식방법 urine feces etc tx ampicillin cc i.v metronidazole cc i.v metoclopramide cc i.v famotidine cc i.v cerenia time kg sc ,,"1,2", 세균성 장염 , 소화기 질환 ,"구토(급성/만성),설사(급성 소장성/급성 대장성/만성 소장성/만성 대장성)",구토(급성/만성),614,7
spitz(스피츠),MN,2244,D_VIP, refer.대형ah 의뢰병원관련 진료전 전화완료 진료후 전화완료 카톡드림 초진일 전화 안됨 원장님 요청사항 주호소 당 뇨 현증경과 어제 지역병원에서 예방접종차 내원하셔서 혈당이 높은걸 확인하심 pu pd 원래 식탐이 많은편 살이 쪘음 어제 kg 요즘들어 더 헥헥거린다고 느껴지심 뇨는 노란편으로 기억하심. month 음수량 내외. 근래들어 늘어난거같다고 하심 이틀전 구토 음식먹은것 물마시는거 이외에는 달라진걸 못느끼심 예방접종 all done 사상충 예방약 사육환경 실내 동거견 없음 사료 anf 홀리스틱 성견사료 신체검사 mental alert hr rr bp bcs mmc pink crt sec 탈수평가 dehydration 혈액검사 공복혈당 전날 fructosamine acth pre 이상 post 이상 전해질 정상 뇨검사 당 케톤 영상검사 미진행 dx ddx 당뇨 쿠싱 쿠싱을 동반한 당뇨병으로 생각됩니다. 프럭토사민이 정상수치며 임상증상에서 두 질환의 공통적인 부분이 많지만 현재 달콩이의 외형상 쿠싱의 gross를 보이지는 않는 상태입니다. 우선적으로 당뇨에 대한 치료를 진행하면서 쿠싱에 대한 recheck을 진행할 예정입니다. rx 식이 d can d 건사료 내복약 없음 tx 수액처치 하트만 유지 fold 주사제 cerenia time kg sc sid 혈당곡선 작성후 익일 퇴원예정 ,,"10,65", 당뇨병 ,내분비 질환 ,"다뇨/다발(다음),식탐",다뇨/다발(다음),676,3
Maltese(말티즈),F               ,2133,G_부천이지,s 어제 번 발작 오늘 발작 회 안절부절 못하는 전조 증상 지속지속 time 정도 혈액검사 상 두드러진 이상 소견은 확인되지 않음 creatinine 수치 높게 확인됨 영상검사 상 실질장기 특이소견 없으며 천문을 통해 뇌실질 확인 시 뇌실의 미약한 확장소견 있음 지속발작증 대사적 문제는 배제된 상태로 뇌질환 혹은 특발성 간질 가능성 남아있음 초음파로 뇌실 확장 가능성이 확인되나 정확한 진단은 mri를 통해 확인하셔야 함 mri 촬영 권유드림 빠른 진단이 아이에게 좋으므로 원내 입원 후 내일 촬영하시길 권유드림 보호자분 직접 가시길 원하셔서 day 오후 time 로 예약해드림 일부 신장수치가 높게 확인되니 mri 마취 전 충분한 수분공급 및 수액처치 필요합니다. day 수액처치 위해 본원 내원해주세요 rx zonisamide time kg bid po 오늘 주사처치하였으므로 내복약은 내일부터 먹이시라고 말씀드림 day mri 예약함 이안동물영상센터 time 보호자분 직접 가실 예정 e 주사 처치 이후 아이가 가라앉아있을 수 있음 이후 재발작 시 본원에 응급내원하셔서 입원치료 받으세요 ,2087,16, 상기에 해당하지 않는 신경계 질환 , 신경 질환 ,발작,발작,557,6
Pomeranian(포메라이안),M               ,2031,F_센트럴,c.c 호흡곤란 유연 경련 구강점막 창백 호흡곤란 유연 밤 time 에 목욕하고 나서 증상악화 낮부터 기력없고 식욕저하 분양이후 간헐적 기침은 지속됨 분양받은지 month 차는 분양전 분양후 차접종 실시 cdv test negative 경련으로 인해 diazepam time kg 사용직후 호흡정지. 폐출혈 폐부종 으로 인한 혈액성 누출액 제거 응급조치 후 의식 자발호흡 회복 이후 심인성 폐부종에 준해 입원처치 저산소증에 의해서 경련증상 보였을 가능성 높음 ,,"14,31,33", 폐수종 (원인 미정) , 호흡기 질환 ,"호흡곤란,유연,떠는 증상, 경련 또는 미진",호흡곤란,257,10
Chihuahua(치와와),F               ,2126,D_VIP, money 결제 승희 응급동의서 작성완료 cc cluster seizure 경련 약 먹고 있으며 한동안 경련 증상은 없었음. year 전부터 경련증상 보였음 year 령일 때부터 시작. . month 전 하루 내 회 정도 cluster seizure 보인 적 있음. 그 병원에서 bid로 약 늘리라고 해서 그렇게 먹이니 괜찮아졌었음. 보통은 time 지속되었음. 오늘 아침 경련 증상 보였고 또 약을 bid로 먹였으나 이후에도 circling 보이면서 회복이 되지 않았음. 이후에 회 연달아 seizure 증상 보였음. time 이상씩 유지되며 반복되었음. mri는 찍은 적이 없음. 간질약만 복용 중. 북악동물병원 진료중. 남자원장님. a 내원 당시 cluster seizure. 심한 유연. 청색증 보인 상태. 연구개노장으로 인한 유연 및 청색증 보여 기관삽관 실시하였고 dexa 투약 하였음. 도로 내원하였으나 입원 관리 중 도로 저하되어 가온 후 정상체온으로 회복. 내원 시 phenobarbital time kg iv diazepam time kg iv mannitol kg hr iv 실시하였고 이후에도 경련증상 보여 diazepam 동일용량 회 time kg iv 추가 투약 이후에도 호전 없어 propofol time kg min cri 실시. 입원하여 경련 모니터링 실시. 보호자 문진 시 경련에 의한 brain damage 너무 심할 경우 회복 불가능함. 우선 경련이 더이상 일어나지 않을 때까지 재울 예정임. 현재 상황을 봤을 때 심각한 뇌손상으로 인해 입원 중에 사망할 수 있음을 고지하였음. ,,, 경련 발작 (원인 미정) , 신경 질환 ,,,793,0
Shih Tzu(시추),FS              ,2116,G_부천이지,s. 계속 변비 증상이 있음 최근 month 맛있는 것은 잘 먹으나 사료에 대한 식욕 별로였음 o. 혈압 혈액검사 alp 약간 증가 방사선 nsf 초음파 비장 머리 위치에 약 time 크기의 혼합에코성 결절 개 관찰. 방광 슬러지. 양측 신장 피질 에코의 심한 상승 및 피질수질경계 불명확하며 좌측 신장의 큰 cyst 나타나 만성신장질환 의심. ct 초음파상 확인된 비장 결절은 ct 검사에서 저밀도로 나타나 전형적인 양성결절의 조영증강은 아니나 크기가 너무 작아 recheck 필요. 흉부 및 복부 림프절 폐로의 전이소견 없음. 유선종괴는 주변 유선조직과 경계가 불명확하게 관찰되며 번째 유선보다 더 후방까지 넓게 보임. a. 유선종양 fna 검사상 악성 전이 의심되는 부위 없음 금일 전적출 진행 비장종양 금일 비장 적출 수술명 유선종양 전적출 ohe 비장적출술 스켈링 안검 mass 제거 좌측 하안검 피부에 약 time 정도의 양성종괴로 보이는 mass 제거함 술전검사 결과 특이사항 상위기술 수술전 처치 항생제 세파 진통제 트라마돌 fluid sd 마취종류 호흡마취 isoflurane 기타 만원 비장 유선전적출 중성화 money 스켈링 money 오후관리사항 food 식사종류 양 수술 후 금식 식욕상태 급식방법 urine feces etc tx ,2233,"221,4203", 유선 종양 / 유방 종괴 , 생식기 질환 ,"종괴, 혹, 낭종,변비","종괴, 혹, 낭종",647,8
K.C(Korean Cat),,2275,G_부천이지,평상시 밥 주는 길냥이 금일 오전 사고가 있었던 것 같음 어제까진 멀쩡했다고 함 o. 환자 recumbency 상태로 내원 점막 매우 창백 crt 심한 탈수 상태 회음부 및 항문주변 연부조직 부종 심함 방사선 좌측 대퇴골 사골절 경비골 생목골절 혈액검사 severe azotemia wbc 측정불가 severe 대사성산증 저나트륨혈증 fpv kit neg. 초음파 양측신장 음영 증가 및 신우 확장 좌측이 훨씬 안 좋음 방광내 출혈 a. 좌측 후지 골절 대퇴 경비골 신부전 traumatic failure 의심됨 대사성산증 전해질 불균형 보호자상담 환자는 정형외과 교정이 우선이 아니라 현재 신부전에 의해 사망가능성 높은 상태로 그 부분 먼저 해결되어야 정형외과 교정 가능함 설명 ,2090,"51,77", 사고 (교통 사고 포함) ,전신성의 질환,"의식불명,골절",의식불명,381,5
Dachshunds(닥스훈트 ),F               ,2274,H,s 산책하다가 진돗개한테 물림 황하동물병원 다녀오심 청진 양호 bcs 교상 둔부 군데 좌측 옆구리 군데 피하기종 및 일부 근육손상 의심 혈액검사 특이소견 없음 교상 month 염증관리 후 수술적 교정 필요안내함 가해자 진도개 견주 분들이 비용 부담 예정 ,,, 교상 (bite wound),전신성의 질환,,,142,2
Mixed(혼합),FS,2116,B_W,s 밤에 갑자기 유연증상 심하고 소리를 지르며 호흡이 가빠져서 내원 주간 내원시 호스피스 권유받고 귀가 그동안 인의용 소염제를 씩 bid 로 month 정도 먹이셨다 함 내원시 기립불능 bp cbc wbc 상승 rbc 관련수치 모두 감소 전해질 na cl 상승 ph hco 종 alp bun alb glob tx 패혈증 가능성 및 수혈 필요할 가능성 설명함 산소처치 주사 cepha ampi cime taurine ornipural buto metro hco cri 수액 h 유지속도 오전에 혈액 재검 재검이나 추가검사는 최소한으로 하기 원하심 monitor mental sl sl warming spo bp bg ,2087,4, 유선 종양 / 유방 종괴 , 생식기 질환 ,통증,통증,344,8
Chihuahua(치와와),FS              ,2116,F_센트럴,cc 유선종양 내원 obj lympe node 액와 서혜 오금 정상 방사선 stunum sudlumbar ln 정상 초음파 비장mass time time tx 우측 반적출 ohe spleen fna 양성 결절 ketamine time 노스판 패치 time butorphanol amp propofol time ,,221, 유선 종양 / 유방 종괴 , 생식기 질환 ,"종괴, 혹, 낭종","종괴, 혹, 낭종",173,8
Mixed(혼합),MN,2244,D_VIP,s 인슐린 감량 후에도 체중이 많이 증가 총 iu 기침이 최근 증가 인형을 물고 뜯는 것을 좋아함 산책은 거의 못함 심장이 걱정되어 호손 베리는 이 전부터 먹임 최근 회 정도 구토 방사선검사 finding ddx vhs bronchitis with tracheobronchial mineralization broncho intersitial pattern ivdd t lt sided heart disease mild bulging og la auricle on the vd view comment ivdd 의심 병변은 현재 해당 부위를 집중한 사진이 아니므로 과대평가 되었을 수 있음. 추후 증상이 있다면 해당 부위 집중 사진 필요할 수 있음. 저등도 la bulge 가 확인되나 심장 수축기에 따라 달리 보일 수 있어 murmur 청취를 통한 위양성 감별 필요. 폐야의 간질 패턴은 저등도 비만 체형에 의해 과대평가 되었을 수 있음. 복부초음파 finding ddx gb sludge vacuolohepatopathy ckd lt adg time rt adg time chronic pancreatitis pancreatic lipomatosis steatosis splenic myelolipoma hermatoma nodular hyperplasia lymphoid follicular hyperplasia chronic jejunal lymphadenopathy comment 당뇨가 이미 진단된 환자로 만성 췌장염의 병변과 당뇨가 연관되었을 가능성 높음. 해당 췌장의 변성은 추후 epi를 추가로 유발할 수 있음. 현재 장내 특이 초음파 소견이 없는 공장림프절의 변성은 이전 장질환에 의해 손상받은 후의 fibrosis 와 fatty degeneration 가능성이 높고 당뇨에 의한 지방 침윤이 발생했을 가능성도 있음. radiologist 윤학영 dvm phd 검사결과 총체적인 근육량감소 다수의 관절이 이 전보다 관리 필요한 상태로 보임 당화단백은 양호하나 이 전에 비해 평균적인 혈당 요당도 상승하 에피오틱 금기 ,"만성신부전, 췌장염",66, 당뇨병 ,내분비 질환 ,,,1025,3
Shih Tzu(시추),F               ,2133,G_부천이지,오후 time 경에 집에서 발견 몸을 가누지 못하고 바둥거리면서 몸이 뒤틀리는듯 의식 없는것 같음 지속 발작 month 전에도 뒷다리가 강직 상태로 발작 의식상태 모름 흉 복부방사선 결과 thorax 심장 및 폐 실질에서는 특이소견 없음 abdomen 위내 공기가 많이 차서 확장되어 호흡 문제 있는 것으로 보임. 좌측 신장은 번째 요추 길이의 배 우측은 배로 정상범위 의 lower margin. 양측 신장 결석. 간의 변연이 약간 둥글게 관찰되어 경미한 간비대. 복부초음파 결과 담낭 많이 확장되어보이며 간 실질 또한 미약하게 에코 증가. 좌측 신장의 caudal pole쪽 변연이 움푹 패여 울퉁불퉁하게 관찰. 만성신장질환으로 capsule의 fibrosis 가능성 있음. 양측 신장 모두 피질 에코 약간 상승되어보이며 medullary rim sign과 결석 음영 관찰되며 신우 확장은 없음. 방광벽 두께 약 time 로 약간 두꺼워보이며 점막면이 울퉁불퉁하여 방광염 가능성 있음. sludge 많은 편. 좌측 부신은 time 우측 부신은 time 로 양측 모두 비대 뚜렷하게 관찰되어 쿠싱 가능성 있음. 췌장 실질에서는 특이소견 없음. 심장초음파 결과 echocardiography 좌심실 내강 확장 없이 좌심실 벽두께 증가가 관찰되어 concentric hypertrophy. 이완기시 좌심실 벽 두께는 cm까지 다양하게 두께가 증가되었으며 특히 대동맥으로 나가는 위치에서의 basal septum 벽두께 cm 증가가 두드러짐. reference 이완기시 중격 벽 두께 time 까지 외측 벽 두께 time 까지 mode fs값이 이상으로 많이 증가. doppler mode mr tr pr ar 관찰되지 않음. 환자 호흡 불안정으로 정확한 평가 어려움. a a 역전 관찰되어 이완기 장애 있음. e 값이이상으로 좌심방내 압력 증가 약간 있는 상태. conclusion 좌심실의 concentric hypertrophy 특히 basal septum의 두께 증가와 fs값 증가는 전신고혈압과 관련있을 것으로 보이며 이로 인한 변화로 이완기 장애 가능성 있음. 상담 부신에 대한 검사 권유 금일 검사상 발작의 원인 파악 안됨 mri 촬영 권유 내일 오후 time 에 이안 의뢰 처치 수액 처치 산소 공급 내복약 투약 암로디핀 time kg 파모티딘 time kg bid po 저녁 time 경 발작 줄어듬 정신 상태 양호 보행 가능 저녁 time time 혈압 ,"2088, 2081, 2286",16, 상기에 해당하지 않는 신경계 질환 , 신경 질환 ,발작,발작,1214,6
