품종,성별코드,주진단명코드,병원,SE,기타진단코드,기타증상코드,주진단명,질환,증상명,주증상명,len,diags_small_id
Pomeranian(포메라이안),FS,2185,A_라라,마이크로칩 개 있음 하나는 대만에서 가지고 온 것이고 나머지 하나는 타 병원에서 진행함 보호자님이 알고 계심 보호자님의 요청사항 이전 중성화 수술시 무호흡 초 있었고 마취 안정성이 걱정 되므로 주의 요망함. 예민하므로 다른 강아지들과 접촉 하지 않도록 주의 양측 슬개골 탈구 교정술 경골 회전 방지 필요하면 추가 필요 발생 진통제 추가 비용 발생 슬개골 탈구 내일 오전 time time 내원하여 수액 처치. 수술은 time 이후 ,,4,,,통증,통증,241,7
Maltese(말티즈),FS              ,건강검진,D_VIP,건강검진차 내원 특이사항없습니다. 매년 회 검진하신다고 예정일 설정함. 내년에는 money 짜리 검진 하기로 하심. 이제 노령으로 가는 나이라서 건강신경쓰기로 하셨기에 액티베이트 처방해드립니다. 꾸준히 먹여주세요. 다음달 사상충은 프로하트 year 짜리로 하시기로 했습니다. ,,,,,,,154,9
Yorkshire Terrier(요크셔 테리어),MN              ,2092,H,s year 전에 방광 결석 진단 받으심 혈뇨를 찔끔찔끔 보인다고 함 안검종괴 year 전부터 있었다고 함 건강검진 같이 실시할 예정 우측 하안검 내측 종괴 안검선염 의심 방광 결석 time 개 혈뇨 확인됨 초음파 담즙 정체 간에코 감소 췌장에코 증가 좌측 신장 결석 비장결절 개 방광벽 폴립종의심됨 혈검 콜레스테롤 증가 azotemia alp 증가 안검선염 방광 결석 안검선염 month 항생체 반응 보기로 함 맥시트롤 month 회 점안안내함 month 뒤 재검 day 건강검진결과 안내하며 내원상담 받으시기로 함 ,,, 방광 결석 , 비뇨기과 질환 ,,,290,1
Chihuahua(치와와),MN,2275,D_VIP, money 선결제 하셨습니다. 송이 오늘 당일 산책 중 낙상. 낙상 후 강직성 발작증상 관찰됨. 강직성 발작 stupor 상태로 내원 bt hr min panting lactate cbc thrombocytosis blood gas mild acidosis deep pain normal plr abnormal normal appropriate gait 일시적인 증상일 수도 있고 오늘 사고가 종특이성으로 기존에 내재되어 있던 뇌질환의 boosting이었을 수도 있고 오늘 사고로 인하여 뇌손상이 지속될 수도 있음 안내드림. tx. mannitol kg cri p. 내일상태 양호하면 퇴원. ,,16, 사고 (교통 사고 포함) ,전신성의 질환,발작,발작,332,8
Russian Blue Cat(러시안 블루 고양이),MN,2095,B_W,s month 쯤 전부터 생식기부위를 핥는 모습 관찰됨 오늘 한시간 이상 화장실 왔다갔따하나 소변 보지 못하고 한두방울씩 간신히 나옴 혈액은 섞여있지 않음 식욕 및 기력은 양호 물도 잘마심 배를 만지면 아파함 bp 매우매우 사나운 관계로 dz 마취 후 검사 및 처치 진행 혈검상 특이사항 없음 방사선상 방광팽만 뚜렷한 결석소견은 관찰되지 않음 초음파상 방광내 슬러지 다량 tx dz 마취한 상태로 톰캣카테터 장착 중간에 깨서 프로포폴 time추가투여 카테터는 쉽게 장착됨 진한 뇨 플러싱 회 뿌연 슬러지 다량 수액 ns 유지속도 주사 cepha cime tra am 매우 사나우니 포폴마취 후 처치 및 검사 진행해주세요 보호자님께 고지된 상태 내일 오전 보호자님께 전화주셔서 초음파 등 추가검사 및 퇴원시기 여부 상담해주세요 ,,"4,901", 고양이 하부 요로 질환 FUS · FLUTD , 비뇨기과 질환 ,"통증,배뇨장애(통증, 곤란), 빈뇨, 이소배뇨",통증,406,2
Poodles(푸들),MN              ,2133,G_부천이지, month 전부터 낑낑거림 어제부터 빙글빙글 돌고 부딪힘 month 전부터 밤에 낑낑거리면서 울음 목적없이 왔다갔다 하는것 같음 특별한 원인 없다고 함 추가 접종 사상충 예방 안됨 pe mental 흥분 상태 plr 반응 있지만 미약 menace test 흥분 상태로 재검 필요 지속적으로 흥분 흉 복부방사선 결과 thorax 외측상에서 caudodorsal lung의 흉추 가까이 cm 직경 결절 개 cvc와 겹치는 수준에 cm time 직경 결절 개 관찰됨. 복배상에서는 좌측 후엽에서만 개 명확히 확인. 그 외 심장 및 전종격동에서는 특이소견 없음. abdomen 흉추 번째 intervertebral disc space 좁아보이는 것 이외 n.s.f 복부초음파 결과 간 실질에서는 특이소견 없음. 비장 몸통위치에서 약 cm 직경의 종괴가 관찰되며 내부에 혈관화 없는 저에코성 cavity 포함하고 있어 출혈 또는 괴사소 의심. 좌측 신장 내측으로 유래를 알 수 없는 크기 약 cm 타원형 종괴 확인. 종괴는 불균질한 실질로 다수의 혈관이 종괴의 한 곳으로 들어가는 양상으로 관찰되어 고환 가능성 있음. 좌측 부신 정상적으로 확인됨. 그 외 복강 장기 및 림프절 이상 소견 없음. 상담 폐 결절과 비장 유래를 알수 없는 복강내 mass는 아미의 증상과 연관성은 떨어지는 것으로 보임 mri 촬영 권유 이후 결과에 따라 치료 권유 폐 복강내 mass는 신경증상 유무에 따라 추가 검사와 수술 권유 집에서 상의후에 내원 하신다고 함 신경 안정제 처방 내복약 페노바비탈 time kg bid ,"2039, 2233",40, 상기에 해당하지 않는 신경계 질환 , 신경 질환 ,신경증상(이상행동),신경증상(이상행동),780,5
Pomeranian(포메라이안),MN,2092,B_W, month 전에 혈뇨를 처음으로 관찰됨. 괜찮다가 한달 지나 다시 나옴. 산책중에 많은 마킹증상 으로 혈액이 보임. 방사선 검사 요도결석 방광결석 확인 초음파 방광 cranial쪽으로 심한 비후 소견 만성 방광자극 염증 방광 종양 수술 음경의 우측으로 접근 결석 총 개 빠짐. 방광점막의 비후 육안으로도 확인 용종식 샘플링하고 조직검사 의뢰함. 요도카테터 장착함. ,,8, 방광 결석 , 비뇨기과 질환 ,혈뇨,혈뇨,205,1
Maltese(말티즈),M               ,2275,G_부천이지,인천에서 분양받음. 댁은 경기도 광주. 침대에서 떨어졌는데 골절. 밴디지해주신 병원은 광주소재 병원. month 전 낙상 사고 인근 병원에서 수술권유 받았으나 붕대만 하고 퇴원 붕대에서 삼출물이 나와서 병원가봤더니 다리 잘라야 한다고 들으셨음 세우리 원장님이 본원 추천해주셔서 내원하셨음 o. pe 우측 발끝에 피부 괴사 소견 방사선 우측 슬관절 변성 우측 발목 아탈구 골융해소견 다수 관찰 혈액검사 crp hct a. 우측 슬관절 유합부전 우측 발목 아탈구 피부 괴사 tx. ampicillin time kg iv cefotaxime time kg iv tramadol time kg iv famotidine time kg iv p. 수술하더라도 예후가 안좋을 가능성이 높으며 절단술을 꼭 고려해야 함 재골절 유합부전 패혈증 등 가능성 말씀드림 ,,77, 사고 (교통 사고 포함) ,전신성의 질환,골절,골절,418,8
Pomeranian(포메라이안),FS              ,2048,G_부천이지,s 딸기 블루베리 토마토 그제저녁부터 혈액성 설사 분변검사 상 유해균 증식 확인 흉부방사선 외측상에서 time 방향 bulging으로 폐동맥 또는 대동맥 확장 의심되며 전엽으로 향하는 폐정맥 직경은 번째 늑골 근위 지점 두께와 비교시 약간 확장. 심장초음파 검사 주폐동맥에서 turbulent flow 관찰되며 cw 검사시 continuous wave 나타남. 정확한 속도 평가는 이루어지지 못하였으나 pda 의심. right parasternal long axis view에서 심실 중격이 약간 우심실 방향으로 휘어져 좌심실 비대 있는 것으로 보임. 세균성장염 tx ampicillin time kg bid iv metronidazole time kg bid iv famotidine time kg bid iv 입원 후 경과에 따라 ct촬영 후 수술 e 마취 중 위험성 있음 ,2007,42, 세균성 장염 , 소화기 질환 ,혈변,혈변,435,0
Shih Tzu(시추),FS,2126,D_VIP, money 선결제 다올 time 전쯤 갑자기 두번 짖더니 옆으로 꼬꾸러짐. 배뇨하면서 눈에 초점이 없어짐. 초 정도로 매우 짧았고 이후 의식은 회복되었으나 의식 몽롱한 상태. 이후 내원함. 번째 보이는 증상. 가까운 병원에서 심장이 안 좋아서 그럴 수 있다고 얘기들음. 한달 전 에는 경련 발작 보이다가 강직성 발작. 이후 금방 풀렸고 거친 호흡. 피부 때문에 스테로이드 먹이고 있고 검사 상 오류 발생할 수 있으니 끊자고 하여 현재는 중단한 상태. 요즘 기력 저하 배뇨를 이불에 많이 함. 누워서 쌈. pupd 식욕부진 운동불내성은 이전부터 보임. 심장사상충 예방 하지 않음. p 내원 시 mental 혼미한 상태에서 내원. lateral recumbency 노력성 호흡. 약간의 유연증상. 청진 시 우측 후엽의 crackle. murmur respiratory arrhythmia bp mmc pink crt dehydration femoral pulse normokinetics a cbc wbc pcv c glu electrolytes 호흡성 산증 dimer lactate chw ag negative ray 흉부 vhs tracheal dorsal elevation 좌심방의 bulsing 우심실 종대. 우측 폐 후엽의 침윤. 복부 상복부의 serosal detail 감소. 디스크 사이 공간 좁음. 심장초음파 kg by hyuna findings mr severe mv remodeling severe tr time tv remodeling severe pr time 이완기능 저하 stage a ratio edvi ref. 수축기능 양호 esvi ref. la 압력 증가 severe peak time e la ao ratio lvd ao ratio mpa ao ratio ddx degenerative bivalvular disease pulmonary arterial hypertension comment la의 확장이 우심쪽으로 심하게 관찰되어 la ao ratio는 실제 확장에 비해 작게 측정되었습니다. 강직 본 증상의 경우 신경증상 가능성 높을 것으로 판단되나 심원성 발작도 함께 고려되는 상태. 우선 심장관리 후 증상 모니터링하기로 함. 이후에도 유사한 증상 발생하고 신경증상으로 더 높게 판단 시 mri 촬영 고려 예정. 비강으로의 호흡기 폐색도 의심됨. 내일 호흡양상 양호하면 네뷸라이저 치료도 고려 예정. 현재 고혈당과 경미한 빈혈도 확인되는 바 복강평가도 필요함. 호흡양상 양호할 시 복부초음파와 요검사 진행 예정. 전반적인 상태 불량함. 호르몬 질환 감별도 필요할 수 있음. 고혈당 보일 때 요 딥스틱에도 요당 확인되었음. 저녁에 다시 배뇨 시엔 요당 나오지 않음. 경련에 의한 일시적 당뇨이었을 가능성 높을 것으로 생각됨. 내일 증상 혈압 모니터링. 상태 양호 시 복부초음파 요검사 진행 예정. 상태 불량하여 하루 더 입원한다고 해주세요 ,,16, 경련 발작 (원인 미정) , 신경 질환 ,발작,발작,1442,4
Shih Tzu(시추),FS              ,2133,F_센트럴,cc 금일 오전부터 사경 운동실조 pex 안구진탕 사경 운동실조 ce mri검진 권유하였으나 보호자 사정상 대증치료 ,,"40,1303,0", 상기에 해당하지 않는 신경계 질환 , 신경 질환 ,"신경증상(이상행동),운동실조,기타 증상",신경증상(이상행동),65,5
Yorkshire Terrier(요크셔 테리어),FS              ,2133,E_24시아이, 강아지가 누워서 못 일어 남 방금 전에 발견함 주물러 줬음 vac none hw none 식욕 활기 백신 사상충 a blood work 문제 없음 seizure로 의심됨 mri 안내함 한달에 번 이상 발작 하는지 보호자 지켜 봄 추가 적인 약 처방은 없으며 경과 관찰 . ,2133,1303, 상기에 해당하지 않는 신경계 질환 , 신경 질환 ,운동실조,운동실조,153,5
Mixed(혼합),F,2126,D_VIP, money 결제 효정 오늘 낮에 한번 발작했다가 바로 깨어남 오늘 오후 time time 부터 계속 발작 상태 근처 동네병원 데려갔다가 본원으로 데려오심 오른쪽 눈은 원래부터 안보인다고 하십니다. 오늘 오후 time 경 처음 발작 보임 time 정도 후 멈춤 어제까지 식욕 활력 배변 배뇨 양호하였음 발작 이후 시력 청력 많이 떨어지는 듯 했으나 이후 조금 회복 양상 스스로 돌아다니기도 함 저녁 time 쯤 발작 다시 시작되면서 한시간 가량 발작 지속 신체검사 bt 안정화 후 hr bpm rr min bp time hg time hg hdo 안검반사 확인 plr 돌아옴 혈액검사 cbc hct c hyperglo 전해질 hyperk lactate crp tx. diazepam kg 기준 time kg 응급투약 time kg iv pm fluid therapy plasma sol 유지 mannitol kg iv qid rx. phenobarbital time kg bid kbr loading time kg qid fordays ddx intracranial dz. 뇌내성 질환 가능성 높은 상태로 의식 회복됨에 따라 mri 촬영 권장 뇌외성 완전 배제 위해 추가 영상 검사 또한 필요 추가적인 발작 가능성 또한 존재 비용부담 있으신 편으로 우선 month 정도는 입원하며 상태모니터링 하는데까지는 동의 입원치료 내일 의식 회복 안될시 요카 콧줄 장착 고려 김수정 과장님께 인계 ,Pancreatitis,16, 경련 발작 (원인 미정) , 신경 질환 ,발작,발작,720,4
Maltese(말티즈),FS,2170,D_VIP,s 스켈링 enamel질 마모 심함 어렸을때 홍역 휴우증 아래 송곳니부위 probe time 이상 들어감 어금니부위 치은소실 심함 치주낭 항생제 도포 진행함 내복약 일주일치 처방 치아관리 철저하게 해주시라고 안내 만약 필요시 발치해야함 ,,, 치주 질환 / 치주염 (젖니 유전자 좌로 유래하는 것 포함),치아 및 구강 질환 ,,,132,6
Maltese(말티즈),MN              ,2092,H,s 이틀전부터 소변을 볼려는 자세는 취하는데 방울 방울 소변을 봄. 식이 및 활력 등은 크게 변화 없음. 청진상 이상 소견 없음. skin tug not delay. mm pink wet crt 복부 촉진시 특이 소견 없음. 복부 영상 검사 간 echo 상승 담낭 슬러지 신장 피질 echo 증가와 결석 방광 및 요도 결석 혈액 검사 미약한 간수치 상승 소변 침사 도말 rbc 다량 확인 외 특이 소견 없음. p 요도의 결석을 다시 방광으로 밀어 넣고 수술적 제거 해야함. 성분분석에 맞춰 재발 방지를 위한 사료 및 관리 필요함. 간수치와 신장의 부분은 결석 치료 종료 후 추가 검사 및 관리 필요함. 내일 수술 예정이며 안 부재로 이도형 과장님께 인수인계. 내일 수술일정 잡히면 연락 드려서 내원하시기로 함. 동의서 작성은 완료함. ,,, 방광 결석 , 비뇨기과 질환 ,,,411,1
Maltese(말티즈),F,2126,D_VIP, money 선납 민혜 해마루에서 김성수 원장님께 진료보시던 환자임. 하루에 발작 번까지도 하는 아이라고 하심. d low fat캔 사료 영양제등 갈아서 강급중. 강급중에도 발작할수 있다고 하심. 오메가 time 식만 조금 먹을때도 있음. 갈비뼈 개 부러짐. 개는 붙고 개는 아직 부러져있다고 하심. 김성수 원장님 진료 원하셨으나 오늘은 불가하시다고 말씀드림. 후두마비 발작 하악골절 고개흔들다가 쓰러지고 팔을 쫙 뻗고 비명 지르면서 후두마비 수술이후 발작증상 나타남. 발작은 year month 전 후두마비있을때부터 이후 빈도가 확 늘어난건 약 month 정도 하루에 번이상 회 time 내외 time 치중 약 month 일정도 먹이셨음. 밥은 못먹지만 물은 잘 마심. 우측으로 circling. year 정도 후두마비수술전부터 있었음. wbc money pcv bun crea crp bg hypoglycemia 금일 원내 seizure or circling은 없음 좌측 갈비뼈 골절 저혈당증상은 지속된 발작 or pss stravation 감별필요 경미한 빈혈은 starvation 혹은 간질환 홍역등 감별필요 신경증상은 뇌내성 발작으로 인한 가능성 기존 iris stage 로 확인된환자 후두마비와 하악골절로 인해 섭식시 비강으로의 누출 생각됨. 갈욕이 심한상태 tx 감압처치 mannitol kg iv furo time kg iv 회 famo time kg bid iv levetiracetam time kg time kg bid iv glucose timeiv twice tramadol time kg bid iv pheno time kg qid iv loading ampicillin time kg bid iv nebulizer bag time 에 번 time 씩 발작에 대한 모니터링 페노 로딩중 항경련처치중 mri를 찍을 상태가 안되는것으로 판단시 연령과 증상을 고려해 mue에 준해 처치계획에 대하여 보호자분께 말씀드린 상태. 지속적인 섭식 장애시 ppn고려 치료시 cytarabine pds 고려중. 신경증상 stable해질시 한방치료도 고려. 익일 cbc 도말 전해질 평가 pds 고려 혈압 모니터링 ,,"29,85,331", 경련 발작 (원인 미정) , 신경 질환 ,"부전마비, 완전마비","부전마비, 완전마비",1076,4
Poodles(푸들),M,2126,B_W,오늘 가방이 떨어진 이후에 epylepsia가 보이고 이후 가금 놀래는 증상이 있고 불안해 하는 증상이 있음 가방이 떨어진것은 오후 time 경에 떨어짐 심장이 너무 심하게 뛰기도함 집에서는 기침을 하지 않았는데 병원내에서 기침을 함 내일 mri검사 진행하고 보호자님과 상담을 진행 ,,, 경련 발작 (원인 미정) , 신경 질환 ,,,158,4
Pomeranian(포메라이안),F               ,2126,D_VIP, 발작으로 내원 금일 오전 time 경 침대에서 떨어졌음 떨어졌을 당시 발작 없었으나 그 이후 회 발작 있었음 낮에 회 오후에 회 하면서 쇼파에서 떨어졌음 내원하기 time 전 회 증상은 다리 뻗뻗해지고 목이 뒤로 넘어가면서 침흘리고 오줌 쌌다고 함 회 모두 증상은 비슷했음 증상 지속시간 time 정도 구토 설사 없었음 발작 후 의식 돌아오고 정상생활 하였음 사료에 대한 식욕없고 기력저하. 내원 전에 사람우유 잘 먹었다고 함 예방접종 및 심장사상충 꾸준히 하셨음 관리받고 있는 질병 없음 alert bcs 청진 이상없음 bp 보행상태 양호 plr 정상 신경계검사 양호 새벽 time 발작 회하였음 tonic clonic seizure. 사지 경직 opisthotonus 침흘림 쩝쩝거림 호흡 불안정 산소공급 안구압박 diazepam time kg iv bolus time 후 의식회복하였음 lactate bg 전해질 s kcl time eq 유지 ddx trauma에 의한 cluster seizure idiopathic seizure 외상으로 뇌내성 병변이 의심되나 정확한 진단은 어려울 수 있다고 설명 야간에 입원하여 응급처치 및 추가 발작 없는 지 모니터링 후 오후에 주치의 배정되면 전화드리기로 함 ct mri 등 상위검사가 필요할 수 있으며 대략적인 금액 안내하였음 보호자 문자 안녕하세요 vip동물병원 수의사 허유진입니다. 콩이는 금일 새벽 time time 경 발작을 회 더 하였습니다. 응급처치하여 다시 의식을 회복하였으나 하루안에 발작을 너무 많이 하여 걱정이 되네요. 그래도 발작 후에 진정이 되었는지 아침밥을 다 먹고 더 달라고도 하고 계속 짖고 하네요. 주치의 배정되고 추후 아이 치료방향에 대해 상담전화가 오후에 갈 예정입니다. 문의사항 있으시면 언제든지 연락주세요. ,,16, 경련 발작 (원인 미정) , 신경 질환 ,발작,발작,893,4
Yorkshire Terrier(요크셔 테리어),FS,2126,C_잠실ON,cc 신경증상 month 전부터 다리가 미끄러지는 증상 보임 금일 오후에 구토 한번 함. 목을 못 가누고 몸을 계속 도는 증상 시작 밥은 잘 먹음. 그동안 발작은 없었음 입양 전 천식으로 오랫동안 병원생활 했음. . 내원 당시 기립불능 우측으로 몸을 계속 돌고 고개가 우측으로 돌아가는 증상 . plr 양측 반응있음. 체온정상 . 두개골 영상 후두골 이형성 소견 tx. diazepam cc kg 뇌압강화처치 . 경추 척추쪽 감별필요. 뇌쪽 문제는 mri로 정확한 진단 가능. 보호자님 퇴원요청으로 퇴원동의서 받고 퇴원. 집에서 오줌 싸는지 잘 봐주시고 물 주세요. 원래 다니던 병원에서 진료받는다고 하셔서 진료기록 메일로 보내드리기로 함. ,,23, 경련 발작 (원인 미정) , 신경 질환 ,"보행이상, 파행(전지, 후지)","보행이상, 파행(전지, 후지)",359,4
Welsh Corgis(웰쉬 코기),MN              ,2275,G_부천이지, time 전에 suv차량이랑 교통사고 차밑에 깔렸음 오른쪽다리는 살이 벗겨지고 뼈도 드러났음 체온 심박수 호흡수 혈압 mental normal 우측 뒷다리는 월드펫에서 붕대 처치한 상태로 내원 보험처리 사항 동부화재 접수번호 검사 방사선 검사 우측 대퇴골두 성장판 골절 초음파 검사 간 음영 감소 방광내 sludge 혈액 검사 알부민 감소 wbcs 증가 crp 정상 dimer 정상 처치 삭모 피부 상처 부위 소독 우측 뒷다리 발가락 피부 소독 sugar therapy 세파 time kg 시메티딘 time kg 트라마돌 time kg tid 엔로 time kg sc sid 상담 금일 검사상 우측 대퇴골두 성장판 골절외 특이 소견 없음 month 정도 관리하면서 다른 이상소견 관찰 가능성 있음 신경계 문제는 파악하기 어려움 차후 상태에 따라 신경계 문제 가능성 제시 예정 상태 양호할경우 month 후 수술 예정 오후관리사항 food d 닭가슴살 잘먹음 urine feces 요도카테터 etc tx cefazolin time kg iv cimetidine time kg iv tramadol time kg iv enrofloxacin time kg sc ,"골절, 2081","77,15", 사고 (교통 사고 포함) ,전신성의 질환,"골절,출혈",골절,593,8
,F,2116,D_VIP, refer. 주호소 유선종양 현증경과 작년 month 에 유선종양 의심되는 부위 초음파로 확인했었음. 그 이후로 점차 커지기 시작했음. 예방접종 all done boosting은 안 하심. 심장사상충 외부기생충 구제는 매달 해주심. 사육환경 주로 실내 생활. 사료 table food를 주로 먹는편. 밥을 잘 안 먹는 편이라 사료를 자주 바꿔서 먹음. gc 기력 식욕 정상. 몸이 허약한 편 surg 작년 질종괴 수술 gi 구토 설사 증상 없음. nv 어렸을 때 경련 증상이 있어서 pss 의심된다는 얘기를 병원에서 듣고 입원 치료 받은 적 있음. 살 때까지 그런 증상 있었음. re 호흡기 증상 없음. ug 물을 잘 먹는 편은 아님. 신체검사 mental bright alert responsive hr bpm rr 회 min bcs mmc pmm crt sec 탈수평가 nrf 유선검사 다발성 mass 사진 참조 혈액검사 cbc mild leukocytosis mild thrombocytosis serum chemistry elevated alt dx ddx mammary gland tumor 다발성 유선 종양이 진단되며 수술적 치료가 지시됨 ce 현재 유선 여러군데에서 다양한 크기의 유선 종양이 관찰되며 치료 및 진단을 위해 수술적 절제가 요구됩니다. 권유드리는 수술의 범위는 우측 유선 적출 좌측 유선 적출 좌측 번 유선에 있는 mass의 lumpectomy 난소자궁적출술 입니다. 보호자분께서 아이의 허약한 체질과 높은 간수치에 대한 걱정이 많으셔서 제안드렸던 수술을 아이가 이겨내지 못할 것이라며 수술을 꺼려하심. 보호자분께 차선의 수술방법으로 난소자궁적출술과 가장 큰 유선 종양 개 우측 번에 있는 time 좌측 번에 있는 time 만 lumpectomy 해서 조직검사하는 것을 말씀드림. 보호자와의 심도있는 고민 끝에 간약을 month 일간 복용한 후 차선으로 말씀드림 방법으로 수술 진행하시기로 결정 다음주 day 난소자궁적출술 및 유선 종양 lumpectomy 차 내원 예정 오전 time rx 내복약 silymarin time kg po bid udca time kg po bid fordays 전화상담 by soo 알약이 너무 커서 먹이시기 힘들어 전화주심. 주사기도 힘들어서 고기에 섞어서 주셨는데 이것도 조금 먹다 뱉어냄. 꿀 조금에 섞어서 먹이실것 안내드렸으나 이것도 힘들것 같다고 하심. 내일 내원하시면 작은 알약 개로 다시 조제해드리겠다고 안내드렸고 필요하시면 전화주시고 내원하시기로 함. ,,, 유선 종양 / 유방 종괴 , 생식기 질환 ,,,1247,3
Pomeranian(포메라이안),MN,2133,D_VIP, money 선납 by 원 강아지 찬 우유를 먹고나서 눈이 돌아가고 고개 젖혀지고 왼쪽으로 돌아감 우유를 급하게 먹고 난후 그랬다 함 마사지후 조금 상태 좋아졌다가 다시 켁켁거리고 상태 안 좋아짐. 평소 목디스크로 사지 못쓰고 목은 옆으로 기울었다 함 다른병원에서 지은 심장약을 한달전부터 먹이고 있음 이에대한 자세한 내용은 잘 모르심 따님분이 알고 있다하심 aus no murmur head left turn 그쪽으로 자꾸 쓰러짐 nystagmus horizonal panting 과도한 흥분 plr 사지는 원래 쓰지 못했음 ray cbc wbc chemi glu bun crp lactate ddx 뇌질환 의심 tx butorphan time kg diazepam time kg dexa time meto time kg mannitol kg ce 증상으로 보아 뇌질환의심되고 그에 준항 처치합니다. 검사는 mri 지시될수 있습니다. 우선 안정화에 중점두어 치료들어가고 향후 검사및 치료에 대해서는 주치의 선생님과 상담합니다. 언제든지 응급상황발생할수 있고 경련이 심할경우 위험감수하고 마취제 투여할수 있습니다. 특별한 일 없으면 주치의 선생님께서 오전까지 상태관찰하고 오후 time 이후에 연락드리겠습니다. 쭉 따님이 내원하시다가 오늘은 아버님이 내원하심 설명 잘 이해하시고 치료하시기로 함 ,,, 상기에 해당하지 않는 신경계 질환 , 신경 질환 ,,,669,5
