품종,성별코드,주진단명코드,병원,SE,기타진단코드,기타증상코드,주진단명,질환,증상명,주증상명,len,label_id
British Shorthair Cat(브리티쉬 숏헤어 고양이),MN              ,2244,H,홍코 체크무늬 가방 지하호텔실 보관 저녁 time 내원예정. hx hyperglycemia day 오후 time 부터 time 간격으로 측정 hi hi hyporexia day 낮부터. 입에 넣었다가 뱉어내는 모습. vomitting 최근 month 사이에 없었음 한 달에 두 번이상. 사료 먹고 바로 할 때도 있고 몇 시간 후에 소화된 사료가 나올 때도 있음 diarhea none pe qar bcs skin turgor normal mm pink moist crt sec heen nrf abd palpation nrf fpli kit negative rx us findings 방광비대 이전 방사선 검사와 비교하여 신장크기 감소 장축길이 time 신장변연은 부드러우며 이전과 비교하여 큰변화 없음. us findings 간에코 미만성 증가 falciform fat과 비교하여 및 간원위부 초음파 감쇄효과 storage disease에 의한 변화로 생각되며 이전 검사와 비슷하게 관찰됨. 신장 피질 및 수질 에코 이전과 비교하여 증가 피질수질 경계 이전보다 경계 모호하게 관찰됨. 이전과 비교하여 신장 형태적인 변화 관찰됨. 췌장 특이사항 없음. 소장 등 위장관계 이상 관찰되지 않음. 운동성은 관찰되지 않음. 당뇨와 별개로 구토 관리 필요 구충부터 다시 시작 펜벤다졸 days 인슐린 투여 시작 iu kg 총 iu sc bid 밥먹이고 인슐린 time 후에 혈당곡선 그릴 스케줄 잡아야 함 조 전화예정 사료량 힐스 cup 하루총량 인데 컵을 못드려서 우선 현재 끼 g에서 g으로 줄여서 먹이시라고 안내함. d캔 하나 드려야 함 ,,, 당뇨병 ,내분비 질환 ,,,803,3
Pomeranian(포메라이안),MN              ,2133,G_부천이지,경련 발작 최근신경증상 한달전 신경계검사 신경 반사 좌안 plr 반응지연 자세반응검사 제대로 기립하지 못하는 상태로 평가가 힘듬 혈액검사 경련에 의한 수치 상승 cpk ast 과흥분에 의해 경미한 혈당상승 hypoperfusion에 의한 tp alb 상승 전해질 불균형 확인됨 신경증상 경련 tx fluid therapy s 타우린 타치온 펜톡시필린 vit cefotaxime time kg iv time kg iv famotidine time kg ,,16, 상기에 해당하지 않는 신경계 질환 , 신경 질환 ,발작,발작,252,6
Maltese(말티즈),MN,2274,B_W,s 동거견 불테리어에게 물림 두부 교상 군데 좌측 전지 전후방으로 심한 교상 곳 등 곳 두부와 좌측 전지의 큰 교상은 근손상 동반 cbc wbc 로 살짝 낮은 것 이외 특이사항 없음 전해질 na cl chem 특이사항 없음 crp tx 교상부위 클리핑 세정 소독 후 드레싱 수액 ns taurine vit c 유지속도 cepha ampi tra iv am tlk cri 내일 교상부위 상태에 따라 수술 진행 염증여부에 따라 며칠 더 염증관리 후 수술할 수도 있음을 고지함 내일 보호자님께 전화주세요 pm time op hemostasis 기 멈춤 delayted pimary closed 실시 systemic facter 양호 woundname bite wound puncured wound contamination or infecton clean contaminated adiquacy of blood supply 양호 surgical debridement 실시 bite wound로 세정 및 초기 처치후 창상의 출혈지 지난 후 time 지나 수술적으로 closed 진행. 일부의 근막과 근육의 손상이 관찰되어 봉합 및 피부 폐쇄 시킴. ,,4, 교상 (bite wound),전신성의 질환,통증,통증,582,2
Mixed(혼합),MN              ,2126,D_VIP,s year 전 처음 증상 관찰하심 기지개 켜다 강직 증상 보여서 쥐난걸로 생각하심 month 회 내지는 주기 더 길게 앞다리 강직 뒷다리는 크게 변화 없는 듯 함 목은 가눌수 있음 의식 month 전부터는 빈도가 좀 잦아짐 month 에 회 관찰하심 증상 나타날 즈음 아이가 보호자 옆에 와서 강직 보여서 주물러주시면 time 후 풀어짐 금일 내원 전에 증상 보였을 때는 침 고이고 소변도 같이 지림 paddling은 없었고 앞다리 강직 눈꺼풀이 처져 보이기도 하는 것 같음 식욕은 양호 소변량은 크게 변화 없음 최근 들어 좀 변 무른 상태 사료 외 닭가슴살 수박 참외 등 과일 조금씩 pe hrbpm bt 도 경미한 복부팽만 신경검사 특이소견 없음 혈검 alt alp high margin 방사선 간 mildly blunt margin 복부초음파 by hyuna findings 간 좌측 외측엽 종대 에코 정상 양측 부신 종대 lt time rt time 비장의 저에코성 결절 . time imaging dx ddx hyperadrenocorticism steroid hepatopathy mild splenic nodular hyperplasia comment 비장 결절의 크기 변화 추적검사가 추천됩니다. acth stimulation test pre post 주증인 신경증상의 경우 intracranial dz로 판단되며 mri 촬영 필요 cortisol post gray zone에 해당하며 현재 초이가 임상증상을 뚜렷이 보이고 있지않아 trilostane 투약은 보류 갑상선 기능저하증 또한 감별 필요 항경련제 month 처방 kbr loading dose mri 촬영 고려해보시기로 하였고 month 후 상담 진행 예정 ,,"33,29", 경련 발작 (원인 미정) , 신경 질환 ,"떠는 증상, 경련 또는 미진,부전마비, 완전마비","떠는 증상, 경련 또는 미진",859,0
K.C(Korean Cat),FS,2048,B_W,hx month 동안 츄르만 소량 먹고 거의 안 먹음 사료는 아예 안 먹음 구토는 없으나 설사는 지속되기는 하나 처음에 비해서 형태가 조금씩 생기는 편 진한 고동색 정도 필건으로 약 먹이시는 중 먹이시는 중 물은 먹는 편 잘 먹는 건 아니어도 어느정도 먹고 있음 gen intermittent aggressive skin turgor mildly delayed crt sec blood work hyperproteinemia hyperglobulinemia g ratio eleveated hct pcr stool clostridium perfiringens ray sono fluid filled stomach no evidence of fbs in git mild corrugation in duodenum clostridial enteritis 기저 원인에 의한 차적인 감염 가능성 또는 원발 원인 확인되지 않은 상태로 호전 반응 가능성 현재 구토 없으나 구토 유발 가능성 존재 이물 가능성 배제되어 metoclopramide 추가 처방 미용에 의한 면역력 저하 가능성 있음 비용부담으로 내복약으로 관리하시다가 구토 유발되거나 기력 저하 지속 시 입원 처치하시기로 하심 ,,"1,2", 세균성 장염 , 소화기 질환 ,"구토(급성/만성),설사(급성 소장성/급성 대장성/만성 소장성/만성 대장성)",구토(급성/만성),602,7
Mixed(혼합),F               ,2274,F_센트럴, history 여행 돌아오셨더니 둔부의 교상 발견 objective 둔부의 광범위한 교상 등 체표의 가량 시간이 경과하여 환부에 털 등이 짖무른 상태 괴사한 조직은 최대한 걷어내고 봉합 외의 부분은 소독 및 레이저 치료 염증으로 인해 봉합 부위 터지거나 재수술 필요할 수 있음 위중함 ,,34, 교상 (bite wound),전신성의 질환,교상,교상,160,2
Shih Tzu(시추),F,2031,D_VIP, money 선납 승희 야간 by 홍 호흡수 am am am am 엎드림 am am 소변 원활 체온 심박 회 분 전반적으로 호흡수 줄어들고 있는 양상이며 엎드려 자는시간이 많음 식욕은 좋고 치킨캔 다먹고 물도 잘 먹음 urination urination rrr urination rrr 내복약 rrr rrr urination 내복약 ,흉수,"28,14", 폐수종 (원인 미정) , 호흡기 질환 ,"기력저하,호흡곤란",기력저하,186,10
Poodles(푸들),MN,2181,B_W,안을 때 통증소리를 지름. 어제 저녁부터. 오늘 새벽에도 심하게 통증을 호소함. shivering. no gi signs. 어제까지 잘 먹음. 오늘 아침에 소량 먹음. 물은 스스로 잘 마심. 오늘도 반길 때 안아주면 아파함. pe b.a.r. mild back pain l . 고유자세반응은 모두 정상. 방사선상 우측 고관절에 djd l 사이의 디스크가 협소해짐. 다른 이상은 없음. 혈액검사 요검사 초음파검사. ivdd grade mr촬영. month 후 유용규 원장이 상담. ,,4, 추간판 탈출증 ,근육 골격 질환 ,통증,통증,268,9
Yorkshire Terrier(요크셔 테리어),FS              ,2275,E_24시아이,교통사고 하악 절치 우측 상악 우측 흔들림 출혈점 치아 흔들림 경과 보면서 지속적인 식욕 없으면 발치고지 폐출혈 소견 마일드 ,-,"15,21", 사고 (교통 사고 포함) ,전신성의 질환,"출혈,식욕부진, 식욕저하",출혈,70,5
Maltese(말티즈),MN              ,2031,F_센트럴, history 어저께 조아요 에서 폐수종으로 진단받고 치료 후 금일 퇴원 체중 kg 수준에서 천천히 감소하여 kg 수준 내원 시 거쳐서 퇴원 시점에서 kg 수준 objective dyspnea cyanosis tremor of head rt. lobe pulmonic edema cardiomegaly vhs right heart enlargement la regurgitation ao la 탈수 상황에서 ef fs ce 폐수종 없는 상태로 유지 임상증상 천천히 올리기 심장 remodeling 등 변화상 심해서 end stage 통원치료 전환이 어려울 수 있고 장기적인 예후는 불가능할 것으로 보임 ,,, 폐수종 (원인 미정) , 호흡기 질환 ,,,338,10
Mixed(혼합),F,2133,C_잠실ON,cc 비틀거림 shiverring 오후에 지우개 섭취 이후 전혀 증상없이 밥도 잘먹었다고 함. 밤 늦게 갑자기 비틀거리고 shiverring보이기 시작함 구토나 설사 등의 증상 없음 평소 신경증상 전혀 보이지 않음 아이 고령이긴 하나 평소 지병없이 잘 지내고 있던편 원래 좋지않던 우측 귀는 잽스 수술 받음 다른 병원에서 수술받으셨는데 작년 진료시 발견되었던 우측 귀의 mass는 제거되었는지 조직검사 하였는지 여부에 대해서는 잘 모르겠다고 하심. 외관상 관찰되는 mass는 제거된 것으로 보임. 방사선 촬영 중 변을 봄 정상변의 형태였으나 은박지가 일부 포함된 변이였음. 지우개 이외 다른 이물 섭취 가능성 여쭤보았으나 모르겠다고 하심. . murmur 없음 . 혈액검사상 특이점 없음 . 방사선상 소화장기에 음식물과 사료가 아닌 것으로 추정되는 음영 높은 물질이 관찰됨 plan. 현재 혈액검사상 발견되는 특이점은 없으나 shivering 비틀거림 등의 신경증상 보이므로 내일 내과원장님 계실때 꼭 내원하셔서 초음파 등 정밀검사 진행하셔야 합니다. 신경증상 보이므로 호흡곤란 등의 상황이 올 수 있으므로 밤사이 잘 지켜봐주시고 응급상황 발생시 바로 내원해주세요 일년 전 우측 귀 mass가 재발하였거나 제거되지 않았을 경우 mass가 뇌신경계를 압박하여 신경증상 발생가능함을 말씀드림. 이는 방사선이나 혈액검사로는 확인되지 않는 부분이라 정밀검사가 필요합니다. ,,40, 상기에 해당하지 않는 신경계 질환 , 신경 질환 ,신경증상(이상행동),신경증상(이상행동),708,6
Maltese(말티즈),M               ,2048,G_부천이지,구토 설사 month 전부터 식욕 없음 month 전에 큐피트 동물병원에 내원 주사 설사 내복약 처방 받음 내원 첫날 식욕 조금 생김 구토 없었음 어제 부터 노란색 구토 증상 보임 식욕 없음 오늘 아침까지 약 먹임 구토 검은색 설사변 갑자기 증상 보인거 같다고 함 특별히 먹인것 없다고 함 최근에 스트레스 받은것 같음 평소에 캔 사료 섞여서 먹임 주로 과일류로 간식 먹임 추가 접종 안됨 사상충은 예방중 검사 췌장염 검사 방사선 검사 소장 및 결장내 가스 초음파 검사 위내 소화물 차 있는 것에 반해 십이지장 운동성 저하. 췌장 주변 복막 에코 heterogenous하게 관찰. 이물 의심 소견 없음. 파보 코로나 장염 검사 변 검사 이상세균 증식 상담 췌장염 의심 합병증 발생 여부 확인을 위해 혈액 검사 권유 정도에 따라 입원 치료 권유 초기 췌장염 처치 수액 처치 하트만 타우린 펜톡시필린 암피실린 time kg 파모티딘 time kg tid 엔로 time kg sid 정장제 sid po d can 급여 오후관리사항 food 식사종류 양 식사시간이후로 와서 금식 식욕상태 급식방법 urine feces etc 치료 및 상담내용 tx e ,2082,"1,2,21,4202", 세균성 장염 , 소화기 질환 ,"구토(급성/만성),설사(급성 소장성/급성 대장성/만성 소장성/만성 대장성),식욕부진, 식욕저하,흑변",구토(급성/만성),584,7
Maltese(말티즈),FS              ,2116,H,유선종양수술 상담 관련으로 오후 time 이후에 내원예정. 보호자님 동물병원관련업종에서 일하심 살에 중성화 수술 그때 cm 정도의 유선종양 있었던거 발견했음 최근 month 전쯤 담즙 슬러지 관련 내복약 month 가량 투약 하셨음 유선종양 관련 종양 있는 부분만 수술적 제거 하시고 싶어서 병원 알아보시는 중 p bp 우측 번 유선부위 직경 cm 정도의 mass 그외에 좌 우측 번유선에 직경 mm정도의 mass 여러개 확인됨 blood work alp alt수치 상승 방사선 간비대 신장크기 감소 복부초음파 담낭내 소량의 슬러지 간크기 간 에코 상승 양측 비장 종대 확인됨 ua 저비중뇨 단백뇨 확인됨 up uc 내일 오전중 내원하셔서 acth검사 혹은 lddst검사 진행 예정 acth검사 진행할 경우 오후 ct검사 같이 진행 예정 금식 안내 되어있음 보호자분 다시 전화오심 acth ct검사말고 lddst로 검사하신다고 하심 ,,, 유선 종양 / 유방 종괴 , 생식기 질환 ,,,466,8
Mixed(혼합),MN,2274,D_VIP,cc 복부 및 둔부 자상 및 구더기 hpi 그저께 옆구리에서 피가 흐르는것 확인. 엉덩이 주변에도 피와 구더기 있는 것 확인 후 구더기 제거해 주심. gs 평상시에 활력 및 식욕 좋음. 최근에 식욕이 조금 떨어진 것 같음. med 어제 진통소염제 한알 처방받아서 먹이심. 좌측 복부에 puncture woundsite wound 아래에 sq dead space는 공유됨. dead space 범위는 약cm 가량 우측 둔부 및 허벅지에 각각 puncture woundsite 씩 각각 하나의 sq dead space가 있고 엉덩이는 약cm 허벅지는 약cm 가량. 허벅지 wound에서는 구더기 개 발견됨. laboratory test cbc leukocytosis chem elevation of alt protein elect. n.r.f hw ag kit positive 현미경상 자충 움직임 확인. dx severe puncture wounds heartworm infection myiasis tx wound lavage with s sugar therapy with tie over bandage sites 피부 타박상에는 실마진 도포 medication during hospitalization cefotaxime time kg iv bid enrofloxacin time kg sc bid metronidazole time kg iv bid meloxicam time kg sc loading 이후 time kc sc sid cimetidine time kg iv bid 입원 관리 하면서 sugar dressing bid로 진행 예정. 심장사사충 치료에 관해서는 현재 응급적인 치료가 요구되는 상태가 아닌 것으로 판단하여 wound 치유가 어느정도 안정화에 다다르면 진행하기로 함. ce 현재 상처치유에 집중해서 치료를 해야합니다. 상처가 굉장히 넓고 깊어서 입원 치료를 일정 기간 유지해야합니다. 심장 사사충에 관해서는 당장 치료가 들어갈 필요는 없지만 상처 치료가 어느정도 진행이 되고 나면 그 때 심장사상충 치료도 진행하셔야합니다. 비용에 대해서는 할인가로 적용시켜드릴 예정입니다. 보호자분께서 그 이상의 할인을 요구하시며 직접 원장님들과 이야기하겠다고 하시고 일단 치료는 계속 진행시켜달라 말씀함. ,,0, 교상 (bite wound),전신성의 질환,기타 증상,기타 증상,1130,2
Maltese(말티즈),MN              ,2244,G_부천이지,s 까만변 계속 봄. 먹지를 못함. 그제까지는 상태 양호 어제부터 식욕부진 점액성 흑변 보이고 있음. 특이사항으로 한달 전부터 끈적한 소변양상 보였다고 하심 신체검사 창백한 점막 기력없음 혈액검사 전반적 간수치 상승 및 황달 저알부민혈증 혈당 측정불가 crp 상승 디다이머 상승 응고계 지연 소변검사 요당 케톤뇨 빌리루빈뇨 확인 영상검사 간 내 다발성의 종양성 변화 담낭 벽 비후 및 슬러지 비장 head 부위 종양성 변화 신장에코 상승 전반적인 복막 에코 상승 저에코성의 췌장변화 복강 내 소량의 복수 dka pancreatitis hepatic tumor metasis tx ampicillin time kg tid iv famotidine time kg bid iv tramadol time kg tid iv vit time kg bid sc fluid therapy fold s 타치온 타우린 kcl 헤파멜즈 vit 펜톡시필린 입원하여 치료 경과 지켜볼 예정 e 전반적인 상태 좋지 않으며 종양에 의한 차적 영향으로 각 장기부전 발생이 진행되는 과정일 수 있음 당뇨 및 췌장염도 차적 영향일 가능성도 배제 못함 환자의 예후는 매우 poor할 가능성이 높음 원발 종양 질환에 의한 전이가 현증을 나타나고 있을 가능성이 높으므로 치료에 좋은 경과를 보이지 못하면 사망가능성 높음 이후 경과에 따라 수혈 등의 추가처치가 필요할 수 있음 오후관리사항 food 식사종류 양 금식 식욕상태 급식방법 urine feces etc tx ampicillin time kg iv famotidine time kg iv tramdol time kg iv vit time kg iv ,"2084, 2082","4202,21", 당뇨병 ,내분비 질환 ,"흑변,식욕부진, 식욕저하",흑변,822,3
Pomeranian(포메라이안),MN              ,2274,G_부천이지,교상 월드펫 동물병원 의뢰 오늘 오후 time time 경에 시골에서 물림 부천으로 올라오시는 도중에 멀미약 먹임 내원시간은 오후 time 호흡수 증가 노력성 호흡 점막 미약한 창백 방사선 검사 상담 흉강 파열에 의한 기흉 폐 collapse 의심 기흉이 심해지면 호흡 문제로 인해 사망 위험성 있음 응급 수술 권유 ct 촬영후 폐 엽의 상태에 따라 폐엽 절제 가능성도 있음 설명 처치 수액 처치 산소 공급 세파 time kg 파모티딘 time kg 트라마돌 time kg tid 엔로 time kg sid 흉관 삽관 수술 좌측 흉벽 군데 파열 좌측 번 늑간부터 상완골 외측 피부까지 피하 연결 흉벽 파열부위 봉합 수술부위 saline 세정 배액관 삽입 오후관리사항 food 식사종류 양 식욕상태 급식방법 urine feces f etc tx ,,"1401,1901", 교상 (bite wound),전신성의 질환,"빈호흡,점막창백",빈호흡,416,2
Poodles(푸들),F,2181,B_W,어제 잠을 자지 못하고 어제 안아준 후에 통증을 호소했었음. 진료받은 적은 없음. 구토와 설사 없음. 사료와 간식을 섞어 주어야 잘 먹음. 기침을 많이 함. 딸과 어머님의 의견이 다름. 딸은 많이 한다고 하지만 어머님은 가끔 한다고. 심장사상충 예방약은 매달 약국에서 구입해서 먹였음. no boosting. year 전까지는 접종했음. ohe year 전에 피부 종괴 제거하면서 수술했음 걷는 것은 잘 걸음. shivering no back pain no murmur but panting. thin body bcs mpl right grade iii dry cough. no neck pain severe dental plaque. halitosis. rbc의 수는 감소하였지만 mcv의 크기가 증가하였음. hct는 정상. l 기관허탈 grade ii. mr 촬영을 권유한 상황. 허리와 brain 보호자가 생각해 보기로 함. ,,4, 추간판 탈출증 ,근육 골격 질환 ,통증,통증,465,9
Siamese Cat(샴 고양이),FS,2275,B_W,낙상으로 내원. 뒷다리를 만지면 아파함. 흉방에서 우측 기흉 우측 전엽과 후엽의 contusion이 관찰됨. 복방에서 방광은 정상. 우측 고관절 탈구. alt ast ck ldh 상승. saa 정상. 혈압 정상 저녁 time 경 흉방에서 기흉은 더 증가하지 않았음. 우선 time 까지 지켜보고 결정하기로 함. 저녁 time time 경 촬영한 흉방에서 기흉은 관찰되지만 점차 감소하고 있음. 응고계 검사. tx 산소공급. 수액처치 buto 주사. 저녁 때 촬영한 방사선상에서 tension pneumothorax가 확인되지 않아서 대증처치하면서 경과를 지켜보고 있는 중. ,기흉,30, 사고 (교통 사고 포함) ,전신성의 질환,,,321,5
Mixed(혼합),M               ,2133,G_부천이지,지인분들께 소개받음 일주일 전부터 왼쪽귀 검은분비물 많이 나옴 사료 불려주심. 어제 저녁먹은 후 수회 구토 금일아침부터 머리 우측으로 . 보능불능 우측 안구 깜박거림 s. 어제 밤에 사료 먹자마자 수회 구토 보호자가 구토 이후에도 속이 비었다고 계속 사료를 주셨고 먹는 족족 다 토함 오늘 아침부터 head tilt nystagmus but 며칠 전부터 약간 고개 기울어진 듯하고 약간의 운동실조가 관찰되었었다고 함 원내 내원시 오전보다는 좀 더 균형 잡는 상태 o. mental alert posture right head tilt wide stance ataxia jerk nystagmus 방사선 방광 뒤쪽 mass effect 치조골 lysis 초음파 전립선 비대 신장음영 증가 혈액검사 glob 상승 alp 배 상승 a. 특발성 전정계 증후군 가능성 있으나 mri 촬영 안된 상황으로 뇌종양이나 염증 등 다른 문제일 가능성도 설명드림 특발성 전정계 증후군이 아니라면 증상 더 안 좋아지거나 다른 증상도 추가될 가능성 있음 설명 현재 구토의 원인도 균형감각 이상 때문인 것으로 사료됨 rx. cerenia sc ,,40, 상기에 해당하지 않는 신경계 질환 , 신경 질환 ,신경증상(이상행동),신경증상(이상행동),570,6
Shih Tzu(시추),MN              ,2126,D_VIP, month 전 쓰러지면서 배뇨하는 발작같은 증상 보임. 몇일전 같은 증상 관찰됨. 그 외 특이증상 없음. t p bp 혈검 nrf 방사 nrf 복초 복부초음파 by hyuna findings 방광벽 비후 time 및 불규칙한 내벽 증식 imaging dx ddx cystitis 현재 발작 빈도수가 적어 내복약 관리를 해도 호전 유무를 알 수가 없음. 따라서 발작 모니터링 하다가 회 더 진행시 mri 검사 진행합니다. 검사상 특이사항 없을 경우 epilepsy에 준한 내복약 처방합니다. ,,16, 경련 발작 (원인 미정) , 신경 질환 ,발작,발작,275,0
Schnauzers( 슈나우져),FS              ,2116,E_24시아이, 배에 혹 옛날에도 혹이 있었으나 제거하지 않고 지켜봄 활력 및 식욕 큰이상 없음 대소변 큰 이상없음 month 사이에 크기가 커지고 변화가 있음 fna 검사상 다량의 혈액장액성 삼출물과 간헐적인 유선 세포가 관찰됨 ce 초음파 검사와 종합하면 염증과 종괴가 같이 있는 양상입니다 더 커지고 염증이 생기기전에 제거하시는 것이 좋겠습니다 부토파놀 time사용 mass제거 실시 조직검사는 비용부담으로 인해 보류 . ,,221, 유선 종양 / 유방 종괴 , 생식기 질환 ,"종괴, 혹, 낭종","종괴, 혹, 낭종",231,8
Boykin Spaniel(보이킨 스파니엘),M,2275,B_W,집에 있다가 잠시 문이 열린사이에 탈출을 함 time 정도 곤지를 찾고 있다가 교통사고 난 것을 발견함 가해자는 곤지가 있는지 모른상태에서 골목을 지나가다가 갑자기 덜컹거리를 느낌을 받고 사고가 난 것을 발견하심 내원당시 의식상태는 명료하였으나 뒷다리를 잘 못쓰는 모습을 보임 좌측 hock joint 내측으로 깊은 자상 및 출혈이 있고 좌측 뒷다리 내측으로 광범위 피부 발적이 관찰됨 흉요추부위 back pain은 분명하지 않음 blood test ck ldh 상승 외에 특이소견없음 us 실질장기 이상소견 없음 effusion 관찰되지 않으며 ub 정상 방사선 right femoral head physeal fracture fracture는 우측이고 외상은 좌측임 익일 흉부방사선 재검 후 수술예정. 유용규 원장님께 인계함 ,"2194, 2195","4,15", 사고 (교통 사고 포함) ,전신성의 질환,"통증,출혈",통증,408,5
Poodles(푸들),MN              ,2244,H,눈이 잘안보이는것 같다고 함. 청진 양호 mm pink crt sec 구강점막 건조 양안 백내장 hypermature 양안 결막 충혈 안압 od os 눈물량 od os 각막형광염색 혈액검사 고혈당증 소변 요당 확인됨 방사선 방광내 결석 의심 초음파 간에코 증가 담낭점액종 방광 슬러지 담낭점액종 백내장 당뇨 스테로이드 유도성 간실질 변화 당뇨관리 쿠싱 증후군 확인 담낭점액종 제거 필요 ,,, 당뇨병 ,내분비 질환 ,,,216,3
Maltese(말티즈),F,2126,B_W, 새벽 세시경 강직성 경련과 패들링이 번갈아 관찰되는 양상의 발작 균형을 잘 잡지 못함 눈이 풀리고 침을 흘리며 일어서지 못함 며칠 전 타 병원에서 기관지염 약 처방받아 투약중 어제부터는 항진균제 같이 복용 당시 방사선상 간비대 관찰되어 혈액검사 권유받으셨으나 진행하지 않음 발작은 처음 발작 지속시간은 time 정도 한시간 간격으로 회 발작 내원시 고유자세반응 있으나 제대로 기립하지 못함 deep pa,,16, 경련 발작 (원인 미정) , 신경 질환 ,발작,발작,226,0
Mixed(혼합),,2031,F_센트럴,s month time 댁으로 들어옴. 길고양이 아닐 가능성. 초기 식욕 양호. 대변 정상. 오늘 식욕 저하. 어제 호흡 힘들어함. 오늘 개구호흡. 방사선 상 흉부 radiopaque. 우측이 심함. probnp 양성. fpv 음성. 초음파 상 흉수. 흉수 tp 누출액. 혈액검사 상 g ratio 폐부종. 산소 입원. 흉수 time제거 후 호흡 개선. 이뇨제 furose time kg 처치. ,,"35,1201", 폐수종 (원인 미정) , 호흡기 질환 ,"개구호흡,흉수",개구호흡,221,10
