품종,성별코드,주진단명코드,병원,SE,기타진단코드,기타증상코드,주진단명,질환,증상명,주증상명,len,label_id
Maltese(말티즈),F               ,2133,H,ct.midazolam time propofol time 진통수액 케타민 time c.c 떨고 헥헥거림 뒷다리 파행 hx. 강서종합동물병원 췌장염 신부전 상상임신 결석 등 감별진단 목록 들음 혈액검사 엑스레이 초음파 결과 뒷다리 잘 못씀 app 양호함 att 이전의 vomiting 그저께 회 diarrhea none 어제 변을 안봄 강서 채수인 원장님 통화내용 기운 없고 몸을 떠는 주증으로 내원 엑스레이 특이소견 없음 초음파 상 췌장염 신장결석 커진 난소 관찰됨 추가 검사는 원하시지 않으셔서 못하심. 췌장염에 의한 통증으로 가진단 후 메토 가바펜틴 트라마돌 피디에스 time주사처치함 month 간 통원하며 주사처치 호전 없어 날 혈액검사하였으나 특이소견 없었음 time 날 보행장애 관련된 증상에 대해 뇌신경계 디스크 가능성도 있다고 설명드림. pe bw kg auscultation normal mm pink dry crt sec skin turgor sec dehydration ataxia rt. hl proprioception lt. hl 지연 blood work dehydration 외 특이소견 없음 urinalysis usg money protein sediment nrf ray us 신장결석 현재 큰 문제는 아님. ct t l 디스크 물질의 척수압박소견 확인됨. l 부위는 약간 좌측 편측 나머지는 대칭적 형태로 척수 압박하고 있음. 압박률은 내외 보호자 상담 내용 수술이 적합한 상황은 아니어서 내과적인 처치와 한방재활치료를 하기로 함 보호자분이 원하시면 수술은 가능하다고 안내함 입원 이유 운동제한을 위해 최소 month 일 입원 재활 및 한방 치료를 매일 집중적으로 실시함 내과적 처치 탈수 및 식욕저하 의 개선 단 식욕부진 분비불안 증상 등 입원하기 부적합할 시 퇴원 증상개선을 보이는 징후 자발 배뇨 deep pain개선 고유자세반응의 개선 보행 개선 치료 입원 초기에는 탈수 보정과 통증 완화에 중점을 둬서 할 예정임 마취 후 통증 호소를 보이면 진통 수액으로 교체 그 이후 물리치료 한방치료 한약등 필요한 부분을 선택해서 하기로 함 입원 비용 진통수액과 검사 제외하고 하루 money 검사가 필요 할 시 말씀드리고 진행 물리치료 온찜질 massage laser th. moxa 가미귀비탕time bid 보중익기탕time bid 통수전 time kg bid ,,, 상기에 해당하지 않는 신경계 질환 , 신경 질환 ,,,1171,6
Scottich Fold Cat(스코티쉬 폴더 고양이),MN              ,2095,F_센트럴,c.c 혈뇨. 기력 저하. flutd로 month 전 부터 타 병원에서 치료 받으심 이렇게 기력 저하 되면서 식욕 떨어지는 경우 처음 확인. 검사 상 폐쇄성 flutd 하루 입원하여 경과 관찰. ,x,"8,28", 고양이 하부 요로 질환 FUS · FLUTD , 비뇨기과 질환 ,"혈뇨,기력저하",혈뇨,109,1
Pug(퍼그),F               ,2126,D_VIP, 해동물병원 리퍼 위 내 이물로 해동물병원에서 리퍼 금일 아침 밥 time 에 먹고 오전 time 까지 괜찮았음 time 이후 구토를 하기 시작하였고 물토를 한다고 함 해동물병원에서 분변검사했는데 이상없었다고 함 검사 및 수술 차 내원 alert bt hrrrbp 방사선 위내 이물 확인됨 오후 수술시작 수술 종료 이물 고무줄 튜브 및 튜브 뚜껑 플라스틱 조각 나왔음 보호자분 전화통화 완료 의뢰병원은 너무 늦어 내일 전화드리기로 함 month month 정도 입원기간 안내하였고 비용은 money 전후 안내함 복부초음파 by hyuna findings 담낭 벽 비후 비장 꼬리쪽의 저에코 결절 개 발견됨 위내 이물 관찰됨 소장 및 대장에서는 관찰되지 않음 좌측 신장 수질의 작은 결석들 방광 내 다량의 부유하는 결석사 팽만되어 있어 벽 비후 여부는 추적검사가 필요함 imaging dx ddx gallbladder gb edema cholecystitis splenic nodule nodular hyperplasia primary malignant neoplasia stomach gastric foreign body lk ub urolithiasis ,,, 경련 발작 (원인 미정) , 신경 질환 ,,,591,0
Maltese(말티즈),M               ,2133,G_부천이지,리셉션 신규 어덜트 환자상태 내원목적 경련 식욕상태 좋으나 최근 식욕떨어짐 활력상태 급 떨어짐 month 배변배뇨 배뇨정상 최근 묽은변 산책횟수 분 회 주 환자 평소 성격 마이크로칩 유무 예방의학 예방접종 종 코 켄 광 인 심장사상충예방 과거병력 혈액검사 없음 스켈링 없음 수술 없음 기왕력 없음 현재관리상태 급여사료 종류 간식 보조제 복용중인 내복약 안먹음 기타 보호자 요구사항 month 전에 발작 증상 시작 수회 발작 발작 하면서 배뇨 증상 보임 발작중 의식 없는것 같음 발작 지속시간은 초 정도 지속 이후 month 정도는 발작 없었음 다음엔 month 회 정도 발작 동영상 촬영 함 발작중에 강직성 으로 가만히 누워 있음 사지가 뻗은 상태로 발작 보임 침흘림 특징적인 상황에 발작 하지는 않는것 같음 발작이 멈춘 바로 직후엔 보행이 흔들림 발작이 멈춘후에는 정상 보행 추가 접종 안됨 사상충 예방중 보호자분 요청으로 병리학적 검사를 실시함 초음파 검사 방사선 검사 혈액 검사 뇨검사 뇨비중 감소 다음 다뇨 증상 있다고 함 발작의 원인 파악 안됨 뇌신경계 질환가능성 있음 mri 촬영 권유 보호자분은 당분간 항 경련제 투약 원함 투약후 경련 상태 확인 권유 내복약 처방 조니사마이드 time kg 파모티딘 time kg 베스타제 bid ,,16, 상기에 해당하지 않는 신경계 질환 , 신경 질환 ,발작,발작,640,6
Maltese(말티즈),F,2116,C_잠실ON,cc 유선종양 작년 겨울에 유선종양을 일부만 제거 다시재발함 유선 종양이 점차 커지고 있음. 안으려 할때 비명 지른 적 있음. 심장약 먹이신 지 year 정도 경과. 심장비대증과 관련하여 . 신체검사상 번 유선에 걸쳐서 유선종양이 분포. 현재까지 번에는 유선종양 확인되지 않음 . 심장초음파 검사상 좌심실 심근 비대 및 대동맥판 협착증 의증 소견 확인됨 심전도 및 혈압 양호하나 혈압이 흥분시에도 높지 않아 수술시 저혈압 가능성 있음 높은 혈전 수치는 유선종양으로 인한 상승 심질환으로 인한 상승 의 가능성 있어 수술 전 후관리가 필요할 것으로 판단 sdma 검사 결과에 따라 신기능 최종 판단 . 희망동물병원에서의 심질환 처치에 따라 수술 여부가 결정될 필요가 있음. 처치 전에 심질환이 많이 진행된 상태였다면 수술로 인한 기대수명이 크지 않을 수 있음. 반면 처치 전과 현재가 동일한 상태라면 심질환은 정체상태로 유선종양을 수술하는 것이 기대 수명을 늘일 수 있을 것으로 보임. 다만 환자가 초 고령에 심질환이 있어 마취 위험성은 상당할 것으로 보여 보호자와의 충분한 상의가 필요함. ,,, 유선 종양 / 유방 종괴 , 생식기 질환 ,,,553,8
Russian Blue Cat(러시안 블루 고양이),FS,2095,B_W, 오늘 아침에 소변을 방울방울 지리고 여기저기 지린 소변에 혈액이 비침 화장실 자꾸 들락거림 그동안 변은 간혹 묽었으나 식욕 기력 좋았고 구토 없음 방사선상 방광에 소변이 충분하지 않아 일단 수액처치 후 요검사 진행하기로 신장에 결석 의심되는 이물 관찰됨 초음파상 방광벽 비후 방광내 슬러지 cbc hb hct 살짝 상승 bga na 종 으로 살짝 낮은,2088,9, 고양이 하부 요로 질환 FUS · FLUTD , 비뇨기과 질환 ,배뇨실금,배뇨실금,197,1
K.C(Korean Cat),F,2048,B_W, fip high positive 복부초음파상 자궁 난소가 확인되지 않음 다음주 day 날 내원예정 ,,2, 세균성 장염 , 소화기 질환 ,설사(급성 소장성/급성 대장성/만성 소장성/만성 대장성),설사(급성 소장성/급성 대장성/만성 소장성/만성 대장성),56,7
Maltese(말티즈),MN              ,2133,G_부천이지,라임 의뢰 사지마비로 걷지 못함 사지 마비 증상 오늘 아침부터 증상 보임 어제까지는 정상적인 컨디션 특별한 원인 없음 촉진시 특별한 소견 없고 통증 반응도 없는것 같다고 함 산책이나 다른 음식 먹은 경력 없음 month 전에 우측 뒷다리에서 진드기 한마리 제거 pe 의식상태 양호 plr 양호 목 견인시 특이 소견 없음 사지 통증 반응 양호 보행시 비틀거리고 쓰러짐 우측 뒷다리 atxia 증상이 심함 지 모두 ataxia 고유 자세 반응 없음 four limb 상담 뇌신경계 문제 가능성 있음 mri 촬영 권유 진드기 마비 의심 기본검진후 며칠 지켜보면서 관찰 권유 상태 악화시 심할경우 호흡근 마비로 사망 위험성 설명 증상 악화시 바로 mri 촬영 권유 진드기 매개 질환 확인 권유 검사 혈액 검사 사상충 검사 전신 방사선 검사 초음파 검사 뇨검사 방사선 흉부 심장 크기와 실루엣에 특이 소견 관찰되지 않음. 폐에 특이 소견 관찰되지 않음. 복부 간이 늑골궁 내에서 관찰되어 소간증 의심. 비장 비대 소견 보이지 않음. 소장은 대부분 가스로 차서 관찰되나 비정상적으로 확장된 소견은 없음. 내림 결장이 변으로 차서 관찰되나 비정상적인 정도가 아님. 방광은 중등도로 차서 관찰. 척추 사이 배쪽으로 작은 골 밀도 음영 관찰되나 이는 배쪽으로 탈출한 디스크 골화 음영 혹은 폐에 osteoma 와 같은 양성 병변으로 의심됨. 배쪽 디스크 탈출은 임상 증상에 보통 큰 영향을 주지 않음 그 외 특이 소견 관찰되지 않으나 방사선 상 rule out은 불가하므로 ct 혹은 mri 촬영 추천. 사지 전지 shoulder elbow carpap joint 에 특이 소견 관찰되지 않음. 양측 hip joint에서 cranial acetabular edge에 osteophyte 의심 음영은 관찰되나 laxity 의심 소견없으며 대퇴골 head and neck 에 변화 소견 관찰되지 않음. 그 외 특이 소견 관찰되지 않음. 초음파 비장 크기와 실질에 특이 소견 없음. 췌장이 다소 고에코로 관찰되나 직경은 정상 범위. 방광 내 슬러지 소량 관찰되나 벽에 특이 소견 관찰되지 않음. 복강 내 림프절 비대 소견 관찰되지 않음. 처치 산소 공급 수액 처치 타우린 파모티딘 time kg bid 오후관리사항 food 식사종류 양 일반사료 반그릇 식욕상태 없음 급식방법 자발 urine feces etc 치료 및 상담내용 tx e ,,"13,1303", 상기에 해당하지 않는 신경계 질환 , 신경 질환 ,"허탈(붕괴),운동실조",허탈(붕괴),1184,6
Shih Tzu(시추),M,2031,D_VIP, month time money 수납완료 황세정 재진 의뢰병원관련 중간 통화여부 보고내용 원장님 요청사항 기침 병력 있음 스테로이드 복용이후 기침 개선 어제 구토 소고기 사다가 먹이셨음 소화되지 않음 음식물구토 식욕은 점진적으로 감소한 것 같다고 하심 금일새벽부터 호흡곤란 신체검사 hr회 rr회 bp systolic heart murmur grade 전반적으로 crackled sound 청진 dyspnea 혈액검사 leukopenia elevated activity of alt alp bun 영상검사 방사선검사 by joohee findings 이전 검사 와 비교하여 심장 크기의 유의적인 변화 확인되지 않음 폐야의 interstitial to alveolar pattern 확인됨 특히 우측 후엽 imaging dx ddx pulmonary edema pneumonia 복부초음파 full scan by joohee findings 간의 불균질한 실질 확인되며 고에코성 결절 확인됨. pv 주변 불규칙한 고에코성 변화 담낭의 슬러지 확인되며 담낭벽의 mucinous hyperplsia 의심 소견 확인됨 비장의 저코성 결절 확인됨 양측 신장 에코 상승 확인되며 수질의 석회화 소견 확인됨 전립선의 불균질한 실질 및 cyst 확인됨 불규칙하며 비후된 방광벽 확인됨. 내강 양호 imaging dx ddx hepatic nodular hyperplaisa cholangiohepatitis gb mucinous hyperplasia cholecystitis splenic nodular hyperplasia lymphoid hyperplaisa neoplasia nephrocalcinosis ckd nephritis bph prostatitis prostatic cyst cystitis previous ddx cpe pneumonia steroid hepatopathy leukopenia infection 유의 tx furosemide time kg sc time kg iv 후 time kg time h 로 cri 시작 cefazolin time kg iv tid enrofloxacin time kg sc tid famotidine time kg iv bid 호흡수 모니터링 하며 이뇨처치 지속 내일 흉방 재촬영 후 furo 감량 여부 결정 cbc 리첵하여 wbc 재평가 ,,"14,21", 폐수종 (원인 미정) , 호흡기 질환 ,"호흡곤란,식욕부진, 식욕저하",호흡곤란,1167,10
Maltese(말티즈),MN,2181,B_W,s 어제 오후 산책 중간부터 안아올리려고 하면 통증호소 새벽 time 이후 갑자기 떠는 증상 빈호흡 낑낑거림 외상 가능성 없음 이물 가능성 있음 산책시 뭐 줏어먹는지 확인 못했다고 평소 사료 위주 급여 접종은 완벽 무릎관절 좌측 문제로 관절약 먹고 있다 함 어제 산책시 좀 많이 걷긴 했음 간혹 빈호흡 후방부 요추 촉진시 심한 통증반응 관절가동범위 및 부중도는 정상이나 간혹 고유자세반응 지연되며 대퇴골 및 고관절 압진 또는 스트레칭시 통증반응 척추 및 골반 방사선상 통증부위에서 특이사항 관찰되지 않음 무릎관절 내외측 두께 살짝 다르나 슬관절 가동시 통증반응은 없음 흉부방사선상 특이사항 관찰되지 않음 복부방사선상 위십이지장 부위 확장 및 위내 경계 비교적 뚜렷한 내용물 관찰되나 조영시 이물이 확진되는 소견은 없음 cbc 특이사항 없음 전해질 na ph 외 특이사항 없음 종 외 특이사항 없음 lactate crp 장내이물 및 디스크질환 고관절 이상 가능성 설명함 운동과다에 의한 일시적인 근경련 통증 가능성도 설명 tx buto cepha iv metacam sc am 수액 ns taurine vit c 산소처치 일반장 입원 권유하였으나 보호자님께서 보험처리 가능하시다며 icu 입원 및 산소처치 원하심 금일 복부초음파로 이물 등 소화기질환 o 후 보호자님과 ct 또는 mri 촬영 상담하기로 함 tel 가 연결이 더 빠르니 이쪽으로 연락주세요 ,,4, 추간판 탈출증 ,근육 골격 질환 ,통증,통증,701,9
Maltese(말티즈),FS              ,2031,F_센트럴,증상이 좋지않아 재내원. 보호자분은 마산으로 데려가고 싶어하심. 폐의 밀도 증가가 관찰되는데 정황상 폐부종에 무게를 두고있음 crp 수치가 증가되어있어 다른 원인도 고려해보아야함. 입원하여 경과 볼 예정. 하루를 넘기기 어려울것같다고 설명드림. 오후 time 경 실신 방사선 검사 후. 실신 증상이 나타날 정도이니 상황은 좋지않다고 여러차례 설명드림 ,x,1601, 폐수종 (원인 미정) , 호흡기 질환 ,실신,실신,196,10
Poodles(푸들),M,2275,D_VIP,s 내원 time 전쯤 보호자가 안고있다가 떨어트림 왼쪽 편으로 떨어지며 머리도 같이 부딪힌듯함 낙상 직후 아이가 웅크린채 다리 뻗지 않고 경직되어 보였음. hr bpm bptime hg bt rr min plr normal 신경반사 양호 bimpl cbc wbc c bg alt lactate 방사선 흉부 폐출혈 소견 등 낙상 time 촬영 확인되지 않고 흉복 두부 골절 소견 확인되지 않음 산소방에서 안정화하며 모니터링시 추가적인 신경증상 관찰되지 않았음 신체검사상 양측 mpl 로 추후 검진 및 수술 상담 받아보실 것 안내. ,낙상,, 사고 (교통 사고 포함) ,전신성의 질환,,,297,5
Munchkin Cat(먼치킨 고양이),MN,2095,C_잠실ON,cc 혈뇨 배뇨곤란 퇴근하시고 생식기에 출혈소견이 있음을 발견하심 햝아가지고 바닥에 흥건하게 타액 혈액성 물질이 있는 상태 중성화한지 year 조금 안됐음 동거견 동거묘 없음 예방접종 사상충 해주고 계심 month 정도 전 부터 우는 횟수 정도가 많아졌음 스트레스 받을만한 요인은 없다고 하심 어젯밤에 화장실에서 배뇨상태 확인하셨음 오늘은 미쳐 확인하지 못하심 식욕 활력은 좋음 . 신체검사 복부팽만 처치시 흥분하면 개구호흡을 함 로비에서 회 구토 . 영상 복부xr 방광이 커져있는 상태 높이 time 길이 time 폭 time 초음파 병변부모니터링 방광이 커져있는 상태며 슬러지는 확인 안됨. 요도 개통성 없는듯 . 뇨검사 뇨스틱검사 단백질 백혈구 고장뇨 ph 뇨침사검사 direct 다수의 struvite성 결정 배 시야당 개 뇨침사검사 dq nrf 세균 확인 안됨 . 혈액검사 cbc nrf 혈액화학검사 신장수치 high margin bun creatinine globulin g 혈액가스검사 미약한 대사성 산증 ph 방광천자 약 cc 뇨 천자 산증 교정 용량 약 cc slow iv butorphanol time kg iv 이후 tramadol time kg iv famotidine time kg iv cepha time kg iv ,,"8,901", 고양이 하부 요로 질환 FUS · FLUTD , 비뇨기과 질환 ,"혈뇨,배뇨장애(통증, 곤란), 빈뇨, 이소배뇨",혈뇨,639,1
Poodles(푸들),FS,2091,C_잠실ON,오늘 버려진 아이 구조해오심 금일 저녁 time 경 구조 집에서 고구마 물 먹이심 살이라고 써있으나 살 이상으로 추정됨 정확한 상태 알고싶어하셔서 건강검진 실시 항체검사 심장사상충 검사 서비스해드리기로 함 내일 저녁에 오셔서 상태안내 받으실 예정 유기견 그냥 키우시면 안되어서 구청에 신고하셔야 한다고 안내드렸으며 키우실 상황은 안되어서 카라 등 단체 통해서 입양시키시려고 하심 dx 음성 항체검사 간염 파보 홍역 뇨검사 염증세포 다수 관찰됨 ,2195,, 방광염 , 비뇨기과 질환 ,,,248,4
토이푸들,FS              ,2116,G_부천이지, money 할인 후 금액 money 금일 money 수납 s. 중성화 및 스켈링 위해 내원 특이사항 없음 o. 번 유선 사이 약 cm 유선 종양 발견한지 한달 정도 됨 유선 종양 fna 핵대소부동증 중등도 이하 혈액검사 nsf 초음파 자궁내막증식 자궁내 anechoic 한 물질 흉부방사선 검사 심장 및 폐에서는 특이소견 없음 a. 자궁내막염 자궁수종 유선종양 금일 스켈링 유선종양 번 적출 ohe 진행 오후관리사항 food 식사종류 양 수술 후 금식 식욕상태 급식방법 urine feces etc tx cepha enro famo tramadol ,"2103, 2102",221, 유선 종양 / 유방 종괴 , 생식기 질환 ,"종괴, 혹, 낭종","종괴, 혹, 낭종",308,8
Maltese(말티즈),MN              ,2181,D_VIP, 심장평가 및 복부 전체 검사 소독 이후 발 사이에 덜 핥는 편. pu pd 없음. 작년 month 에 의인성 쿠싱 왔었다고 하심. p 청진 시 lt. murmur bp a cbc c alt ecg sinus rhythm bpm wave time pr qrs time qt st time axis 도 방사선 흉부 심종대 소견은 없음. 폐야 양호. 복부 간종대 신장 결석 및 디스크 사이공간 협소. 심장초음파 by hyuna findings mr mild mv remodeling mild 이완기능 양호 수축기능 양호 la 압력 양호 la ao ratio lvd ao ratio pr time physiologic pr ddx degenerative mitral valve disease mild comment 사내공유 영상의학과 서류 심장초음파 자료 내 엑셀파일 참고 복부초음파 by hyuna findings 양측 신장 피질 에코 약간 상승 신장 실질의 미세결석 및 석회화 방광 벽의 비후 mm 및 불규칙한 내벽 증식 비장의 다발성 저에코 미세 결절 전립선의 대칭성 비대 mild imaging dx ddx nephritis nephrocalcinosis urolithiasis cystitis splenic nodular hyperplasia recheck 필요 benign prostatic hyperplasia mvi ivdd susp. 심장 관련 검사 시 mvi 확인되나 아직 심장리모델링은 진행되지 않음. 약 투약은 보류하고 헤파카디오 및 오메가 보조제 복용 추천드렸음. 액티베이트 복용 중이심. 심장 정기검진 month 후 재검 추천드렸음. 복부 방사선 상 디스크 의심됨. 향후 증상 나타날 시 내원하기로 하였고 체중 조절 필요함을 설명드렸음. alp 상승 및 간종대 고려 시 쿠싱 가능성 때문에 복부 초음파 체크 하였음. 특이사항은 없으나 방광염 의심됨. 관련 증상 나타날 경우 내원 부탁 드렸음. 비장결절도 모니터링 필요하므로 month 간격 체크 필요함을 설명드렸음. alp는 골격유래일 수도 있음. alp유래는 isoenzyme 의뢰 가능함을 설명드렸음. ,"2001, 2091",, 추간판 탈출증 ,근육 골격 질환 ,,,1050,9
K.C(Korean Cat),F,2133,C_잠실ON, cc lethargy. seizure. month 전 차 접종. 기생충 예방 none. 저녁 time 경 이상배뇨. 동거묘에 의하여 사료 급여량 부족. glucose fip kit negative. 간수치 상승 확인. 보호자분 입원 원치 않아 퇴원조치. 병원에서 두시간정도 hd 수액 및 furosemide time kg mannitol kg iv. seizure 계속됨에 따라 diazepam 투여. 내,,16, 상기에 해당하지 않는 신경계 질환 , 신경 질환 ,발작,발작,227,6
Poodles(푸들),MN,2244,D_VIP, money 결제하셨습니다 준민 당뇨의심 최근 한달전부터 다음 다뇨 체중감소증상 보임 식욕은 없지는 않지만 잘 먹지는 않는다고 함 탈수 체중 kg 혈액검사 고혈당 alp 상승 mild anemia fructosamine 정상범위 산증 심한편 소변검사 뇨당 이상 케톤 복부초음파 full scan by hyuna findings 간 에코의 전반적인 상승 췌장 비후 time 및 에코 저하 imaging dx ddx hepatic fatty infiltration diabete mellitus acute pancreatitis 케톤성 당뇨 입원하에 산증해소후 인슐린 치료의 protocol 말씀드림 비용부담 하루에 money 정도 소요됨 으로 인해 하루정도만 입원후 통원치료로 전환하기로 함 금일 하루 충분한 수액처치 및 전해질 교정 속효성 인슐린은 오늘 저녁이나 내일 오전부터 적용할 예정 ,,"10,27", 당뇨병 ,내분비 질환 ,"다뇨/다발(다음),체중 변화, 체중 증가, 체중 감소 ",다뇨/다발(다음),442,3
K.C(Korean Cat),FS,2181,B_W,lameness 를 아직도 보임 특히 꼬리를 만지면 아파함 어제 저녁 time 부터 아무것도 먹이지 않음 아침에 물만 조금 먹음 ,2188,4, 추간판 탈출증 ,근육 골격 질환 ,통증,통증,72,9
Pekingese(페키니즈),MN              ,2091,F_센트럴,연구개 노장 확인. 마취 할때. propofol time 연구개 노장이 확인됨. 전체적으로 인두 및 비강 인두 주변이 비후되어 코고는 소리를 충분히 유발할 만함. 소변 자주 누는 증상 방광염 가능성 있어 투약 후 경과 보기로함. 병력 청취 상으로는 허리 디스크 때문에 조절이나 감각 이상으로 나타나는 증상으로 보임. ,x,10, 방광염 , 비뇨기과 질환 ,다뇨/다발(다음),다뇨/다발(다음),177,4
K.C(Korean Cat),MN,2091,C_잠실ON,cc 혈뇨 어제 밤부터 혈뇨 시간이 지날수록 옅어지는 중임 어제 저녁 식욕 양호 활력 양호 약간 변비가 있어서 month 에 한번정도 보고 있고 어제 변은 정상 혈액검사 bun globulin 방사선 nrf 초음파 신장 비교적 양호 좌측 신장에 time cyst 확인 방광벽 비후 없음 방광내 혈괴 확인 슬러지 없음 뇨검사 적혈구 백혈구 다수 세균없음 뇨스틱 단백뇨 확인됨 od 붉은색눈곱이 지속적으로 형성 더이상의 추가 검사는 안함 눈 같은 경우는 눈물량을 측정해봤으면 좋겠지만 고니의 비협조로 측정 불가 방광염에 준해서 치료 ,,8, 방광염 , 비뇨기과 질환 ,혈뇨,혈뇨,296,4
K.C(Korean Cat),MN              ,2031,G_부천이지, 오전관리사항 food d 개인사료 소량 안 먹음 urine feces f etc tx cefazoline time kg iv tramadol time kg iv vit time kg sc furosemide time kg iv 검사결과 방사선 검사 폐음영 어제와 비슷. 조금 줄어든 양상. 좌축 후엽 bulla. 초음파 검사 좌신 혈액교환 없고 위축된 상태. 우신 에코 상승. 방광내 소량 슬러지. 방광위쪽 복강 중간에 복막에코 상승 생화학검사 globulin 수치 정상으로 돌아옴. bun glu 상승. cpk 정상 이상이지만 여전히 상태 혈구검사 wbc 여전히 높은 상태 feline combo 음성 뇨검사 leu sg money 뇨침사 nrf 심장초음파 간단 심비대 초기 ddx lung pulmonary hemorrhage pulmonary edema bullae lt caudal lobe kidney lt kidney dysplasia peritonium peritonitis trauma lib fracture 금일 오후부터 이뇨제 지혈제 처치 중지 수액량 늘림 유지 배 오후관리사항 food d 개인사료 소량 안 먹음 urine feces etc tx cefazoline time kg iv tramadol time kg iv ,"2003, 2275",, 폐수종 (원인 미정) , 호흡기 질환 ,,,640,10
