품종,성별코드,주진단명코드,병원,SE,기타진단코드,기타증상코드,주진단명,질환,증상명,주증상명,len,diags_small_id
Shih Tzu(시추),FS              ,2133,G_부천이지,s 신장 관리 심장관리 작년 여름부터 내복약 투약하다가 괜찮은 듯 싶어 month 전부터 끊음 어제 배변보다 다리 강직 머리 젖힘 대략 time 정도 증상 발현 의식은 있었음. 오늘도 마찬가지로 배변 배뇨 중 번 동일 증상. 위와 같은 증상은 month 전에도 처음 발현 이후로 큰 문제없이 지냈음 신체검사 심잡음 기본 뇌신경계 rx 정상 혈액검사 상 ast ck 상승된 것으로 보아 신경증상에 의한 근경련 증상은 있었을 것으로 판단 의식이 있었다는 점 혈액검사 결과 고려 시 기저 질환인 심장에 의한 실신보다는 신경증상 가능성 높음 rx clopidogrel time kg sid po 실리마린 e 보호자분께서는 나이고려 mri 촬영까지는 생각치 않으심. ,,40, 상기에 해당하지 않는 신경계 질환 , 신경 질환 ,신경증상(이상행동),신경증상(이상행동),368,5
Chihuahua(치와와),M,2185,C_잠실ON, cc 파행 최근 애견운동장에서 month 전 많이 뛰어놀은 뒤로 파행 점점 진행 . 방사선 우측 탈구 이전 방사선 사진 비해 진행 . pe 신체검사상 파행 좀더 쉽게 진행 금일 우측 탈구 교정 수술 실시 좌측 진행여부는 지속적으로 지켜보기로 함 ,,23, 슬개골 (아) 탈구 ,근육 골격 질환 ,"보행이상, 파행(전지, 후지)","보행이상, 파행(전지, 후지)",138,7
Maltese(말티즈),MN              ,2092,E_24시아이, 미용한지 time 정도 됨 month 전부터 기침반사 점점 심해져서 내원함 밥은 잘먹고 노는것도 활발 어제 목욕시킴 식욕 활기 백신 사상충 rad 방광내 결석확인 기관지염 졸레틸 time 입원 month month 까지 입원기간동안 기관지염 처치 같이 연계하도록 안내. 보호자분 생각해보니 혈뇨증상과 소변 못보는것 같은 자세 취했다고 함. ce 입원연장가능성 열어놓음 . ,2020,"8,901,5", 방광 결석 , 비뇨기과 질환 ,"혈뇨,배뇨장애(통증, 곤란), 빈뇨, 이소배뇨,기침",혈뇨,209,1
K.C(Korean Cat),MN,2095,D_VIP, money 결재하심. cc 배뇨곤란 소변을 조금씩 흘리고 다님. 어제 저녁부터 방에서 지린내. 오줌을 방에 흘리고 다녔음. 닦아보면 약간 분홍색 갈색. 오늘은 화장실에 앉아서 울었음. 펠렛 화장실 사용. 동거묘 있음. 중성화 암컷. 접종상황 year 본병원에서 접종 한 후 접종 내역 없음. 그 동안 건강했고 다른병원 가신적 없음. 식욕 양호. 식이 일반건사료 캔사료. 활력 별로 안 움직임. 환경변화 아이가 좋아하던 의자를 바꾸셨음. alert bw kg bt no skin turgo delay 복부 방사선 full bladder. 방광내 결석의심. 좌측신장내 석회화 혹은 결석. 혈액검사 nrf 소변검사 usg money dip stick blood ptn ph wbc 도말검사 crystal rbc 다량. 국소마취 후 요도카테터 장착. 입원진행 및 수액 처치. 익일 초음파 진행 안내드림. 주치의 결정되면 오후 time 이후에 연락드릴 것 안내드림. 내과 by 현수 구석에서 웅크리고만 있음 전혀 음수와 식사 하지 않고 있음 입원 스트레스 극심한 편 보호자가 준 츄르 약간 핥아먹은 정도 뇨검사 재 실시 하였으나 이상 없음 간헐적으로 선혈뇨와 갈색뇨 번갈아서 나오는 중 환자 성격은 비교적 협조적인 편 수액속도 유지 배로 증량 복부초음파 urinary system by hyuna findings 양측 신장 종대되어 있으나 피질 에코 양호 신우확장 없음 좌측 신장 내 석회화 관찰됨 방광 내 다량의 결석사 관찰되며 방광 벽 비후 time 있음 imaging dx ddx urolithiasis cystitis 방광 세척 하고 나서 혈뇨 양상 지속되어 당일 하루 더 입원 결정 입원 스트레스로 식사 하지 않고 있어 익일 퇴원 예정이며 증상 재발시엔 재내원 필요 뇨침사 검사상에서는 감염체는 확인되지 않으나 확진 위해 뇨배양 의뢰중 내복약으로 항 불안제와 소염제등 처방하여 단기적으로 복용 환경관리 보호자 교육 추가문진 한 화장실 개 사용 개로 늘리시고 펠렛이나 모래 등 기호성 확인 필요 음수량 증진 위한 습식 사료 비만 관리 현재 bcs 목표 체중 kg 보호자분 당일 d stress 구매해가심 익일 담당의가 저녁 time 사이 퇴원 예정 시스테이드와 내복약 주시고 퇴원해주세요 보호자 상담은 이미 당일 진행하였습니다. time 이상 배뇨곤란 지속시 재내원 하라고 해주세요 재검은 month 뒤 주치의 로 잡아주시면 됩니다. 퇴원전 방광 세척 진행해 주세요 ,,"901,8", 고양이 하부 요로 질환 FUS · FLUTD , 비뇨기과 질환 ,"배뇨장애(통증, 곤란), 빈뇨, 이소배뇨,혈뇨","배뇨장애(통증, 곤란), 빈뇨, 이소배뇨",1213,2
Beagle(비글),F               ,2133,G_부천이지, month month 내원전에 통증 반응 나타남 month month 산책후 증상 나타남 산책후 집에서 덜덜 떨고 있었음 수면후 다음날 아침에 만졌을때 보호자 공격 month month 부터 일어나지 못하고 소리지르면서 깨갱 거림 진통제 투약후 상태 호전 진통제 투약 중지후 통증 반응 다시 발생 pe 불특정부위 촉진시 아파함 특히 앞다리를 드는 행위에 민감하게 반응 but 지 모두 촉진시에는 통증 반응 없음 떨림 증상 보행시 매우 조심스럽게 이동 고유 자세반응에 미약하게 반응 떨어짐 통증에 대한 반응 가능성도 있음 radiographic findings thorax nrf abdomen right cranial abdomen is mildly hazy. appendicular skeleton misc. ultrasonographic findings spleen body is mildly edematous hypoechoic. cranial abdomens peritoneum is mildly hyperechoic by the pancreas spleen ddx pancreatitis peritonitis splenitis spleen contusion spleen nodular hyperplasia spleen infarction ct 촬영 마취 케타민 cc 촬영 부위 목 흉복부 조영 iohexol time kg 비내 초음파 영상과 유사하게 조영 증강 없는 저감쇠 반응의 부분들이 긴 선 혹은 nodule처럼 확인 cervical 번째 경추의 dens는 정상적으로 확인. ct 검사상 척수실질내 이상소견 없음. abdomen 췌장 몸통보다 cranial쪽 위 유문부에서 십이지장으로 넘어가는 위치의 복막 지방 밀도가 ground glass 형태로 증가되어 국소적 복막염 소견. 비장 실질 전반적으로 두꺼운 선 형태로 조영증강이 잘 나타나지 않는 병변들이 다수 관찰. 특히 꼬리쪽에서는 판 형태로 병변이 넓게 나타남 sus. splenic infarction . 판 형태 병변쪽으로 들어가는 비문 위치의 혈관 주변 복막 지방 밀도가 증가되어 국소적 복막염 소견. thorax 전종격동내에서 cranial mediastinal ln sternal ln가 나타나나 심한 비대는 관찰되지 않음. 심장 앞쪽에서는 정상적으로 관찰될 수 있는 흉선 보임. 그 외 특이소견 없음. 처치 수액 처치 세파 time kg 트라마돌 time kg 암피실린 time kg 파모티딘 time kg tid 엔로 time kg sid 상담 복막염 상태로 사망 위험성 있음 대략 미만 복막염의 원인 파악 안됨 췌장 비장에 의한 복막염 가능성 설명 지속적인 monitoring으로 원인 파악 예정 통증의 원인은 현재 복막염에 의한 것으로 보임 ,,4, 상기에 해당하지 않는 신경계 질환 , 신경 질환 ,통증,통증,1361,5
Maltese(말티즈),F               ,2048,F_센트럴,cc 어제 부터 계속적인 구토 증상 어제는 회 이상 구토 간 수치 상승 및 crp 수치 큰 폭으로 상승. 분변 검사 상 정상세균총 붕괴됨. 초음파 검사 상 functional ileus 확인. 장염에 준하여 입원 처치 내일 까지 혈장 쓸 예정 입니다. ,x,"1,67", 세균성 장염 , 소화기 질환 ,"구토(급성/만성),간수치상승",구토(급성/만성),141,0
K.C(Korean Cat),FS,건강검진,B_W,cc. 종합검진 s. 스케일링은 진행하지 않는것으로 결정 특별한 증상없음. 보호자님 생각에 매우 건강하지만 검진진행원하심 심장사상충검사와 항체가검사 같이 진행하기로함. o. 검사상 특이사항없음. 위 내 헤어볼 의심물질확인됨 소변검사 진행예정이었으나 소변이 없어 진행하지 못함 항체가검사상 fhv fcv 항체 방어수준이하 a.p. 종종합백신 boosting 검사결과 메일로 전송해드림 ,,,,,,,214,9
K.C(Korean Cat),F               ,2275,F_센트럴,s 교통사고.운전중 길에서 발견 쇼크상태.호흡곤란 저혈압 대퇴동맥 미미 방사선. 폐반사도 증가 좌측 대퇴골두경 골절 p 둔부피부 손상. 피하 근막 노출. 임시봉합 . 세척 없이 포비돈 소독만 가볍게 함. . 처음 내원시는 발견 안됨.입원중 넥칼라가 벗겨져 다시 씌우는 과정에서 발견 time 고양이 상태 전화 드리기로 함. ,,"74,14,77", 사고 (교통 사고 포함) ,전신성의 질환,"쇼크, 저혈당쇼크,호흡곤란,골절","쇼크, 저혈당쇼크",181,8
Maltese(말티즈),F               ,2116,E_24시아이, 전부터 있었는데 유선종양이 몇달만에 커짐. 여러개 있었던것도 알고있음 식욕 활기 백신 사상충 안했음 a hw kit mf sx 유선종양 전적출 중성화 방광결석 졸레틸 time 박비용청구 박입원 퇴원시 내복약 time 분 나갈것 후처치 발사 술후 month 뒤 방사선평가 윤부원장님께 부탁하고 갑니다. 노령견이라 회복더디고 혈행장애로 술부 가운데 괴사되거나 지연시 입원연장 운 띄어놨으며 담당의 휴무고지했으며 후처치때 뵙기로 했습니다. ,2092,"221,76", 유선 종양 / 유방 종괴 , 생식기 질환 ,"종괴, 혹, 낭종,방광결석","종괴, 혹, 낭종",244,3
Maltese(말티즈),MN,2092,B_W,방광에 결석 재발 집안환경 보호자님 아침 time time 출근에 저녁 time 경에 퇴원함. 먹는 것은 사료와 껌 비스켓주는 상황 오줌이 노란 느낌에 화장실에서 소변을 봄. 보호자교육 물을 먹어야함 설명함. 하루에time l정도 먹을것. 수술후에 주기적인 요검사를 통해서 음수량 조절할것. 환경이 되는데로 진행 수술 방광절개후에 제거함. 결석 성분 의뢰 보냄. ,,9, 방광 결석 , 비뇨기과 질환 ,배뇨실금,배뇨실금,203,1
,FS,2048,B_W,s month 전부터 구토 헤어볼 식이성 구토 오늘 하루종일 식욕 없음 이물 가능성 전혀 없음 접종 꾸준히 하심 동거묘 마리 내원시 탈수 st 매우 지연 mmc 는 양호한편 plr 및 기타 반사는 모두 정상 방사선상 직장내 수분저류 외 특이사항 없음 fpv negative 복막염 키트는 진행하지 않음 cbc plt mild 한 감소 특이사항 없음 전해질 특이사항 없음 종 alt mild한 상승 amylase glu lactate 분변검사상 충란이나 병원성 세균은 관찰되지 않으나 장내세균총의 과증식 소견 tx metronidazole cri cerenia sc cime meto iv am 수액 ns taurine vit c 교정속도 유지속도 원내에서 진료중 수양성 설사 회 이후 구토설사 없음 내일 오전 다니시던 병원으로 이동하실 예정 이동시 검사결과 및 진료기록 모두 출력해주세요 ,,"1,2", 세균성 장염 , 소화기 질환 ,"구토(급성/만성),설사(급성 소장성/급성 대장성/만성 소장성/만성 대장성)",구토(급성/만성),441,0
Pomeranian(포메라이안),F,2126,D_VIP,발작으로 응급내원 time 전 발작하는것을 확인 time 정도 지켜봄 발작은 서서히 멈췄음 병원으로 내원 하면서 과흥분을 보임 침대에서 자고 있는것을 확인하고 쿵 소리가 나길래 확인해봤더니 침대밑에서 발작 하고 있었다고 함 침대에서 자고 있는 것 확인했는데 어느 순간 쿵소리와 함께 바닥에서 time 정도 전신 발작. 숨쉬는 것 힘들어하고 침흘리면서 경련보임. 안고 만져주니 조금씩 호전보임 p 내원 당시 alert 약간의 과흥분 체중 kg 추정 응급시 급하게 체크함 bt bptime hg plr delayed ou 그외 뇌신경 검사 모두 양호. 자세반응 모두 정상 a lactate nh blood gas ph hco beecf tx. mannitol kg iv for time susp. intracranial dz. 뇌외성 질환 감별 위해 추가로 방사선 초음파 추천됨. 연령 신체검사 신경검사상 뇌내성 질환일 가능성이 높으며 idiopathic epilepsy 다른 뇌외성 질환 배제된다면 mri 필요. 추가 검사 안내 및 금일 입원하 추가 경련 모니터링 추천드렸으나 집에 귀가하여 상태 지켜보고 추가 발작 있을시 내원하시겠다고 함. 내복약 처방 또한 보류하고 모니터링 하는 쪽으로 결정. 추가 발작시 바로 내원하셔야 하는 점 고지. 뇌압감압처치 후 plr 지연은 사라짐. f call ,,16, 경련 발작 (원인 미정) , 신경 질환 ,발작,발작,668,4
K.C(Korean Cat),FS              ,2275,G_부천이지, 오전관리사항 food 식사종류 양 수술할수도 있어서 금식중입니다. 식욕상태 급식방법 urine feces etc 오후관리사항 food 식사종류 양 d 고양이 d 식욕상태 핸드피딩으로 잘먹음 조금남김 급식방법 핸드피딩 urine feces etc 치료 및 상담내용 tx 진통수액치료 타우린 cefotaxime time kg iv bid famotidine time kg iv bid e 수술관련 상담 최원장님 환자관리 상담 dvm 박상현 ,,77, 사고 (교통 사고 포함) ,전신성의 질환,골절,골절,245,8
Yorkshire Terrier(요크셔 테리어),MN              ,2275,G_부천이지,s month month 경부터 우측 후지파행 증상 후지방사선 결과 우측 iliac body 골절. ischium은 acetabulum위치와 ischiatic tuberosity 앞쪽에서 각각 골절되어 골편이 생김. pubic symphysis의 골절이 있으며 그 외 pubic tubercle 위치에서도 골절이 있을 것으로 생각되나 정확한 위치 평가는 어려움. 골편들의 변연부가 blunt해진 것으로 보아 골절된지 며칠 이상 지난 것으로 생각됨. 좌측 sacroiliac joint luxation 의심 흉 복부방사선 결과 thorax thoracic inlet 위치의 기관 직경 감소는 redundant tracheal membrane 가능성이 높음. 심장 및 폐에서는 특이소견 없음. abdomen 둔부쪽에서 내부에 장내 가스로 생각되는 음영을 포함한 연부조직 종괴가 관찰되며 이는 perineal hernia로 보임. 복강내 방광 음영이 명확하게 관찰되지 않으므로 초음파를 통한 평가 추천. 복부초음파 결과 복강 장기내 특이소견 없음. 허니아 위치에서는 방광 전체 소장 결장 일부가 들어가있음. ct 결과 촬영부위 복부 골반 소견 lt. si joint lx rt.iliac body fx. rt. acetabulum fx. pubis and ischium fx pubis 일부 골편과 acetabulum에서부터 ischium tuberosity까지 연결되는 골편이 관찰되지 않으며 우측 ischium tubercle 크기가 좌측에 비해 현저하게 작고 변연 또한 울퉁불퉁함 year 전 수술과 관련있을 수도 . iliac body fracture 부위는 ct 검사상 피질골이 명확하게 생성되지 않고 골증식 또한 나타나지 않아 year 전 사고와 연관성은 떨어질 것으로 생각됨. 우측 patella나 무릎관절낭에서는 이상소견 없음. 골반골절 회음허니아 tx cefazolin time kg iv famotidine time kg iv tramadol time kg iv 내일 수술예정 e ct 촬영 후 최적의 수술방법에 대해 고려할 예정이며 재료비가 추가될 수 있음 술후 온전한 보행이 불가할 수도 있으나 통증이 있어 파행이 있는 건 아닙니다 필요에 따라 술후 재활치료가 진행될 수 있습니다 ,,23, 사고 (교통 사고 포함) ,전신성의 질환,"보행이상, 파행(전지, 후지)","보행이상, 파행(전지, 후지)",1118,8
Chihuahua(치와와),FS              ,2116,F_센트럴,cc 유선종양 수술 내원 혈액검사 탈수소견 방사선 nrf tx 유선 전적출 ohe drain 진통패치 time 개. k ketamine time propofol time ,x,221, 유선 종양 / 유방 종괴 , 생식기 질환 ,"종괴, 혹, 낭종","종괴, 혹, 낭종",95,3
Mixed(혼합),M               ,건강검진,D_VIP,hr bp 잦은 식후 구토증상으로 건강검진 진행 단백뇨 upc 검사필요함을 안내해드림. 추후 내원해서 진행하신다고 함. 눈물부족 재검 최근 아침 눈꼽이 많아졌다고 함. 일시적인지 진행성인지 확인위해 month 후 눈물량 재검합니다. 골반 슬개골 약측 고관절 특히 우측 및 슬개골 탈구 사이노퀸 캡슐구매하심 꾸준히 먹이세요 전립선비대 중성화 필요합니다. 치석도 많아 조만간 스켈링하면서 중성화 함께 하길 권유. 비장 mass 재검. 추적관찰합니다. 일단 month 후 재검합니다. 비소화기성 구토의 원인은 확인안됨 소화기성 질환 배제위해 내시경 ct 필요합니다. 상위검사에서도 문제없으면 나쁜 식습관으로 인한 위장기능장애로 봐야할듯. 혹은 위장보호 약물을 처방해서 경과보는 것도 방법입니다. 증상 잦아지면 다시 말씀하신다고 합니다. 영양불균형 걱정되어 컴플리비트 처방. 복부초음파 by hyuna findings 비장 실질 내 작은 저에코의 결절 . time 전립선의 대칭성 비대 imaging dx ddx splenic nodular hyperplasia benign prostatic hyperplasia comment 비장 결절은 양성일 가능성이 높으나 크기의 변화를 확인하기 위한 초음파 재검이 추천됩니다. 현재 구토와 관련된 위장관의 이상 소견은 관찰되지 않습니다. ,,,,,,,657,9
A.Cocker Spaniel(아메리카 코커),FS              ,2116,G_부천이지, 유선종양 수술위해 내원 혈액검사 혈액검사 상 특이소견없음 영상검사 담낭슬러지 자궁 무에코성 fluid로 인해 확장됨 방광 내 다량의 슬러지 소변검사 뇨침사 상 다수의 간균 확인됨 유선종양 악성도 있음 세균성 방광염 자궁수종 tx ampicillin time kg iv cefazolin time kg iv famotidine time kg iv tramadol time kg iv 금일 오후 수술예정 month 입원 e 기본 month 입원 술부 염증 생기는 경우 많아 이후 경과에 따라 추가 입원 필요할 수도 있음 혈액검사 상 특이소견없으나 마취사는 일어날 수 있음 ohe 유선 종양 수술 마취 프로포폴 cc 오후관리사항 food 식사종류 양 수술 후 금식 식욕상태 급식방법 urine feces etc tx cefa cc iv ampi cc iv famo cc iv tramadol cc iv ,"2103, 2091",221, 유선 종양 / 유방 종괴 , 생식기 질환 ,"종괴, 혹, 낭종","종괴, 혹, 낭종",447,3
Mixed(혼합),MN,건강검진,D_VIP,cc. 건강검진 배쪽 피부 더 퍼지지는 않음 그외 특이사항 없었음 alert bt hr rr no murmur no crackle bp 전신상태 nrf 피부 하복부 papule mild 눈 양안 경미한 충혈 stt os od 안압 os od 안저 nrf 구강 tartar 송곳니 유치 개 발치 필요 비강 nrf 근골격 nrf 심장 nrf 호흡기 nrf cbc nrf chem nrf ray 복부초음파 full scan by hyuna no remarkable findings ,,,,,,,266,9
Mixed(혼합),F               ,2133,F_센트럴,c.c 과호흡 호흡이 빠르고 의식이 흐릿함 year 전 사지강직 month 간 으로 c.t 검사한적 있음.뇌쪽에 문제가 있다고 함 특별한 치료를 하지 않았지만 이후로 괜찮았음 유기견 세로 추정 을year 정도 키움 입양당시 기초접종하고 이후 추가접종 안함 청진상 특이사항 없음 cdv.cpv test negative ray 폐상태 양호 장내 가스 chemistry azotemia 리파제 상승 간수치 상승 탈수 sono 자궁내 액체양 에코 입원중 신경증상 유연 diazepam time 회 phenobarbital time 추가 치료여부를 익일까지 결정하겠다고 함 ,,"1401,40,31", 상기에 해당하지 않는 신경계 질환 , 신경 질환 ,"빈호흡,신경증상(이상행동),유연",빈호흡,316,5
Poodles(푸들),MN,2126,C_잠실ON,cc vocalization unknown pain. hpi month 전부터 비명을 지르고 어딘가 아픈것 같은 모습 평소 구토가 잦음 이전에도 귀 스크레치 하는 증상 확인됨. 다음다뇨는 유년기부터 확인된 증상. 한쪽으로 기울며 걷는 증상 leaning history med vac trauma surg env food hypoallergenic. 어렸을 때부터 다음 다뇨증상이 있음. 신체검사상 back pain month 변 신경검사상 특이적인 이상 확인되지 않음 . 우측 눈 형광염색 확인됨 좌측 눈 확인되지 않음 눈물량 odos plr 우측은 약간 느리게 확인됨 좌측은 정상 양안 핵경화 확인 . 영상진단학 검사상 중증의 후두골 이형성증이 확인됨. 임상증상과의 관련성 클 것으로 판단됨 초음파 검사상 만성 신장 질환 소견 경미하게 확인됨. . 임상증상과 coms 가 일부 일치 하는 것으로 환자의 연령을 고려할 때 뇌종양을 반드시 감별할 필요가 있음 mri 검사 추천 mri 검사 실시하지 않을 경우 뇌압감압 처치를 추천함 익일 내원하여 입원할 예정. month 간. ,,4, 경련 발작 (원인 미정) , 신경 질환 ,통증,통증,546,4
Shih Tzu(시추),F               ,2133,H,초진 문진 어제 낮부터 보행이 이상하다고함. 가다가 주저앉음. cc 후지 보행 이상 hx 어제 저녁에 후지 보행 이상 발견 불특정한 통증호소 보임 phx 만성 피부염 environment indoor food vaccination deworming 이력 없음 pe mentation bar qar depressed stupor comatose bw kg bt hr bpm rr bpm bp mmhg cuff size mm crt skin turgor hydration bcs ga gait integ eent cv pmi grade jugular venous resp abd gi gu nerv ms pln etc rx blood works ua us 간의 크기 증가소견 담낭내부 상태 양호함. 신장의 내측 및 앞쪽 좌측 부신부위에 지름 time 가량의 원형의 종괴 내부는 불균질한 echogenicity 를 가지며 일부 석회화된 음영이 확인됨. 이 mass 에 의하여 좌측신장의 축이 시계방향으로 약간 틀어져 있음. 종괴에 의한 후대정맥 압박이 관찰됨. 신장의 피질 cyst 가 개 좌측에서 확인됨. echogenicity 상승. 신장의 크기나 변연의 상태는 비교적 양호해 보임. 우측 부신은 최대 직경 time 정도로 불균질한 echogenicity 를 보임. 좌측부신위치의 종괴평가와 후대정맥 유착이나 침습 여부를 평가하기 위하여 ct 촬영이 추천되며 fna 나 biopsy 검사가 필요하다고 생각됨. acth 검사와 부신종양여부를 확인하기 위한 lddst 검사가 필요함. dx ddx 경추 ivdd 요추 ivdd fce adrenal tumor 경추 요추 디스크 가능성 있음 복부 초음파상 부신 종양 의심됨 ct 촬영 및 치료 방향 결정 필요하지만 보호자분 우선 심경계 조제약 원하심 month 일 분 처방해 드림 ct 촬영은 고민해 보기로 하심 중간에 증상 악화되면 연락 달라고 말씀드림 tx comments ,,, 상기에 해당하지 않는 신경계 질환 , 신경 질환 ,,,962,5
Mixed(혼합),F               ,2170,D_VIP, 타병원에서 간수치 높았다고 함 특별한 증상은 없음 간수치 관련하여 검사 원하심 새밀린 복용중 혈검 alt 외 특이사항 없음 복초 nrf stt 간수치 관련하여 크게 걱정 안하셔도 될 듯합니다. 새밀린 복용 지속하세요 스켈링 하셔도 됩니다. ,,38, 치주 질환 / 치주염 (젖니 유전자 좌로 유래하는 것 포함),치아 및 구강 질환 ,,,135,6
Pomeranian(포메라이안),MN,2185,D_VIP,cc 남아중성화 금식완료 활력 식욕 양호 배변 배뇨 양호 한 쪽 고환이 다른 쪽보다 작으며 고환하강 확인하기 위해 초음파 실시함 털 밀었더니 보다 비슷한 사이즈로 명확하게 보임 청진상 특이사항 없음 혈액검사상 특이사항 없음 남아중성화 진행 오전 time 후처치 예약 ,,23, 슬개골 (아) 탈구 ,근육 골격 질환 ,"보행이상, 파행(전지, 후지)","보행이상, 파행(전지, 후지)",149,7
Poodles(푸들),FS              ,2170,G_부천이지, 오후관리사항 food 식사종류 양 식욕상태 급식방법 urine feces etc tx clindamycin time kg iv famotidine time kg iv ,"2286, 2288","61,6102", 치주 질환 / 치주염 (젖니 유전자 좌로 유래하는 것 포함),치아 및 구강 질환 ,"구내염,치주염",구내염,94,6
British Shorthair Cat(브리티쉬 숏헤어 고양이),MN,2170,D_VIP, 마취전검사 crea mild high mild anemia hct 신장에 대한 평가 필요하여 sdma 검사 의뢰. 치과 치은부종 치주염 치방 forl 확인되어 발치 및 봉합. 조직검사 스켈링 발치 후 내복약 처방. 구강소독약 month 회 소독 및 오라틴 month 회 염증부위 도포. sdma 상승시 신장 전반적인 검사 진행예정. 조직검사 결과에 따라 앞으로 치은 관리 방향 결정. 다음내원일 재진 결과상담 및 구강체크 ,Chronic kidney disease,, 치주 질환 / 치주염 (젖니 유전자 좌로 유래하는 것 포함),치아 및 구강 질환 ,,,237,6
K.C(Korean Cat),FS,2170,D_VIP,s 치과치료 잇몸의 심한 발적 출혈 구취심함 치아방사선상 전치아의 치조골소실 심함 송곳니 앞니 제외한 전발치 진행함 오늘 하루 입원후 내일 퇴원예정 ,,"26,222,38", 치주 질환 / 치주염 (젖니 유전자 좌로 유래하는 것 포함),치아 및 구강 질환 ,"구취,부종, 홍반",구취,83,6
