품종,성별코드,주진단명코드,병원,SE,기타진단코드,기타증상코드,주진단명,질환,증상명,주증상명,len,label_id
Jindo Dog(진도견),M               ,normal,F_센트럴,hx 어제 저녁 time 경 멧돼지에게 공격당하여 왼쪽 뒷발 골절 평상시 건강상태 양호 사상충 예방 잘 해주심 심한 통증 pe bar 왼발 지간부쪽 골절 사진참고 bw crp 상승 등 hw kit negative 내일 amputation 진행 month 정도 입원하여 치료진행 ,X,77,,,골절,골절,155,2
Pekingese(페키니즈),FS,2001,D_VIP, money 선결제 송이 통화 이후 턱 부위의 부종 및 후지 부종 등 보임 건대 재내원하여 입원 처치 및 대사성 산증 등 교정 pe 내원 당시 장액성 양측성 비루 양측 sm ln 종대 빈호흡 경미한 노력성 giv vi holosystolic murmur in lt apex to rt 양측 후지 부종 및 좌측 전지 부종 복압 항진되어 있으나 파동감은 없음 혈액도말 neutrophil toxic basophilic formy 복부초음파 full scan gi tract by hyuna findings 담낭 벽의 점액 축적 초기 점액종으로 판단됨 총담관 양호 양측 신장 피질 에코 상승 우측 신장의 크기 저하 lk ao ratio rk ao ratio 양측 신장 신우 위치의 결석 및 좌측 신우 확장 time 우측 부신 종대 time 후대정맥 침습 관찰되지 않음 췌장의 전반적인 비후 좌측엽 최대 time 및 에코 저하 위 확장 및 액체 저류 shadowing 관찰되는 선형 물체 관찰됨 간식 음영의 가능성 있으므로 보호자와의 면담시 확인 필요합니다. imaging dx ddx gb mucocele early chronic kidney disease urolithiasis hyperadrenocorticism acute pancreatitis gastritis gastric foreign body 심장초음파 kg by hyuna findings mr severe mv remodeling severe tr time tv remodeling severe pr time 이완기능 저하 stage a ratio edvi ref. 수축기능 양호 esvi ref. la 압력 양호 peak time la ao ratio lvd ao ratio ddx degenerative bivalvular disease pulmonary arterial hypertension problem list assessment 참고 만성경과의 ckd 상태외에 과거 건대 검사시보다 전반적인 상태 크게 악화 ckd 현재 초기 핍뇨기로 진입할 우려 있어 배뇨확인 중요 췌장염 심증도로 상황에 따라 심한 복막염 및 패혈증 진행 가능성 있어 초기 적극적 치료 필요 심장 중증도 이상의 mmvd tvi pah 확인되며 후지 부종의 추가적인 원인으로 생각됨 갑기저 가능성 무척 높아 병행 치료 중 전반적인 위장관 염 및 무력증 위내 이물 의심소견 치료 후 재평가 필요 부신종괴는 모니터링 기타 비강종괴 비염 담낭점액종 잠재적 방광염 cds 등 밤사이 ffp 투약 및 수액처치하면서 배뇨 호흡 부종 양상 등 확인하여 필요시 요도카테터 장착 익일 오전 보호자 재상담 유선 하여 치료 계획 변경 오전 검사 전해질 c cbc 필요시 흉방 ,만성신부전,6, 판막증 (의심 포함한 심장 잡음 + 심부전 증후 자), 순환기 질환 ,비강 분비 및 비출혈,비강 분비 및 비출혈,1342,9
Poodles(푸들),FS,2082,D_VIP, time 전에 외출후 보호자님이 피 섞인 구토물 발견하심 갈색성 사료소화추정 및 혈액 양상 오전에 연어 말린거 먹임 혈토 후 활력 저하 및 식욕 저하 보임 우유는 마시는 정도 당시 이물 이나 약물등을 먹은 것 처럼 보이지 않음 평소 이물은 잘 주어먹음 가끔 쓰레기통도 뒤짐 두달전까지는 빈발적인 공복성 구토를 함 두세달전에 사료를 변경 이후로 구토 호전됨 가끔 컥컥거리는 증상을 보임 보호자님 인사시 흥분할때 보이는 양상 정상 배변 배뇨 봄 다소 떠는 양상 보임 일주일전에 사료 변화 당시 gi 증상 없음 피하출혈반점 pe bar normal skt pink mm crt sec 구강내 출혈 없음 no abdominal pain 도 혈액도말 nrf 분변도말 nrf cpl 방사선 nrf hematemesis pancreatitis gastroenteritis 혈토를 주증으로 내원한 환자로 약 두달전까지 만성적인 공복성 구토를 보였던 이력있음 금일 검사상 cpl외의 기타 혈액검사 수치는 정상으로 확인됨 이물 섭취는 정황상 많이 의심되지는 않지만 완전 배제는 어려운 상황 야간 응급내원으로 복부초음파 진행하지 못함 혈토에 대한 원인으로 췌장염 원발 만성적인 구토에 대한 위장염 및 위궤양 발생과 이로인한 이차적인 췌장염 병발 이물에 의한 가능성 등으로 판단됨 입원 처치하여 급성췌장염 및 위장염 에 대한 처치 필요 안내드렸지만 보호자님 비용 부담과 내일 오전 내원가능하셔서 금일 항구토제 및 위장염에 대한 대증처치후 내일 영상검사등 추가 검사 진행 할 예정 tx cerenia cc kg sc sid sucral cc po rx metro kg sid meto kg sid famo kg sid tra kg sid amocra kg sid ,위장염,"101,28,21", 췌장염 , 간 · 담도계 및 췌장 질환,"혈토,기력저하,식욕부진, 식욕저하",혈토,863,20
Shih Tzu(시추),FS              ,2001,E_24시아이,부토파놀 amp hw kit mf ecg 호흡성부정맥 bg 패혈증 bp us 쿠싱 자궁축농증 난소낭종 좌측신장 쪼그라들었고 우측신장의 보상적반응으로 살고 있음 echo 폐성고혈압 tr pr 환자상태 때문에 다음번에 정확히 측정할것. 당장 중요한문제 자궁축농증 패혈증 underlying disease 쿠싱 폐성고혈압 보호자가 한솔이랑 본원에 중성화한암컷이라고 해서 자궁축농증 배제했다고 함. 쿠싱에 대한부분은 보호자도 인지 한솔원장님도 인지. 술전 보호자한테 자궁축농증에 대한 수술은 한솔ah 본원 어디서도 하셔도 된다고 말씀드리라고 초이스 원장님 다만 패혈증 상태로 본원이 더 적합할듯 . 한솔원장님이 자궁축농증 수술비 세게받고 본원에서 수술하랍니다. ,2001/2245/2087,"75,0", 판막증 (의심 포함한 심장 잡음 + 심부전 증후 자), 순환기 질환 ,"심잡음,기타 증상",심잡음,366,14
친칠라,MN,2095,C_잠실ON,cc month 전 부터 urinary incontinance. dribbling. 식욕저하. 활력저하. ,,9, 고양이 하부 요로 질환 FUS · FLUTD , 비뇨기과 질환 ,배뇨실금,배뇨실금,59,7
Shih Tzu(시추),FS              ,2133,F_센트럴, 사경 안구진탕 아침엔 별 이상없었는데 밤에 귀가하여 보니 증상발현 작년에 중성화 양측 외이도 만성염증 vestibule synd. 발생 원인 확인 위해 mri 촬영 권장 익일 오후 time 경 이안 mri 촬영 보호자 동반 예약 보호자분 mri 촬영 취소 증상이 완전히 해소되지 않을 수 있음을 고지 증상 호전 시까지 최소 month 소요 각막궤양 및 기저질환 발현의 가능성 고지 말초성으로 준하여 치료 시행키로 ,,"40,0", 상기에 해당하지 않는 신경계 질환 , 신경 질환 ,"신경증상(이상행동),기타 증상",신경증상(이상행동),232,12
Shih Tzu(시추),FS,2245,C_잠실ON, time lddst time 중성화 자궁축농증 아님 스켈링 치과방사선포함 실시하기로 함 고콜레스테롤혈증 고중성지방혈증 환자가 고지방 식이를 하지 않음 alp 상승 부신비대 고혈압 이후 더 낮은 혈압이 관찰됨 부신피질기능항진증 가능성 있음 난소낭종 중성화수술 실시하기로 함 ,,10, 부 신피질 기능 항진증 · 커싱 증후군,내분비 질환 ,다뇨/다발(다음),다뇨/다발(다음),153,5
Shih Tzu(시추),MN,2078,D_VIP, refer.다온 의뢰병원관련 진료전 전화완료 진료후 전화완료 초진일 전화 안됨 원장님 요청사항 급성 간수치 상승 및 황달 보여 담낭파열 가능성 평가 요청하심. 주호소 급격한 체중감소 기력저하 식욕부진 황달. 기립불가. 현증경과 month 이상 지속된 식욕부진과 급격한 기력저하로 병원 내원함. 원래 kg 나가던 아이. 아에 month 간 아무 것도 먹지 않았고 보호자 분이 부분적으로 강급했음. 심한 탈수 보인다고 들었음. 일주일 간 입원처치 진행했고 퇴원 하려던 중 담낭파열 의심되어 본원에 의뢰됨. 친정어머님이 키우시는 아이로 전후 사정 정확히 모르시나 이전까지 보행이나 다른 행동이상 등은 보이지 않음. 그 전 검진 병력 없으며 눈이 안 보여서 안과검진만 받은 적 있음. 시력 회복 힘들단 얘기만 들었음. toxicosis 가능성 없음. 뭐 먹었을 가능성 없음. pupd 있었음. 다온 ah에서의 경과 내원 당시 severe hypovolemic shock 상태. 공격적인 수액처치 진행 후 익일 폐수종 발생의심되었고 심장초음파 상 경미한 mr 확인됨. 이후 lddst 진행했고 쿠싱 진단하여 trilostane 복용 시작함. 점점 회복하여 퇴원 예정 중 금일 급격한 간수치 상승 및 황달 새로이 확인되어 담낭파열 감별위해 본원 refer 실시함. cefotaxime time kg bid tramadol time kg bid metronidazole time kg bid enrofloxacin time kg sid dalteparin iu kg bid pimobendan time kg bid trilostane time kg bid famotidine metoclopramide doxycycline 처방함. 신체검사 mental depressed bp bcs mmc yellow crt 혈액검사 cbc wbc hct plt crp c tbil alb nh electrolytes na cl dimer cpl 영상검사 복부초음파 finding ddx gb mucocele cholecystitis vacuolohepatopathy cholangiohepatitis chronic hepatitis ckd with bilateral renal calculi hyperadrenocorticism lt adg rt adg time peritonitis mild cystitis ub calculi chronic pancreatitis ascites echogenic comment 현재 복강내 가스로 모든 장분절과 깊은 곳의 gb wall 의 이상은 확인되지 않은 상태임. gb 파열의 근거가 명확치 않음. cholecystitis 소견이 확인되어 chronic inflammation 에 의해 gb wall necrosis 가능성은 배제할 수 없음. 만성 췌장염 소견이 확인되나 부종이 뚜렷하지 않아 현 복막염의 원인은 gb necrosis 에 의한 bile leakage와 초음파상 확인되지 않은 gi 문제등을 배제할 수 없음. gb wall rupture 진단의 골드스탠다드로 초음파 조영이 추천됨. ct 는 초음파상 보이지 않았던 gi 문제나 담관 확장을 확인하는데 도움이 될 수 있음. radiologist 윤학영 dvm phd dx ddx gb mucocele gb rupture obstruction susp. cholecystitis cholangiohepatitis peritonitis hyperadrenocortisism intracranial diseases neurologic sign head turn nystagmus 현재 담낭파열이 우선적으로 고려되나 명확한 증거들은 확인되지 않음. 오늘은 우선 안정화하고 내일 수치 변화 더 보일 시 다시 고려 예정. 현재로썬 마취 위험성 매우 큼. 수술 진행 시 마취 위험성 안고 진행해야함. rx 식이 royalcanin low fat liquid rer 내복약 pimobendan time kg bid po trilostane time kg bid po silymarin time kg bid po acetylcysteine time kg bid po same time kg sid po vit 그랑페롤 iu sid po tx 수액처치 s kcl time geq taurine ornipural vit vit hepamerz time hr fold nebulization ns acetylcystein 주사제 cefotaxime time kg iv tid metronidazole time kg iv bid marbofloxacin time kg im sid famotidine time kg iv bid ffp time kg cri 입원. 익일 tbil alt ast alp ggt 및 복초 진행. 필요 시 수술 고려될 수 있음. ,"Hpatitis, Hypothyroidism, Gall bladder mucocele, Hyperadrenocorticism","27,28,21,18,29", 담관염 / 담관 간염 , 간 · 담도계 및 췌장 질환,"체중 변화, 체중 증가, 체중 감소 ,기력저하,식욕부진, 식욕저하,황달,부전마비, 완전마비","체중 변화, 체중 증가, 체중 감소 ",2358,17
British Shorthair Cat(브리티쉬 숏헤어 고양이),F               ,미진단,G_부천이지,어제보다 컨디션이 안좋은것 같다 하심 츄르만 먹고 살료는 안먹음 균형을 잘 못잡는거 같고 기력이 없음 어제 드린 내복약 및 안약 처치 하심. no dehydration status deep pain 및 감각은 있으나 걷다가도 간헐적으로 쓰러짐 균형을 잘 못잡음 cbc leukopenia lymphocytopenia mild thrombocytopenia chemistry ag ratio 간수치 mild 상승 saa 상승 fiv felv negative 상담 현재 나타난 임상증상 및 혈액검사 결과를 토대로 fip 가능성 높다고 판단됨 보호자분께서 fip 에 대해 충분히 알고 계심. 일단 약먹이면서 지켜보고 안좋으면 안락사까지 고려중이심 pds 처방 후 추후 클로람부실도 처방 고려 인터페론까지는 비용문제로 원치 않으심 원내에서 d can 잘 먹음 동거묘는 당분간 다른집에 맡겨두신다 함 경구제 독시사이클린 time kg bid pds time kg bid 파모티딘 time kg bid ,,"13,21",,,"허탈(붕괴),식욕부진, 식욕저하",허탈(붕괴),499,18
A.Cocker Spaniel(아메리카 코커),F               ,normal,F_센트럴,다음다뇨 다식 증상이 있어서 검사 실시 혈액검사 nsf 요검사 nsf 요비중 money 이상 이어서 현재 다음증상은 정상 소견이라고 설명드림 현재 검사에서 다음다뇨다식과 관련된 특이 소견이 없어서 추가 검사 없이 경과 보기로함 ,x,"10,65",,,"다뇨/다발(다음),식탐",다뇨/다발(다음),127,5
Poodles(푸들),F,2130,B_W,집에와서 안주고 쿠션위에올려놓으자마 갑자기 기절 기립불능및 코마상태 전화주시고 바로 데려오심. 내원당시 긴장한상태이며 전화상 상태보다는많이 호전이 됨. 입주위와 얼굴주위 털에 알수없는 이물조각과 고춧가루등이 발견됨. 심장 및 혈액 검사상 특이사항 없음 복부 초음파상 특이사항 없음 두개뇌 질환 의심된는 상황으로 mri검사 필요할 것으로 보임 추후 증상 재발시 검진 진행예정 mri검사를 통해서도 진단되지않을 가능성 특발성 간질 등 말씀드림 ,,1601, 실신 및 허탈 (원인 미정) , 신경 질환 ,실신,실신,246,13
Miniature Schnauzer(미니어쳐 슈나우져),MN,2244,D_VIP, refer.서울종합 의뢰병원관련 진료전 전화완료 진료후 전화완료 금일 진단결과 안내드림. 원장님 요청사항 주호소 당뇨평가 체중감소 식욕부진 식욕은 있으나 먹지 못함. 구토 기력저하. pupd 현증경과 눈꼽이 자꾸 끼고 어제부터 구토 보임. 식욕은 있으나 구토 때문에 먹지를 못 함. month 간 안약 넣을 땐 눈꼽 안 끼나 중단하면 다시 눈꼽 낌. 그래서 month 전 재내원하였고 혈액검사 하고 주사 맞고 내복약 처방받음. 다음 날부터 구토 보이고 밥도 더 못 먹고 기력 매우 떨어짐. month 정도 기력 떨어짐. 잠만 많이 잠. pupd 심함. 물 매우 급하게 먹음. month 사이 체중이 조금씩 빠짐. 원래 kg 되던 아이. month 사이 급격히 체중감소 더 심함. 배변상태는 양호함. 관리 받는 질환은 없음. year 부터 키우심. 예방접종 어릴 때만 진행. hw 먹는 제제 간헐적으로 사육환경 indoor. alone. 사료 일반사료. 요근래 table food 많이 먹어서 편식 약간 하는 편. 신체검사 mental alert. hr rr bp bcs mmc pink crt 탈수평가 dehydration. delay skin turgor. no murmur no crackle. 혈액검사 cbc c hyperlipidemia 내원 시 혈당 전해질 fructosamine sdma 영상검사 방사선검사 imaging dx ddx hepatomegaly comment 간의 심한 종대 확인됨 복부초음파 full scan imaging dx ddx hepatic lipidosis secondary to diabetes peritoneal effusion peritonitis acute pancreatitis gastroenteritis comment 간의 전반적인 비대 및 에코 상승 환자의 연령을 고려할 때 당뇨 원발성 지방간의 가능성 높음 간 지방 사이의 미량의 복수 관찰됨 담낭 내 점액성 슬러지 관찰되며 담낭벽의 점액 축적은 미약하나 추후 점액종으로의 발전 가능성 있으므로 초음파검사로의 추적관찰 추천됨 췌장 우측엽의 에코 저하 및 비후 time 는 심하지 않으나 중상복부의 복막염이 중등도 이상으로 확인되며 복압 항진에 의해 췌장 좌측엽 관찰이 불가하므로 혈액검사 등으로의 췌장염 감별 필요 방광목 근위요도 위치의 소량의 고에코 슬러지 관찰됨 방광벽은 양호 위 및 소장의 운동성 저하 관찰됨 위내 다량의 액체 저류 췌장염 복막염에 의한 차적 염증성 변화의 가능성 있음 radiologist 이현아 dvm ms vip동물의료센터 영상의학과 과장 direct tel 내선 mail vip radiology vipah.co.kr 요검사 usg money ketone glu rbc 요침사 상 nrf dx ddx diabetic ketoacidosis protein losing nephropathy diabetic nephropathy susp. chronic kidney disease pancreatitis cholestasis dka 확인되어 입원 하 처치. pancratitis도 의심됨. 췌장염에 의한 형당뇨 가능성도 존재함. 향후 수치 및 증상 모니터링하며 지켜 볼 예정. dka의 경우 예후 불량할 수 있음을 고지함. rx 식이 d 소량 식이test tx 수액처치 plasma solution kcl time eq taurine ornipural vit vit fold. time hr 주사제 regular insuline iu kg im iu kg sc famotidine time kg bid iv metocloramide time kg bid iv maropitant time kg sid sc tramadol time kg bid iv metronidazole time kg bid iv 입원 하 당곡선 체크 예정. ,"췌장염, PLN","27,28,1,10", 당뇨병 ,내분비 질환 ,"체중 변화, 체중 증가, 체중 감소 ,기력저하,구토(급성/만성),다뇨/다발(다음)","체중 변화, 체중 증가, 체중 감소 ",1880,17
Mixed(혼합),M               ,2140,D_VIP, money 선납하셨습니다 세익 교상 산책 중 교상. 큰 허스키와 만난 후 time 산책 후 접종 심장 사상충 예방 완료. 구토 설사 없음. 어제 저녁에 밥 먹음. 평소 치료 받던 질병 없음. 우안 결막 부종 및 출혈. 전안방 출혈. 우측 시력 소실. 마취전 검사상 특이사항 없음. p 아이가 통증을 느껴서 마취 후 안구 상태 확인하기로 함. 결막은 심하게 붓고 손상입었지만 각막부분은 상처 보이지 않음. 안구 부종 가라앉히고 눈 안정화 후 눈 상태 다시 체크할 예정. 의뢰 병원 통화 외과적인 치료보다 입원하에 내과적인 치료로 이어간다고 설명 드림. ,결막부종,34, 포도막염 (홍채 염 / 전 눈 술 출혈 포함) , 눈 및 부속 기관의 질환,교상,교상,309,3
Maltese(말티즈),M,2001,C_잠실ON, cc syncope 심비대 진단 받으심 작년 봄 샵에서 목욕 후 기침 심해져서 병원가셔서 방사선 촬영 후 심장병 진단 받으심 원래 다니시던 병원 진단에 의해 상태 심각하지 않아서 약은 먹지 않으시다가 상태 악화되서 약 먹은지 time 정도 되셨고 month 전 새로운 약으로 바꾸심 오후 time 쯤 숨을 가쁘게 쉬고 끙끙대고 내원 time 전쯤 time 쯤 강직 경직 보임 이런 적은 처음 혈액검사 방사선 촬영 등은 이번해 봄 쯤이 마지막. 치석이 매우심함. 치석이 매우 심한편이라 응급상황 지난 후 아이 안정되고 심장에 무리가 가지않으면 검사 후 스케일링 하시는 것이 좋겠다고 말쓰드림. . 혈액검사 통해 전반적인 신체상태 평가 방사선 사진 촬영통한 심장 폐 등과 각종 장기 파악 . 청진상 murmur 심함 . 혈압 측정 불가 한 . 혈액검사상 cbc ghp 전해질 정상범위 가스검사상 호흡성 산증 관찰됨 . 방사선 상 심한 심비대와 폐수종을 보임 . 호흡 곤란과 호흡성 산증을 보이므로 산소공급 . 호흡 개선을 위한 이뇨작용 촉진 tx. furosemide time kg per time dopamin cri po제 pimobendan time kg spironolactone time kg ramipril money mg kg plan. 금일 저녁은 이뇨작용 촉진과 산소공급통해 호흡개선 후 내일 아침 호흡안정되면 복부 방사선 예정 심장병이라 예상치 못한 돌연사 등의 가능성 고지함 현재 아이 심장과 호흡상태는 매우 좋지 않으나 다행히 혈액검사상 간이나 신장 등 장기의 이상수치는 발견되지 않아 이뇨제 투여 등으로 인한 다른 장기의 부담 등은 다른 노령견들에 비해 좀 덜한 편입니다. 보호자분께서 이후 케어 궁금해하셔서 일단 처음에는 심초음파 통해 아이 심장의 정확한 상태 파악후 한달에 한번 또는 상태에 따라 그 이상or이하 정도 아이 장기 상태 임상증상 등 고려하여 검사 후 약타가시면 되고 자세한 사항은 응급상황 해결 후 내과 전문 원장님과 상담하시기로 아이 안정시까지 며칠간은 입원하셔서 케어하시는 편이 좋습니다. 어머니 전화번호 tel 따님전화번호 tel ,,1601, 판막증 (의심 포함한 심장 잡음 + 심부전 증후 자), 순환기 질환 ,실신,실신,1050,13
Maltese(말티즈),FS              ,2119,F_센트럴,cc 헥헥거림 떪 안절부절못함 가끔 증상을 보임 month 지나면 스스로 좋아짐 가끔 멍하게 있는 때도 있슴.서성거리며 배회하기도 함. 오늘은 유난히 헐떡임 증상을 보일때는 식욕부진 동반 흉부방사선.양호 혈검.대체로 양호 p 간질 가능성 설명드리고 주간에 내원하여 진찰받을 것 권유드림. 진정제 처방.칼미벳 아세프로마진 ,,"35,21", 간질 , 신경 질환 ,"개구호흡,식욕부진, 식욕저하",개구호흡,179,1
Shih Tzu(시추),MN              ,2133,F_센트럴, history 심장약 투약 중 최근 실신 혹은 경련 증상 반복 모견 경련 후 사망 소견 이후 선회 및 peddaling 증상으로 미루어 신경증상 의심됨 month 전부터 설사 혈액성 설사 오렌지 동물병원에서 심인성 폐부종으로 판단되어 이뇨 처방 계속 받고 있음 objective no pulmonic edema astasia recumbency stupor mental plr tactile severely elevated liver enz. hyperphosphatemia elevated renal enz. ce mortality rate 이상 dnr ,,"40,1601,33", 상기에 해당하지 않는 신경계 질환 , 신경 질환 ,"신경증상(이상행동),실신,떠는 증상, 경련 또는 미진",신경증상(이상행동),312,12
Russian Blue Cat(러시안 블루 고양이),FS,2087,D_VIP,s 섭식 문제 치아문제가능성 전보다 사료 먹을 때 부스러기가 나옴 구토 설사 없음. 식욕 매우 좋음. 킬로 조금 넘게 나갔음. 작년 month 검사 기록 crea bun 좌신 결석 신장 변형심함. 우신 위축 의심. 보조제 영양제 먹이시는 것 없음. 습식사료는 주 회 먹이시고 있음. 레날 사료 먹이시고 있음. chem bun crea elect nrf cbc no anemia usg money 등장뇨 upc normal range sdma 의뢰. 초음파 양측 renal atropy 방광은 양호함. iris stage np 신부전관리. sdma수치확인 후 재검주기 결정. ,,27, 만성 신장 질환 (신부전 포함) , 비뇨기과 질환 ,"체중 변화, 체중 증가, 체중 감소 ","체중 변화, 체중 증가, 체중 감소 ",321,17
Mixed(혼합),F               ,2091,D_VIP,기절 구토 외음부 삼출물 며칠 전 보호자분 몸살로 앓아누웠을 때 부터 계속 잠만 잠 이틀 전 새벽에는 놀다가 기절했음 의식 없었으며 외음부에서 노란 삼출물이 나왔음 전조증상 모호하며 금방 깨어나서 잘 다님 이후로 위액성 구토 회 있었으며 식욕 떨어져서 간식만 먹음 어제 정상변 본 이후 변은 없음 이물 가능성이 크지는 않으며 변 교육때문에 식초를 뿌려둔 적이 있었음 접종 예방 완료 alert vital sign 양호 mm pink dehydration no murmur crackles 혈액검사상 alkp 상승 두드러지며 crp 중등도로 높음 영상검사상 위벽의 두드러진 비후와 경미한 위확장 확인됨 간 실질 nrf 소장 nrf 복강 림프절 경미하게 종대됨 방광 내 다량의 슬러지 확인됨 질 도말검사상 다량의 염증세포 비각화상피 세균 확인됨 소변검사상 심한 세균성 방광염 확인됨 p 위염 세균성 방광염에 준해 내복약 처방합니다 위염 개선되지 않으면 조영검사 내시경검사 고려 세균성 방광염과 관련하여 항감수 의뢰중 방광염의 기본 치료기간은 month 이며 컨트롤 되지 않는다면 구조적 이상 확인 필요 기절 간수치상승 기절은 단회성의 이벤트이고 증상 모호해서 모니터 하기로 합니다. 간수치는 모니터 하되 개선되지 않으면 간기능검사 필요함 재발시에는 pss 배제 위한 ct 고려중 약 먹으면서 증상 개선 없다면 상위검사 및 입원관리를 위해 내원해주세요 재검 목 간수치 위벽비후 crp 리첵 의뢰병원 통화 완료 by 윤 ,"위염, 간수치상승","1601,1,24", 방광염 , 비뇨기과 질환 ,"실신,구토(급성/만성),삼출물, 분비물, 농루",실신,735,13
Doberman Pinscher(도베르만 핀셔),M               ,2014,G_부천이지,복부팽만 기침 하더니 일주일 전부터 복부팽만 운동 불내성 오래 전부터 증상 확인 복부 팽만 month 일 전부터 증상 확인 식욕 양호 변상태 양호 예방접종 사상충 예방 안됨 pe bcs heart murmur normal mucous men. 검사 사상충 검사 양성 혈액 검사 방사선 검사 초음파 검사 상담 심장 사상충에 의한 증상 치료 권유 일단 몇일정도 투약후 상태에 따라 치료 여부 결정 예정 내복약 처방 독시사이클린 time kg 에날라프릴 time kg 피모벤단 time kg 라식스 time kg 실데나필 time kg bid ,,"11,1302", 심장사상충(Heartworm disease), 순환기 질환 ,"복부확대(팽만),운동불내성",복부확대(팽만),301,8
