품종,성별코드,주진단명코드,병원,SE,기타진단코드,기타증상코드,주진단명,질환,증상명,주증상명,len,label_id
Maltese(말티즈),F               ,2046,G_부천이지,아침에 야채 먹고나서 갑자기 거품물고 경기 호흡곤란. 잠깐 괜찮아 지는듯 식욕 보였음. 잘 받아 먹음. 성격이 있어 동거견 아이들 밥을 뺏어먹는 정도. 식도이물 의심 원내에서 조영검사 시도중 seizure. 현증 식도이물외 기타 질환 가능성 높음. 혈액검사상 혈당수치 저칼륨혈증. 추가검사 필요함. 보호자분 다니시던 병원으로 이송 원하여 차트 전송. jjhn nate.com ,,"26,1", 소화관 이물 / 섭취 , 소화기 질환 ,"구취,구토(급성/만성)",구취,210,4
Maltese(말티즈),F               ,2274,G_부천이지,동거견에 물려 안구돌출 보호자분 요청으로 병리학적 검사 진행 혈액검사 상 두드러진 이상소견은 없음 sx 안구적출 응급수술 tx ampicillin time kg iv cefazolin time kg iv famotidine time kg iv tramadol time kg iv e 마취사 가능성 설명 수술 후 염증발생 안구 교상 시 구강 세균 감염이 있었다면 이로 인한 신경계 감염 가능성 있음 ,,34, 교상 (bite wound),전신성의 질환,교상,교상,222,3
K.C(Korean Cat),FS              ,2178,G_부천이지,침흘림 식욕 저하 움직임 감소 저작 못하는것 같음 회음부 쪽 염증 의심 초음파로 확인 예정 흉부방사선 검사 심장 및 폐 특이소견 없음. 복부초음파 검사 담낭내 다량의 sludge 관찰. 췌장 실질 전반적으로 균질한 고에코로 관찰. 임상적 증상과는 관련 없을 수 있음. 방광 전방 위치에 약 cm 길이의 불균질한 저에코성 원형 병변 주변으로 지방 에코 심하게 증가. 혈관화 되어있는 것으로 보아 림프절 비대 또는 임상 증상 없는 지방염 가능성. 이후 크기 recheck 권유. ct 검사 치아 주변 치조골 융해 나타날 정도의 치주질환은 관찰되지 않음. 우측 하악 어금니 골절로 치수강 노출. 잇몸 염증 심한 우측 상악 pm month 변 상악골 피지골 융해 의심. ct 찰영후 발치 예정 수술명 스케일링 및 발치 술전검사 결과 특이사항 chemistry cbc nsf electrolyte nsf ray nsf ct sono 차트내용 참고 수술전 처치 항생제 세파 진통제 트라마돌 fluid ns 마취종류 호흡마취 isoflurane 기타 잇몸 염증 심함 편도 주위 염증 심함 triamcinolon 피하 주사 처치 수액 처치 세파 time kg 파모티딘 time kg 트라마돌 time kg ,,"31,21,28", 구내염 / 설염 ,치아 및 구강 질환 ,"유연,식욕부진, 식욕저하,기력저하",유연,611,16
Mixed(혼합),M               ,normal,F_센트럴,cc 파행 보호자가 안고 있는중에 뛰어내림 . time 전 .파행 우후지 들고 다님 방사선.골절라인 없슴 신체검사시 오른쪽 무릎관절에서 십자인대 단열이 의심됨.draw sign 오후 time 에 수술계획과 구체적 비용에관해 전화 드리기로 함. 우측 경골 근위부 성장선 골절 확인되어 보호자 상담. 경골 조면도 변위가 있어 결출골절도 함게 발생된것으로 보임. plan month 정도 안정화 시키고 핀을 통한 고정 수술 예정. ,X,77,,,골절,골절,238,2
Yorkshire Terrier(요크셔 테리어),F,2043,D_VIP,cc hematemesis vomiting gen 어제 저녁에 캔을 줬는데 그걸 그대로 구토 그 이후에 아무 것도 안먹음 캔도 데워서 줬는데 먹는 족족 구토를 함 조금 전에 피 섞인 혈토를 함 원래 환경이나 온도에 매우 예민함 특히 비 오는 날 가끔 구토하고 함 diet major d can 사료 평소 minor 개껌도 month 에 한번 줄까말까 env 함께 사는 동거견이 있음 그 아이는 위장관 증상 없음 다른 아이들은 매우 좋음 prv hw vac all done ecto는 일부러 안하심 pmi 계속해서 재발하는 구토 non dehydration normal crt bt abdominal pain reflex 혈액검사 cbc nrf c nrf crp normal pt aptt normal kit 검사 cpl positive 췌장염 양성이나 키트의 색 변화가 미약하고 다른 정황상 급성 구토로 인한 일시적 상승으로 판단 됨 스트레스성 위장염 특별히 먹은 것도 없음 보호자분 중 한분이 외국에 나가셔서 스트레스를 받았을 가능성 항구토제 및 위장관 보호제 처방 후 recheck 내시경은 나중에 다시 증상이 보이면 하는 걸로 ,췌장염,"101,21", 위염 / 위장염 / 장염 , 소화기 질환 ,"혈토,식욕부진, 식욕저하",혈토,578,20
Abyssinian Cat(아비시니아 고양이),M,2279,C_잠실ON,cc 기력저하 식욕저하 오늘 종일 먹지 않음 뒷다리 약간 파행 우측 앞다리도 약간 파행 방금전에도 소변 대변 다 양호 shiverring month 전에 차 접종 실시 . 앞다리 관절 촉진시 통증호소 앞다리 파행 체온 방사선상 특이사항 없음 혈검상 백혈구 수치 만으로 다소 높음 범백 키트에 음성확인 청진상 특이적인 사항 없음 . 현재 범백일 가능성은 어느정도 배재되었지만 어린 연령임을 고려할때 지속적인 식욕저하는 위험할 수 있으므로 입원치료 진행하기로 함 식욕 활력 정상체온 되찾아서 집에서 통원치료 가능할때 퇴원하기로 안내. 최소 month 이상 입원권고. ,,3, 발열 (원인 미정) ,전신성의 질환,발열/고열,발열/고열,315,6
Mixed(혼합),FS              ,normal,F_센트럴,hit by car 다리쪽을 부딪혔다고 함 ray 좌측 경골.비골 골절 propofol time ,x,77,,,골절,골절,54,2
Pomeranian(포메라이안),FS              ,2021,E_24시아이,약으로 컨트롤이 잘 안되서 역곡 다솜동물병원 서울 퇴계로에 있는 병원 윤신근 스텐트 비용 에서 수술하기로 하고 금일 방사선과 혈액검사를 다 했다고 함. 입원 가능여부가 중요한게 아니고 환자 상태 호흡곤란의 여부 수술방법 나타날수 있는 상황이 충분히 논의 후 입원가능. 현재 기관협착에 대해서 많은 내과적 처치가 있으므로 본원 또는 타원에서 다시 진료를 받아보시는것을 추천드립니다. 엄마가 키우는강아지. 딸 자세히 모름 약을 먹이질 못했다고. 다솜에서 추천받은건 아니고 본인들이 윤신근에 알아봄 식욕 활기 백신 사상충 심잡음 crackle sound 폐수종 기관협착 폐수종처치 박입원 신부전등 신장수치 상승 또는 연장시 month 가능 이후 심혈관계 검사 기관경 및 협착성기침에 대한 평가 따로 수납 죽으면 폐수종 늦게 처치들어가서 약물에 반응전 산소부족으로 못견딘것입니다. 치사율 . ,2031,"75,5,14", 기관 허탈 , 호흡기 질환 ,"심잡음,기침,호흡곤란",심잡음,439,14
웰시코키,FS,2007,D_VIP, refer. 바른 의뢰병원관련 진료후 전화예정. 금일 day 이라 의뢰병원 원장님 통화안됨. 익일 전화드릴 예정. 주호소 심장검진 현증경과 month month 생. 집에서 출산. 어미와 형제 마리. 차 접종 차 바른동물병원에 내원. 청진 후 심장병 의심소견으로 리퍼. 예방접종 month 전 차 접종 완료. 구충제 복용완료. 사육환경 indoor. 동거견 마리. 어미 형제들 마리 사료 일반 건사료 신체검사 mental alert hr rr panting 흥분상태 bp bcs mmc pink crt sec 탈수평가 no dehydration continuous murmur 혈액검사 lactate cbc mild anemia hct 영상검사 흉부방사선 nrf 심장초음파 by hyuna findings 폐동맥 내 pda flow 확인됨 systolic time pv annulus 좁아져 보이지 않으나 rvot flow time s로 측정됨 mr tr 등의 역류 관찰되지 않음 mpa 확장 뚜렷하지 않음 ddx patent ductus arteriosus pulmonary stenosis dx ddx pulmonary stenosis patent ductus arteriosus pda 경미한 ps 및 pda 혈류 확인되나 심장 리모델링등은 아직 진행안된 상태. 식이변화 내복약 없이 유지하며 증상 모니터링. 수술 가능한 시기까지 정기적인 recheck 필요. month 후 심장초음파 재진 예정. 보호자님께서 전화예약 하기로 함. pda 수술 필요 시 month 령 이후 수술 가능성 안내. 수술비용 필요시 ct 진행 및 ct 비용 추가됨 안내드림. 그동안 아이컨디션 모니터링 당부드림. shortness of breath coughing weakness exercise intolerance 증상 안내. ,PS,75, 동맥관 개존증 · PDA , 순환기 질환 ,심잡음,심잡음,904,14
Mixed(혼합),F,2073,D_VIP,cc 유연 어제부터 침흘림. 어제 아침에는 얼굴이 젖을 정도로 유연증상 보임. 오늘은 유연 덜해짐. 신경증상 없었음. 산책 다녀온 바로는 별 이상 없었는데 그 날 저녁에 자고 일어나서부터 유연증상이 심하게 일어났다고 함. 활력 양호함. 식욕 양호. 배변 없음. 구토 없음. 체온 양호. 청진 양호. mental alert. 구강 검사 시 특이사항 없음. 혈액검사 cbc c 특이사항 없음. 방사선 검사 nrf 유연 구강 내 문제 가능성 떨어질 것으로 생각되며 보호자 분 관찰 시 신경증상이 동반 되지 않아 경련 전후증상으로 보기도 어려움. 산책 시 독성물질이나 이물 섭취에 따른 일시적인 유연증상으로 우선 고려됨. 검사 상 특이사항 없어 우선 gi 관련 내복약 처방하고 지켜보기로 함. ,없음,31, 상기에 해당하지 않는 소화기 질환 , 소화기 질환 ,유연,유연,384,16
Maltese(말티즈),F               ,2031,F_센트럴,저녁부터 호흡이 빨라짐 심장병 치료한지 year month 정도 호흡수 회 분 ray 폐우엽 방사선 비투과성 chemistry 탈수 백혈구 증가 crp증가 ,,"1401,2222", 폐수종 (원인 미정) , 호흡기 질환 ,"빈호흡,폐부종",빈호흡,87,11
Chihuahua(치와와),M               ,2073,E_24시아이, 집에 마리 키움 퇴근하고 오니 혈변증상 마리 분변검사상 장염소견 단순처치 받음 이틀전 오늘 퇴근하고 오니 혈변증상이 아주 심해서 기운없어서 내원함 혈변을 찌끔찌끔 쥐어짜는 행동을 합니다. 접종 all done 어제까지 잘먹음. 구토 증상 없었음 사료만 급여하는 상태임 식이관리 하는 편 가끔 모량때문에 닭가슴살을 먹임 식욕 활기 백신 사상충 방사선상 장내가스음영 췌장염 음성 crp 장염 month 입원권고드렸으나 보호자가 우선 내복약 처치연계 구토증상 없다고 했는데 병원에서 나갈때쯤 구토함. ,,42, 상기에 해당하지 않는 소화기 질환 , 소화기 질환 ,혈변,혈변,278,19
K.C(Korean Cat),FS,2170,D_VIP, money 선납 종인 구조묘 year 전쯤 구조 구내염 병력있었음 time 이후 혈토 보이고 바로 내원 month 전부터 식욕없음 눈꼽 끼는 증상도 month 전부터 혈액 덩어리가 나오는 양상 아이 예민하고 구석에 숨어지내서 병원 잘못데려오심 여러마리 키우셔서 배변 모니터링 힘드나 설사소견없었음 탈수 기력없음 rad 위 십이지장 가스팽만 소견 cbc 백혈구 증가 간단한 혈액검사상 백혈구의 심한증가소견 관찰되며 구내염 외 추가적인 염증소견 발견될 수 있고 추가적인 혈액검사 필요함 진정이 안된상태에서 구강검사가 힘들며 아이 상태가 안좋아 마취진행이 어려워 구내염으로 인한 혈토감별이 힘듬 방사선상 위 및 소장의 팽만소견을 동반하며 위내 이물 장중첩 등을 의심할 수 있으며 정확한 진단을 위해 초음파검사 필요함 기력저하 및 탈수 심한상태라 입원처치 진행하며 주치의 결정 후 추가적인 검사 및 치료플랜 안내 예정 time 이후 주치의 정해지면 안내예정 아원장님 진료 원하십니다 보호자 김규연 이혜란님으로 변경 복부초음파 full scan by hyuna findings 담낭 내 소량의 슬러지 양측 신장 피질 에코 상승 췌장 좌측엽의 종대 time 및 에코 저하 소장의 부분적인 확장 및 액체 저류 폐색은 확인되지 않음 소장의 미약한 corrugation imaging dx ddx cholecystitis interstitial or glomerular nephritis acute pancreatitis gastroenteritis 보호자상담 현재 심한 췌장염과 간부전이 확인됨. 구내염도 심한상황 정상컨디션이 아니고 체온도 계속 높게 유지됨 식욕이 없어 feeding tube 강급 이물에 대한 완전한 배제는 되지않아 일단 장내 gas 제거후 다시 확인할 예정임 언제든 응급상태 생길수 있음 ,호흡기질환,101, 치주 질환 / 치주염 (젖니 유전자 좌로 유래하는 것 포함),치아 및 구강 질환 ,혈토,혈토,894,20
Persian Cat(페르시안 고양이),FS              ,2275,G_부천이지, 오전관리사항 food 식사종류 양 금식 식욕상태 급식방법 urine feces etc 수술 마취 프로포폴 cc 오후관리사항 food 식사종류 양 수술 후 금식 식욕상태 급식방법 urine feces etc 지속적으로 안구 및 구강 내에서 삼출물 나옴 치료 및 상담내용 tx cefazolin time kg tid iv ampicillin time kg tid iv famotidine time kg bid iv tramadol time kg tid iv vit time kg bid sc fluid 타치온 펜톡시필린 타치온 타우린 수술 상악 하악 symphysis 배열 wire 이용하여 고정 외상으로 인한 상악 경구개 열개부위 봉합 e cctv 확인 결과 차량사고에 의한 외상으로 확인되었다고 함 ct촬영 후 수술 진행. 수술의 목적은 최대한 손상된 골격을 교정하는 것이며 상태에 따라 완전한 교정이 힘들수도 있음 수술이 잘 되더라도 이후 심리적 문제로 식욕절폐 등이 생겨 폐사하는 고양이들도 많음 수술 후 최소 month 은 입원치료가 필요함 응고계 지연이 확인되는 바 상당기간 출혈성 삼출물이 확인될 수 있으며 염증수치 saa 가 교정될 때까지는 전신적인 증상 기력저하 식욕부진 등 이 남아있을 수 있음 ct 검사 촬영부위 전신 조영 time manual injection 술전 소견 하악 symphysis 배열 어긋남. 좌측 zygomatic bone 좌측 비강 주변 palatine bone과 nasal bone 골절. 좌측 비강내 다량의 액체병변 관찰되며 출혈로 생각됨. 그 외 골격계 척추 흉강 복강 특이소견 없음. 술후 소견 하악 symphysis 배열 정상적으로 회복. 상악 앞니와 하악 송곳니 수준에서 고정링 장착 확인. 혈액검사 응고계 지연 확인되며 saa수치 상승 확인됨 ,,"77,15", 사고 (교통 사고 포함) ,전신성의 질환,"골절,출혈",골절,893,2
Bull Terrier(불 테리어),MN,2035,B_W,코피를흘리며 내원 좌측비공 동동주를 같이 먹었는지 확인안됨. 안먹은거 같다고 하심. 걸음걸이가 대구랑 틀리다고 하심. 대구 입원하고나서 집에서 춘배는 사료까지주었는데 갑자기 코피가 나오기 시작하여 내원함. 몇주전부터 기침처럼 캑캑거렸다고 하심. o. 야간 검사시 aptt pt 지연 오전 중 응고계 종 재검시 모두 정상범위 내 a. ddx 타박에 의한 일시적 출혈 비강내 종괴 간기능부전. p. 증상 재발 시 추가검사 고려 ,,6, 코피 (원인 미정) , 호흡기 질환 ,비강 분비 및 비출혈,비강 분비 및 비출혈,237,9
Persian Cat(페르시안 고양이),MN              ,normal,F_센트럴, history 살이 빠짐 식욕이나 활동성은 그대로 유지 구토는 month 에 번 수준 objective bw time 감소 pkd 일부 심화 renal ezn. in normal range sdma 검사 진행 treatment 음수량 지속 증가 체중 일부 증가 및 우울감 감소를 위해 매일 일정 시간 놀아주고 이후 로얄 캐닌 어덜트 파우치 급여 액티베이트 상황에 따라 급여하면서 투약 길들이기 plan month 뒤 sdma 검사 결과 확인키로 ,x,"27,1",,,"체중 변화, 체중 증가, 체중 감소 ,구토(급성/만성)","체중 변화, 체중 증가, 체중 감소 ",250,17
Yorkshire Terrier(요크셔 테리어),MN              ,2001,E_24시아이, 접종 내외부 기록 확인해주세요 타병원에서 심장약 먹고있고 기관지협착증은 어릴때부터 있었음 얼마전 우심확장으로인해 폐에서 피뺐다고 . 심낭수배액 인듯 오늘 기침이 많이 심했는데 집에와보니 호흡곤란증상보여 응급으로 내원 폐수종 폐출혈등의 증상으로 다니던 병원에서 입원 받은적있음 정기적으로 심초음파등으로 팔로우 하는 환축임 당일은 내복약 먹였는데 오후에는 못먹임 식욕없고 호흡곤란증상 보여서 투약 못했음 pe 원내에서 응급사항 중간에 호흡down 됨 항문열림 청색증 노력성호흡 식욕 활기 백신 사상충 rad 폐실질손상 폐수종 심장병 기관지협착 severe copd고려 ce 당일 고비될수 있음 고지 폐사가능성 고지하고 입원필요 month 버티게 하는게 우선 목적임 가족분들과 논의 안락사 진행 ,,75, 판막증 (의심 포함한 심장 잡음 + 심부전 증후 자), 순환기 질환 ,심잡음,심잡음,387,14
Persian Cat(페르시안 고양이),M               ,2087,D_VIP, 야간 by 조 특이사항 없음 혈액검사 cbc hct 로 하락 전해질 로 여전히 낮아 수액에 kcl첨가 신장수치 crea bun 양호 보호자 상담 수액 처치하며 탈수 교정되어 hct 로 확인됨 신장수치도 조금씩 하락했으나 여전히 높은편 ,,27, 만성 신장 질환 (신부전 포함) , 비뇨기과 질환 ,"체중 변화, 체중 증가, 체중 감소 ","체중 변화, 체중 증가, 체중 감소 ",132,17
K.C(Korean Cat),MN              ,normal,F_센트럴,s 외상. 가끔 외출 함. 비출혈 결막 충 출혈.좌안 예방접종. 어릴 때 기초 접종시 차 까지만 방사선.경구개골 분리 혈검.wbc 상승 plt 저하 저하 키트검사 . 파보.음성 bnp.정상 p 내일 time 오후 time 보호자 내원. 수술 설명 하기로 함. saa 검사 할 것. ,X,77,,,골절,골절,157,2
Mixed(혼합),M               ,2244,G_부천이지,s. 금일 우측 눈 노란 눈꼽 좌측 눈은 시력이 없는 것 같음 몇달 전부터 다음다뇨 다식 o. ou lens entire opacity hyperemia os menace iop ou stt od os 혈압 혈액검사 hyperglycemia elevated ggt and t.bil increased bun tg acth st post borderline radiographic findings thorax narrow cervical portion of the trachea mild bronchial pattern abdomen renal calculi ub calculi extreme hepatomegaly appendicular skeleton misc. ultrasonographic findings multiple hypo hyperechoic nodules from the hepatic parenchyma gb double rim hyperechoic swirling sludge in the gb hyperechoic liver multiple renal calucli in bilateral kidneys hyperechoic crystals calculi in the ub mildly plumb adrenal glands anechoic cyst in the right kidney a. 당뇨 췌장염 담낭 담관염 가능성 탈수 의심되고 t.bil 수치 낮추기 위해 입원하여 수액처치 권유드렸으나 일단 내복약으로 집에서 관리해보고 싶어하심 rx. nph kg money cc sc d day 젠토닐 백내장안약 ,"2141, 2021, 2286, 2081","10,24,0", 당뇨병 ,내분비 질환 ,"다뇨/다발(다음),삼출물, 분비물, 농루,기타 증상",다뇨/다발(다음),800,5
Turkishangora(터키쉬 앙고라),FS,2170,D_VIP, 재진 종합 건강검진 왼쪽 눈에 눈물이 많음 month 에 한번씩 구토함 month 전 진료받고 돌아간 이후 침을 더 많이 물고 있는 것 같음 신체검사 hr rr bp bcs 검이경 검사 nrf 혈액검사 cbc nrf c glu crea amylase alb elec hyperna hyperk hyperca sdma normal normal feline bnp kit 영상검사 방사선검사 imaging dx ddx pulmonary bullae with mineralization suspected spondylosis deformans comment 폐 우측 후엽 위치의 . time 크기의 원형 구조물 관찰됨 변연 및 내부의 밀도 증가 관찰되나 내부의 air structure를 고려할 때 이전의 trauma 등에 의해 발생한 bulla의 석회화 가능성 있음 방사선 재검 시 크기 변화 없을 경우 비임상적으로 판단됨 흉추 요천추 s 의 척추체 endplate의 배쪽 증식 관찰됨 disc space 양호 복강 양호 복부초음파 full scan o gi tract comment 양측 신장 변연의 불규칙한 부분 관찰되나 신장의 크기 피질에코 등 양호하여 혈검 상 이상 없을 시 incidental finding으로 간주할 수 있음 그 외 복강 내 이상소견 관찰되지 않음 radiologist 이현아 dvm ms vip동물의료센터 영상의학과 과장 direct tel 내선 mail vip radiology vipah.co.kr 요검사 요비중 money 요ph 요스틱 protein wbc 요침사 nrf 안과검사 stt iop fluorescein stain conjunctiva mild hyperemia 분변검사 nrf 치과검사 calculus index gingival index complicated crown fx. no hypersalivation 초음파 검사 채혈 후 침 고여있음 방사선 검사 상 폐 우측 후엽에서 bullae가 확인되었습니다. 노령임을 고려할 때 종양의 가능성을 배제할 수 없습니다. 종양과의 감별을 위해서는 ct 등의 추가 검사가 추천됩니다. 이후 주기적인 재검이 필요합니다. 변형성 척추증은 노령성 변화로 생각됩니다. 결막염에 준해 안약을 점안해주세요. 침흘림의 원인이 치주질환에 있다고 생각되지는 않습니다. 검진 결과와 원내에서 수시간 지켜본 결과를 종합해 볼 때 통증 스트레스 뇌내문제의 가능성을 완벽히 배제할 수 없을 것으로 생각됩니다. 종합 건강검진 결과 치과치료를 위한 마취가 불가능할 것으로 생각되는 뚜렷한 이상이 확인되지 않았습니다. 그러나 bullae 노령임을 고려할 때 마취 위험성이 클 것으로 생각됩니다. 마취 전후 수액을 충분히 맞고 되도록 마취시간을 짧게 하여 치과치료를 진행해보는 것으로 하겠습니다. rx 구강소독 sid bid 항생안약 회 일 치과치료 예정 ,,31, 치주 질환 / 치주염 (젖니 유전자 좌로 유래하는 것 포함),치아 및 구강 질환 ,유연,유연,1409,16
