품종,성별코드,주진단명코드,병원,SE,기타진단코드,기타증상코드,주진단명,질환,증상명,주증상명,len,label_id
Pekingese(페키니즈),M               ,2166,G_부천이지, month 전에 쓰러진후 못 일어남 right head turn tilt 식욕 있음 발작 없었음 약은 month 에 포 투약 하셨다고 함 radiographic findings thorax pectus excavatum abdomen dilated stomach due to dyspnea hepatomegaly appendicular skeleton increased amount of osteophyte and decreased ivds in misc. ultrasonographic findings mildly increaed hepatic parenchyma. anechoic cyst visible in the right middle liver lobe. left kidney is severely deformed with dilated pelvis anechoic cyst in the medulla increased echogenecity indistinct corticomedullary junction and multiple echogenic calculus. left adrenal gland lost its corticomedullary junction increased echogenecity with mildly plump appearance. upper normal limit time right kidneys echogenecity is moderately increased with dilated pelvis and multiple echogenic calculus. idx pectus excavatum spondylosis deformans renal calculus hepatomegaly hepatic cyst ddx hepatitis fatty liver steroid hepatopathy chrnoic renal failure pyelonephritis hyperearenocorticism tumor incidentaloma 상담 간부전 만성 신부전 증상 있음 안락사 권유 집에서 당분간 약 먹이신다고 함 음수 관리 권유 페노바비탈 추가처방 time kg bid po phenobarbital ,"2087, 2085","1303,40", 전정 질환 , 귀 질환 ,"운동실조,신경증상(이상행동)",운동실조,1085,15
A.Cocker Spaniel(아메리카 코커),MN              ,2046,E_24시아이, 저녁에 집에 왔더니 간식에 있는 방부제 먹고 검은색 구토 여러군데 해놓음 먹은시간은 추정 어려움 식욕 활기 백신 사상충 comment 검은색으로 보아 실리카겔이 아니고 산소흡착제로 보임 주성분은 철성문이나 화학성분들이 같이 들어가 있음 주 부작용 구토 소화기증상 간. 신경계증상 위는 비어있어 time 이후로 추정되어 활성탄 투여 time 수액처치 필요함 tx 일단 박입원 수액처치 퇴원시 이상수치 재검 . ,-,"101,25", 소화관 이물 / 섭취 , 소화기 질환 ,"혈토,이물",혈토,229,20
Mixed(혼합),FS              ,치아골절,G_부천이지,s 우측상악pm 골절 의심. 어제 보셨다고 함 컨디션 양호 심장사상충 예방 따로 하고 계심 예방접종은 안하셨음 신체검사 골절. 치수 노출 혈액검사 nrf 방사선 nrf 치과방사선 특이사항 없음. 치수 확장이나 치첨 병변 없음 수술명 어금니 발치 술전검사 결과 특이사항 위 참고 수술전 처치 항생제 암피실린 진통제 트라마돌 fluid sd 마취종류 호흡마취 isoflurane 기타 발치 ,,77,,,골절,골절,216,2
Miniature Pinscher(미니어쳐 핀셔),MN,2048,D_VIP, money 수납 승희 cc hematochezia onset day 기존에 다니던 병원이 있고 그 병원에서 관리 받으셨으나 오늘 쉬는 날이라 이쪽으로 내원하심 오늘 새벽부터 어제는 괜찮았었음 선혈성 설사를 회 함 젤리형태 소장성 구토 없음 헐떡거림 오늘은 아무 것도 안주셨다고 하심 어제 소고기를 조금 주셨음 간장 양념된 것 매우 소량 줬음 이물을 먹었을 가능성은 없음 심장사상충 내부 구충은 따로 하고 계심 백신 접종도 완료되었음 신체검사 bar crt mm dry pink bcs aus. nrf rectal palpation nrf normal anal sac perianal area 분변검사 gross fresh blood in feces micro direct nrf stain 다량의 clostridium 탈락한 intestinal epithelial cells 혈액검사 mild neutrophilia high crp ddx extra gi disorders anal sac infection coagulopathy primary gi disorders diatary intolerance fb hge ahds inflammatory colitis intussusception neoplasia parasitic infection cpv polyps 입원 조치 보호자분께서 내일 못데리고 간다고 하셔서 day 날 까지 입원 호텔 원하심 대증처치 및 항생제 처방 ,Acute hemorrhagic dirrahea syndrome,"42,21", 세균성 장염 , 소화기 질환 ,"혈변,식욕부진, 식욕저하",혈변,715,19
Maltese(말티즈),FS,2101,B_W,s 배가 많이 부른 상태임 몇일되기는 했음 최근에 pu pu가 있었음 pain은 없는것 같은데 끙끙거림이 있음 오늘 밥을 하나도 먹지 않음 금일 수술을 진행함 tx s pain control ketamine time kg lidocaine time kg tramadol time kg maintenous fluid cefradine time kg tid cimetidine time kg tid tramadole time kg tid enrofloxacin time kg bid taurine time head sid acethylcystein time kg bid vita b.c 각 ample head supply all day ,,"10,11", 자궁 축농증 , 생식기 질환 ,"다뇨/다발(다음),복부확대(팽만)",다뇨/다발(다음),354,5
Yorkshire Terrier(요크셔 테리어),MN,2044,D_VIP, refer. 번동 강북ah 주호소 구토 설사 현증경과 어제 저녁부터 갑자기 급성구토 회 음수만 해도 구토 있음 처음에는 식이성 현재는 하얀 포말성 구토 및 위액성 아직 혈액은 확인 안 됨 최근 month 일 사이에 식단 변경 없음 평소에 이물 먹거나 식탐이 많은 스타일은 아님 어제 저녁 설사 확인 노란 설사 feca score 오늘 오전에 혈변 처음 확인 오늘 오전만 회 점액질 섞인 설사 month 동안 회 이상 month 정도 최근에 혼자 있어야 하는 스트레스 이벤트 발생 지난 주에 month 일정도 안과 질병으로 약 먹었음 기왕력 슬개골 탈구 수술 함 만성 피부염 돼지고기 알러지 반응 예방접종 all done hw 이버맥틴 주사 외부구충 구충제 사육환경 실내 산책 month 에 회 time 정도 alone 사료 나우 일반사료 year 반정도 간식은 보통 닭고기 삶아주심 최근에도 먹고 있음 삶은 당일 소진 하심 신체검사 mental alert bcs mmc redish crt 초 탈수평가 susp. 혈액검사 wbc hct pcv 이상으로 고려됨 crp 전해질 불균형 나트륨 소실 염소 소실 cpli specpli pending 영상검사 복부초음파 gi tract by hyuna findings 소장의 전반적인 운동성 저하 및 corrugation 췌장의 에코 상승 및 비후 time 상복부의 전반적인 심한 에코 상승 췌장십이지장림프절의 종대 및 에코저하 imaging dx ddx gastroenteritis chronic active pancreatitis peritonitis reacitve lymphadenopathy dx ddx acute hemorrhagic diarrhea syndrome 급만성 췌장염 복막염 acute hemorrhagic diarrhea syndrome ahds 선혈의 설사 증상과 급성 구토 수회 로 내원한 환자 실험실적 결과와 임상증상 환자 signalment 등 종합시 hge renamed ahds 으로 준해 치료 필요 공격적인 수액처치 및 항생제 처치 clostridium enterotoxin hypersensitity 감소 위해 하며 췌장염 관리 하며 소화기 증상 모니터 팝애니랩 분변 검사 의뢰예정 촉발요인으로 최근 스트레스 이벤트 관련 가능성 있음 급만성 췌장염 만성 췌장염 혹은 급만성 췌장염 확인 ahds 발병과 관련되어 간섭 촉발 요인 될 수 있는 점 감안하여 평상시 관리 필요한 점 보호자 교육 rx 식이 저지방식이 위주로 내복약 amoxicillin clavunic acid time kg bid omeprazol time kg sid sucralfate time kg tid po probiotics month 포 프로맥스 month 칸 tx 수액처치 plasma sol time kg hr 주사제 의뢰병원에서 지사제 주사하고 오셨음 metronidazole time kg iv tid famotidine time kg iv tid tramadol time kg iv tid cerenia time kg sq sid dalteparin iu kg sq bid 탈수 방지 nausea 방지 pain control 하면서 입원관리 ,"복막염, 췌장염","42,1", 위 / 십이지장 궤양 , 소화기 질환 ,"혈변,구토(급성/만성)",혈변,1571,19
Siamese Cat(샴 고양이),F,2178,C_잠실ON,cc 계속 침흘림 time 저녁 호텔에서 간식 줌. time 집에 데려온뒤로 침흘리기 시작. 점점 심해짐 밥은 먹음 차 접종 여부 뚜렷하지 않으며 항체검사 안되어 있음 tel 여 ,,31, 구내염 / 설염 ,치아 및 구강 질환 ,유연,유연,100,16
A.Cocker Spaniel(아메리카 코커),FS,2070,B_W,구강내에서 피고름이 나오는 것 같음. 귀는 많이 깨끗해진 것 같다고 하심 과건에 유선종양 수술했었음. 우측 하악에 검은색의 종괴가 관찰됨. 심잡음은 청진되지 않지만 부정맥이 청진됨. 치석과 치은염이 심함. 양측 외이도의 삼출액은 감소하였지만 crust가 많이 증가하였음. 특히 우측이 더 심함. 구강내 종괴로 인해서 접종은 보류. crp 복초에서 복강내 종괴 관찰. 기원을 알 수는 없음. 심전도에서 매우 심한 부정맥 관찰. supraventricular premature complex 관찰. cardiac arrest st degree av block negative or postivewave normal qrs complex. atropine반응 검사 hr는 증가하였지만 wave는 관찰되지 않음. 심근질환 때문에 마취가 어려운 상황. 갑상선 농도 측정을 의뢰해보고 다음에 ct촬영이 가능한지 판단해 봐야 합니다. crp가 높기 때문에 항생제 처방이 필요함. 항생제 처방. 요부족으로 upc는 검사하지 못했음. month 후 재검. ,,"13,15", 상기에 해당하지 않는 소화기 계통의 종양성 질환 , 소화기 질환 ,"허탈(붕괴),출혈",허탈(붕괴),526,18
K.C(Korean Cat),FS,2032,B_W,s 일주일 전부터 식욕저하 밥을 거의 안먹는듯 기력저하 구토 설사는 없음 최근 며칠 대소변을 가리지 못함 접종 완료 이물 가능성은 확실치 않으나 평소에 식탐이 많은 편은 아님 외상 등의 히스토리는 모르심 추석연휴 전 time 전 다른 이유로 목쪽에 혹이 만져저서 타 병원 내원하여 혈액검사 진행하였으나 특이사항 없다는 진단 받으심 내원직후 방사선 촬영하려던 중 응급상황 발생 cpr 로 호흡 및 심박 회복 방사선상 심한 흉수 간헐적으로 후궁반장 동반되는 강직성 경련 발생 설사 없다 했으나 체온계에 혈변 묻어나옴 cbc wbc over rbc mcv mch plt 전해질 na cl bga ca ph hct hco time 종 alp amylase bun tp alb tb ca glu nh saa lactate 응고계 pt aptt fib dimer tx 흉수time배액 혈액성 흉수 방사선 재촬영시 후엽부위 흉수 제거됨 배액시 의식 돌아오면서 기관튜브와 혀를 같이 씹어서 혀에 상처남 항경련처치 diazepam phenobarbital ampi cepha ornipural taurine tathione tranexamic acid iv 수액 ns taurine vit c 교정속도보다 다소 낮게 nahco cri ph hco metronidazole cri 혈액재검 흉수검사 및 필요한 추가검사 진행 예정 보호자님과 통화 후 진행해주세요 흉수 배액관 장착 필요성 고지함 응급상황 발생 가능성 고지함 plr 및 의식 없다가 천천히 의식 회복중 체온 심박 호흡수 혈압 spo 모니터링 체온계에서 혈액이 묻어나오고 있음 오후 time 심장초음파 확인 nrf 흉수천자 time 흉수검사 tncc tp exudate 도말상에 세균이 확인되지 않음 fip가 가장 의심스럼움 세균배양 흉수로 fip pcr 검사가 필요 오후에는 체온의 조절이 잘되지 않음 ,2267,13, 흉수 (血胸/膿胸/ 유방 예쁜 가슴 포함한 원 원인 미정), 호흡기 질환 ,허탈(붕괴),허탈(붕괴),922,18
Yorkshire Terrier(요크셔 테리어),FS,2088,D_VIP, 집에 가서 심장약 신장약 여기서 처방받은약 먹고 사지가 쭉 뻗는 증상나타남 식욕부진 설사도 함 alert aus no murmur blood test bun cr crp cpl ray 신장결석 기관협착 우심방 비대 ce 쭉 뻗는 증상은 실신 경련 일시적 쇼크증상등으로 일어날수 있는데 증세봐가며 감별해야 할것이고 mri 심초등으로 감별진단해야합니다. 신부전 췌장염 수치 매우 높아 현재까지는 괜찮지만 갑자기 상태 안좋아질수 있습니다. 대체적으로는 회복될가능성이 더 크나 경과 보며 판단합니다. 내일 심초음파 복부초음파 수치올라간 항목 재검사등 실시 하겠습니다. 주치의 판단하에 추가적인 검사필요할수 있습니다. 내일 오후 time 사이 주치의선생님 연락드리겠습니다. ,,"13,21,2", 신장 결석 , 비뇨기과 질환 ,"허탈(붕괴),식욕부진, 식욕저하,설사(급성 소장성/급성 대장성/만성 소장성/만성 대장성)",허탈(붕괴),373,18
K.C(Korean Cat),MN,2170,A_라라,s year 전에 구내염으로 타병원에서 스켈링과 약물복용하였음. 호전되지 않고 침흘림과 잇몸발적 금일은 잇몸발적과 붓기가 매우심해서 내원하셨음. 구내염 매우 심하고 구취도 심함. 황달 제 안검 복부 피부색 변화 코도 막혀있음. 초음파 검사 비장 에코 저하 재확인 필요함. fna 필요할 수 있음. abscess o medullary rim sign 장간막 림프절 비대 담낭확인이 안됨. 담낭으로 추정되는 당낭벽 두께 time 간에코는 낫인대에 비해서 낮지는 않음. 췌장 크기증가 및 췌장혈관 확장 ddx cholagiohepatitis fatty liver 췌장염 만성구내염 ddx forl 구강암 황달수치 호전 후 구내염 치료 발치와 조직검사 필요함. ,2178.0,"31,26",,,"유연,구취",유연,366,16
Poodles(푸들),MN              ,2123,F_센트럴, history month 정도 수준부터 다리에 힘이 안 들어가는 것 같았으나 보행에는 특이점은 없음 금일은 몸을 떨고 다리를 끌면서 배뇨를 지림 month 즈음에 인근 병원에서 피부 치료 받고 이후에는 투약 중단 objective 후지의 고유자세반응 지연 tentative diagnosis 이전 myelitis에 준하여 치료하되 중간에 치료 중단 기간으로 인하여 현증 확인은 명확치 않음 입원 하 치료하며 경과확인하되 증상 악화의 가능성 있음 따님이 데리고 내원하셨으나 어머님이 입원 원치 않으셔서 데리고 가심 month 투약 후 경과보고 검사 자료 송부해드릴 예정 ,x,"1303,9", 척수 질환 (추간판 탈출증 제외) , 신경 질환 ,"운동실조,배뇨실금",운동실조,319,15
Pomeranian(포메라이안),MN,renalglycosuria,B_W, blood glucose bun crea osmolality time os kg glucosuriatime dl urine na plasma na urine crea plasma crea fena upc ct상 pss o time hr 급수시 거의 대부분 음수 cc kg day 이상의 물을 마심 time h time 급수시에도 요비중,,10,,,다뇨/다발(다음),다뇨/다발(다음),188,5
Poodles(푸들),M,2048,B_W,이틀전부터 비틀거리는 것을 발견 month 전부터 스스로 먹지를 않음 다른 아이들은 먹음 마리 항상 변이 조금 질은 것이 잇었음 구토는 없었음 내원 당시 혈액이 묻어나옴 고체온 계속 짖는 증상 이틀전부터 병원을 내원하여 치료를 받았었음 내원전에 수액을 맞고 왔었음 cdv ccv cpv 음성 일주일전에 떨어뜨린 적이 있었고 그 후로 먹지 않는 증상이 나타난 것같다고 하심 wbc hct plt alb tp tbil lac na cl ph hco 대사성 산증과 전해질 불균형 백혈구 혈소판 감소증이 동반됨 심한 장염이 나타났으며 tbil의 상승은 앞으로 지켜봐야할 것으로 보임 패혈증에 준한 처치를 진행 신경증상 모니터링 ,,13, 세균성 장염 , 소화기 질환 ,허탈(붕괴),허탈(붕괴),347,18
Mixed(혼합),M,2001,D_VIP, refer. 의뢰병원관련 진료전 전화완료 진료후 전화완료 원장님 요청사항 신경써주실 것 당부 주호소 심장검진 현증경과 month 전 처음 실신 증상 보임 그 후 총 회 쓰러짐 주로 보호자분 퇴근시 반가워하면서 쓰러짐 지속시간 초 정도 atonic 마지막 쓰러질 때 후지 강직 및 이후 배변 켁켁대는 증상은 이 전부터 보임 주로 산책시 보임 목줄 식욕은 좋으나 전반적인 활력 다소 감소 기존처방 pimo furo spiro enal theo time kg 예방접종 all hw 사육환경 indoors alone 산책 자주하는 편 사료 사료 잘 먹지 않음 table food 뼈다귀 간식 수제 간식 신체검사 mental allert 겁많은 성격 hr normal rr normal bp time hg bcs mmc crt normal 탈수평가 이하 사지 관절 상태 불량 특히 우측 전지 및 양측 후지 슬개골 탈구 및 근육량 심한 감소 경부기관 자극시 기침 반응 없음 apical beat midly increased iii vi holosystolic murmur in lt to rt apex ipl 심장질환 진단 staging 및 치료계획 수립 마지막의 강직 배변은 심인성 증상이 아닐 가능성 높은 부분 사전 고지 혈액검사 nrf 심장바이오마커 영상검사 흉부방사선 심종대 외 흡기시 경부기관 tc 확인 gii 심장초음파 findings mr severe mv remodeling severe tr time pr time 이완기능 저하 stage a ratio a ratio edvi ref. 수축기능 양호 esvi ref. la 압력 증가 severe peak time e la ao ratio lvd ao ratio dx ddx degenerative mitral valve disease severe pulmonary arterial hypertension severe 검사결과 심증도의 mvi tvi pah 확인됨 acvim 실신의 주원인으로 생각되며 전반적으로 약물 관리 보강 필요 다만 일반적인 경우에 비해 혈압이 낮아 추후 재평가 필요 rx 식이 사료를 잘 먹지 않아 우선 cardiac 캔에 적응토록 처방 추후 장기적인 심장 관리에 적합한 식이 및 보조제 보강 추천 내복약 furosemide time kg spironolactone time kg enalapril time kg pimobendane time kg sildenafil time kg e 질환에 준한 제반상담 식이 음수 일상생활 투약 등 month 후 재검 임상증상 bnp 결과 등 감안하여 약물 추가 조정 상태 안정 후 의뢰병원 귀원 관리 comment 실신 주증으로 내원했던 환자로 실신의 주원인으로 중증도 이상의 mvi tvi 폐고혈압이 확인되었습니다. 그에 비해 혈압은 다소 낮아 추가적인 실신의 원인이 될 수 있습니다. 다만 혈압의 경우 단독적인 문제라기 보다는 심부전 자체로 인한 심박출량 감소와 순환 상태 저하와 관련될 것으로 생각되어 전반적인 심장약물 조정 후 재평가가 추천되는 상황입니다. 또한 이를 감안하여 이뇨제는 추가로 크게 증량하지 않았으나 약물 변경 후 경과 실신 증상 지속여부 혈압 la 부담 정도 등 에 따라 이뇨제의 추가적인 증량이 지시될 수도 있습니다. 이상의 경과 확인을 위하여 내원 month 후 bnp 결과와 임상경과 감안한 약물 재조정 후 귀원 조치할 예정이었으나 아직 재내원은 하지 않으신 상태입니다. 현재 심인성 실신으로 충분히 설명할 수 있는 상황이나 약물 조정 후에도 증상이 지속된다면 추가적인 원인 감별이 필요할 수 있으며 이뇨제를 크게 증량하지 않았기 때문에 향후 환자 호흡수 srr 추이를 잘 모니터링 하실 필요가 있습니다. ,,1601, 판막증 (의심 포함한 심장 잡음 + 심부전 증후 자), 순환기 질환 ,실신,실신,1824,13
Yorkshire Terrier(요크셔 테리어),FS              ,2084,F_센트럴,복부가 빵빵한거 같습니다. 식욕은 양호합니다. 신체검사 back pain 혈액검사 간 담도계수치 상승 초음파 간mass 레이져치료 실시 추후에 간fna 검사 실시하기로함 ,x,11, 간 / 담도 / 췌장의 종양 , 간 · 담도계 및 췌장 질환,복부확대(팽만),복부확대(팽만),95,8
K.C(Korean Cat),M               ,normal,F_센트럴,s 층에서 화단으로 떨어짐. 방사선.좌후지 경골 비골 골절 우측 관골 골절 . 폐 앞쪽구역 반사도 증가 혈검 . 칼륨수치 저하 인수치 상승 간수치 alt alp ast 상승 글루코스 수치 상승 키트검사.파보.음성 lt 경골비골 골절 rt iliac frax. 폐출혈이 의심되는 상황이므로 산소공급과 주사처치후 안정화 시켜 경과 보기로 함. time 내원하여 수술 상의 하기로 함. 예상 술비내외 혈뇨 증상 보여 초음파 검사 했으나 본인에게 미리 알리지 않았다고 매우 화가 남. 과잉진료라고 생각하고 있음. 방광파열은 아닌듯보임. 검사에 대한 거부감이 크고 검사하는 것에 대해 사전 설명이 꼭 필요. 가급적 검사하지않고 치료 원함. ,X,"77,8",,,"골절,혈뇨",골절,353,2
K.C(Korean Cat),FS,2028,A_라라,s 발열 있음 컨디션 떨어지고 식욕 저하 있음 병원에서 로얄케닌 캔을 주었으나 먹지 않고 케이지 속으로 들어감. 재채기 하면서 노란 콧물이 나와서 내원하였음 약물은 time 에 먹이심 당일처치 날짜 간호사 설간 사료 쉐바파우치 개인 주사 time time 세파 트라 라니 처치 time 체온체크 도 기타사항 time 식사 체온체크 보호자님과 통화 내용 체온 정상으로 떨어졌고 쉐바 캔도 먹었음 오늘 하루 입원 치료 진행하기로 함. 보호자님께 추가 입원 비용과 주사 비용 든다고 설명 오늘 약 지어 먹인다고 안내함 서정임 내일 휴무 안내 수액 hd 배 주사 세파 트라 tid 내일 오후까지 약물 bid 오전 오후 다름 사료 일반 사료 쉐바캔 모니터링 없음 ,,3,,,발열/고열,발열/고열,366,6
Maltese(말티즈),MN,2170,D_VIP, refer. 주호소 작년에 사료먹다가 구강내에서 출혈이있어서 검사시 양쪽 ranula를 진단받으셨다고하심. 구취 심한상태이고 어제 앞니하나가 빠졌다고 하심. 음식을 삼키는데는 크게 문제는 없는편임. 신체검사 mental alert hr rr bptime hg 청진상 murmur bcs pink mucous membrane crt sec 탈수평가 skin turgo delay 탈수 치과검사결과 money mobilization. 치아 전반적으로 enamel 정도 moderate tartar. esp. money money 구강검사결과 이전에 발병했던 ranula rupture후 남은 조직의 증생 확인됨. 혈액검사 cbc 검사결과 wbc money . pcv plt money 으로 경미한 수준의 빈혈수치 확인됨. chemistry 검사결과 crt alp 으로 경미한 수준의 간수치 상승 확인됨 영상검사 흉부 방사선 검사상 vhs 로 심장크기는 정상범위 내 있으나 tracheal elevation 확인됨. dx ddx ranula periodontitis gingivitis gingiva hyperplasia 일 마취하에 정밀한 치아상태 및 ranula조직에 대한 평가 후 치과치료 및 ranula marsupialization 수술예정입니다. ,Ranula,"26,15", 치주 질환 / 치주염 (젖니 유전자 좌로 유래하는 것 포함),치아 및 구강 질환 ,"구취,출혈",구취,646,4
Shih Tzu(시추),MN,2005,D_VIP, refer. 호담 ah 의뢰병원관련 진료전 전화완료 진료후 전화완료 초진일 전화 안됨 원장님 요청사항 주호소 syncope 현증경과 호담 동물병원에 다니고 있음 심장질환이 심해져서 평소에 호담동물병원에서도 vip로 가서 관리 받으라고 하셨다함 최근에 호담에서 심장초음파도 검사했다 함 어제는 호담에서 약을 타다가 저녁에 먹이지 못했다 함 조금전 경련하는것처럼 강직이 일어나 이쪽으로 내원하심 몇년전에도 실신한번 한적있음 평소에도 기침은 하였음 소화기 증상 없음 피부는 모낭충치료도 하고 있음 사료 피부 심장사료 먹이심 신체검사 mental alert hr rr aus murmur mild crackle sound arrithmia 노력성 호흡과 기침 bp bcs mmc pink 탈수평가 혈액검사 cbc chemi electro 진행 lactate 영상검사 ray severe cardiomegaly vhs echo mital valve remodeling moderate mital valve prolapse moderate mr time la ao tr time time time e e teichholz edvi time m esvi time m simpson edvi time m esvi time m dx mvi severe diastolic dysfunction severe systolic dysfunction. pulmonary hypertension. 현재 심실의 확장이 심하고 이완능력 및 수축능력의저하가 심함 심실확장에 의해 부정맥발생. 이로인한 실신증상발현 가능성 높음 약물조절해보고 만약 실신이 반복해서 나타난다면 pacemaker 장착도 고려해야함 rx 식이 심장전용사료 내복약 cephalexin time kg bid enrofloxacin time kg bid lasix time kg tid enalapril time kg bid spironolactone time kg pimobandan time kg tid sildenafil time kg tid theophylline time kg codein time kg famotidine time kg month 후에 재진 방사선 초음파 ,,1601, 부정맥 , 순환기 질환 ,실신,실신,1076,13
K.C(Korean Cat),FS              ,2178,G_부천이지,치과 몇년 전부터 입냄새 좋지 않았음. 작년 동배 고양이 구내염으로 인해 사망했음. 식욕 얼마전까지는 삼키면서 먹었으나 사료 지금은 먹지 못함. 간식으깨서 주면 먹음. 유연. 혀내밀고 있음. 설사 구토 없음. 활력 떨어짐. 비용 상 하악 치은 발적및 부종 pm teeth tartar severe. serum tp bun 간기능 이상 의심. 양측 상하악 어금니 주변 치은부 발적및 부종 severe. 구내염. 문제치아 발치및 스케일링 tx scaling 발치 양측 상 하악 송곳니 뒷편 전구치 구치 개 발치. pds sc rx rodogyl famo pds bid days. 분배 담당자 분배 방법 자동 복약 지도 주의사항 cc 주사기 각 개씩 챙겨드림 내복약 용량 로도질 time kg 파모 time 소론도 time ce 퇴원이후 활력저하및 구토 하루이틀가량 보일 수 있음. 이후에도 회복하지 않는다면 구내염 외 기저질환 가능성. 구내염 내복약 추가처방 필요. 주말 내원하여 컨디션 확인및 내복약 추가처방 고려. 당분간 건사료보다 불린 건사료 또는 캔사료 유동식 형태 급여 추천. 컨디션 저하 없다면 약만 받으러 오실것. 특이증상 있거나 컨디션 회복하지 못하다면 뚜비 데려오셔서 검사상담. ,,"26,31,61", 구내염 / 설염 ,치아 및 구강 질환 ,"구취,유연,구내염",구취,611,4
