품종,성별코드,주진단명코드,병원,SE,기타진단코드,기타증상코드,주진단명,질환,증상명,주증상명,len,label_id
Maltese(말티즈),FS              ,2082,G_부천이지,혈변 봤음. 가람 동물병원 들렸다 오셨음 혈변 month time 부터 증상 보임 month 전에 사료에서 캔사료로 식이 교체 회 일 설사 식욕은 있음 약간 식욕 저하 보임 가람 동물병원에서 치료 받음 오늘은 성북구쪽 동물병원에서 검사 받음 hct 저단백혈증 전해질 불균형 췌장염 양성 pe heart murmur 치아 거의 없음 fecal exam direct nsf stain dysbiosis. 장상피세포 호중구 흉부 복부방사선 검사 흉부 외측상에서 time 방향 경미한 bulging으로 좌심방 비대 가능성. 청진 필요. 폐 특이소견 없음. 복부 외측상에서 간 늑골궁 안으로 들어오고 위축 전방으로 변위되어 소간증 의심. 복부초음파 검사 담낭내 sludge 매우 다량. 유동성은 있음. 간은 늑골궁 안에서 매우 작게 스캔. 간내 문맥혈관 확인되며 간 실질은 균질하게 관찰. 변연은 명확하게 스캔되지 않음. 작은 직경의 pss 또는 microvascular disease 만성 간질환 가능성. 비장내 cm 미만 크기의 불균질한 저에코성 결절 개. 결장은 대부분 비워져있는 상태로 전반적으로 벽 두께 time 이상으로 증가됨. 방광 앞쪽에서 복수 소량 관찰. 초음파상 췌장 실질 및 주변 복막 에코 특이소견 없음. 소장 과운동성 의심. 소장벽은 특이소견 없음. 상담 오늘 검사에서 심한 대장염 의심 month 정도 치료후 상태에 따라 정밀 검사 직장 내시경등 예정 빈혈과 lactic acid등 몸상태 안 좋음 심할경우 사망위험성 있음 심부전 검사는 차후에 꼭 받아보시길 권유 심부전에 의한 급사 가능성 있음 설명 처치 수액 처치 타우린 오르니푸랄 헤파밀즈 암피실린 time kg 메트로니다졸 time kg 파모티딘 time kg bid 미소프로스톨 베스타제 bid po ,2043,42, 췌장염 , 간 · 담도계 및 췌장 질환,혈변,혈변,882,19
K.C(Korean Cat),MN,2274,C_잠실ON, month 등쪽 부위 감염 삼출물 보임 치료 후에도 month 후 현재까지 뒷다리 힘이 없어보임 점프할때 주저함. time 이내 높이까지 올라감 ,,34, 교상 (bite wound),전신성의 질환,교상,교상,82,3
K.C(Korean Cat),MN,2278,B_W, time 령 새끼를 입양했음. time 전에. british fold와 scottish fold 교잡. 경미한 누꼽정도. 차까지 접종 후 추가접종을 하지 않음. 타이는 month 전부터 식욕감소. 음수 안함. 자주 retching을 보임. 그러나 구토는 없음. pe 신체검사상 탈수는 없음. 폐음과 심음 정상. 방광크기 정상. 복부촉진시 통증 없음. 미열 체온 도 채혈 후 흥분한 상태에서 측정하여 상승하였을 수도 있음 활력이 없는 것은 아님 이전에 비해 기력이 감소하였다고 함. 이전에는 정말로 활발했다고 함 구강내 특이소견이 관찰되지는 않음 가볍게 입을 벌려서 체크했을 때. 정밀검사한 것은 아님 건강검진 에서 혈액검사만 실시하기로 함. felv fiv 콤보 추가. felv fiv combo all negative fip titer wbc plts 혈액도말상 백혈구의 toxic change가 있음. 혈소판수는 정상 alb tp glo ag ratiio saa 전해질 정상 hco 복초에서 hepatic ln와 mesenteric ln의 경미한 종대. 양측신장의 cm junction에 hyperechoic. tx ns vitamin c convenia timesc depo medrol timeim 새로 입양한 동거묘 검진. 눈과 분변의 건강검진 pcr 혈액상의 felv fiv 콤보 검사 month 후 재검. 초음파검사 복강내 림프절의 크기 변화 saa cbc. depo medrol timeim. 그 후에 month 마다 재검. 정상이면 추가 재검 안해도 됨. ,2279,"3,17", 건강 상실 (식욕 부진 등 원인 미정) ,전신성의 질환,"발열/고열,림프절 병증",발열/고열,769,6
Welsh Springer Spaniel(웰쉬 스프링거 스파니엘),M               ,2263,G_부천이지,다른 병원에서 홍역 진단 식욕 양호 머리를 drop하는 tic 증상 있음 보호자 전화 통화 홍역 위험성 인지 하고 있음 기본적인 검사와 치료 예정 tic 증상이 최근에 발생 신경증상이 심해져서 경련 발생시에는 안락사 고려 time 정도 입원 치료 예정 검사 방사선 검사 홍역 검사 혈액 검사 처치 수액 처치 유지수액 kcl vit c 세파 time kg 파모티딘 time kg tid sear plasma cc anti serum cc 네블라이져 qid 오전관리사항 food 식사종류 양 개인사료 불림 식욕상태 좋음 급식방법 자율 urine feces etc tx 오후관리사항 food 식사종류 양 식욕상태 급식방법 urine feces etc tx cefa cc famotidine cc sear serum cc anti serum cc ,,40, 개 디스템퍼 · CDV ,전신성의 질환,신경증상(이상행동),신경증상(이상행동),414,12
Maltese(말티즈),MN              ,2231,E_24시아이, 접종 내외부 기록 확인해주세요 tp alb glu crp 검사는 했고 수혈만 하러 오셨다고. hct 정도로 당장 수혈을 할 상태는 아니고 원인규명후 원인제거를 해야할 상태임 호흡 crt등은 괜찮음. 복부팽만있으나 알부민이 어제 검사에서는 나왔지만 오늘은 이 나왔음. 필요검사 매일 cbc 낮아지는추세면 수혈 준비해야함. 췌장염 ,,20, 빈혈 (원인 미정) ,혈액 및 조혈기의 질환 ,빈혈,빈혈,184,10
Shih Tzu(시추),F               ,2043,F_센트럴,history day 부터 혈변 관찰 어제부터는 음식 먹으면 바로 혈변 구토는 한적 없습니다. objective bp bt chemistry normal sono righrt adrenal gland enlargement fecal examination spore forming bacteria 다수 관찰 피하수액 plan 항생제처치 month 이후 증상 관찰 ,,42, 위염 / 위장염 / 장염 , 소화기 질환 ,혈변,혈변,202,19
Maltese(말티즈),F               ,2001,G_부천이지,월드펫 동물병원 의뢰 흉수 복수 올해 month 경에 복부 팽만에 대해 인지함 month 경에 월드펫 동물병원에 내원 복수 흉수 진단 받음 활력이나 식욕 컨디션은 양호 켁켁거리는 증상은 올 month 부터 인식 열이 나는것 같음 사상충 예방 예방접종 완료 사료 오리 훈제 고구마 등 table food 먹임 오래전에 관절염약 단기 복용 pe 복부 팽만 파동감 있음 심잡음 좌 우측에서 확인 hr 이상 검사 혈액 검사 방사선 검사 초음파 검사 복수 검사 ct 검사 내복약 처방 실데나필 time kg 에날라프릴 time kg 라식스 time kg 피모벤단 time kg bid ,,"35,3,12,1201", 판막증 (의심 포함한 심장 잡음 + 심부전 증후 자), 순환기 질환 ,"개구호흡,발열/고열,복수,흉수",개구호흡,322,1
Shih Tzu(시추),F               ,2022,D_VIP, money 결제완료 효정 cc 갑자기 쓰러짐 year 전 유기견 입양 오늘 오전 심하게 켁켁거림 저절로 완화됨 오늘 저녁 갑자기 몸이 퍼지면서 대소변 지림 의식소실 여부는 불확실 과거 안구적출해서 양측 안구 없음 과거 hw 치료 병력 환치 확인 예방접종 심장사상충예방 month 전 심장사상충 음성 확인 노력성 빈호흡 no murmur 좌측 crackle sound 움직임 양호함 눈은 확인되지 않으나 의식 양호한듯 p panting bp srr wbc crp 방사선 폐침윤 우측 중엽 좌측 중후엽 소간증 방광팽만 정상배뇨확인 감염성 폐렴 세균성폐렴에 준하여 치료 산소공급 경과에 따라 필요시 cdv civ hw 확인 필요 month 간 경과 중요함 내일 crp 방사선 혈압 예정 의뢰병원 문자연락 vip동물병원 신봉훈입니다. 초롱이는 검사결과 폐렴으로 판단됩니다. 세균성 폐렴에 준하여 치료하기로 하고 입원하였습니다. 아이가 쓰러진 부분에 대해서는 뚜렷한 원인이 확인되지 않으나 현재 저혈압이 있어 이와 관련있지 않을까 생각됩니다. 다른 변동사항 있으면 연락드리겠습니다. 감사합니다 ,,"13,35", 폐렴 , 호흡기 질환 ,"허탈(붕괴),개구호흡",허탈(붕괴),552,18
Shih Tzu(시추),M               ,2048,G_부천이지,혈변 어제부터 설사 혈변 식욕 활력 매우 좋음 캔에 사료 석어서 급여 클로스티리디윰 쌍구균등 세균 다수 확인 쓰레기통이나 이물 가능성은 없다 느끼심 방사선 초음파 저립선 비대 세균성 장염 e 현재 신체에 다른 설사를 일으킬 만한 이유는 없음 사료 슈퍼에서 아무거나 구입해서 급여. 어떤 사료인지 모름. 사료에 캔 석어서 급여 고급 사료로 교체 필요합니다 자주 발생하는 설사에 장내 세균 건강하게 하기 위해 유산균 급여해주세요 당분간 intestinal 물 약 유산균 외에는 급여 하지 마세요 ,,42, 세균성 장염 , 소화기 질환 ,혈변,혈변,275,19
Maltese(말티즈),MN              ,2091,E_24시아이, tshama hanmail.net 원래 다음 다뇨있었고 변도 잘 봤는데 갑자기 변을 아무데나 싸고 물은 안먹고 소변도 거의 잘 안보는 증상 보임 요즘에는 거의 time 만에 소변을 보았음 물도 잘 안먹고 패드에 안하고 다른곳에 싸는 증상도 보임. 소변색은 약간 진한정도이고 혈뇨나 커피색뇨는 아님 예전에는 물많이먹을 때 정도로time정도만 먹었음 슬탈있어서 진통소염제 약 처방받아서 먹고 있었음 오늘은 약이랑 밥은 안먹음. pe bar 복압양호 cbc.serum chem alp tg ray 특이소견없음 urinalysis ph sg money cocci 초음파 방광벽 깨끗하지 못함 gb에도 슬러지 있음 방광염 담낭내 슬러지 alp상승 고지혈증 음수량 늘려줄것 하루time l이 적정 음수량 줄고 소변이 방광에 정체되는 시간이 많으면서 방광염으로 진행되었을 가능성있음 방광염 약 month 복용후 세균 없으면 month 약먹고 중단 세균 있으면 추가 방광검사 alp 수치 상승과 담낭내 슬러지 관련하여 간보조제 복용 추천 month 뒤 소변검사 및 방광 초음파 새밀린 복용 추천 ,,9, 방광염 , 비뇨기과 질환 ,배뇨실금,배뇨실금,550,7
Shih Tzu(시추),MN              ,2082,G_부천이지, time time 정도 에 내원 예정 노엘 의뢰 복수 췌장염 month 전부터 혈변 증상 복부초음파 검사 복강내 종괴로 인해 장기들 위치 변위되어있음. 종괴는 비장 스캔되지 않아 비장 유래로 생각됨. 일부 간엽과 연결성 관찰되어 간으로의 침습 가능성. 간 실질에서도 고에코성 원형 종괴 관찰됨. 양측 신장은 정상적으로 관찰. 검사 방사선 검사 초음파 검사 혈액 검사 혈액형 검사 상담 복수 확인 안되고 복강내 종양 의심 복강 대부분을 차지하고 있는 커다란 종양 혈액 검사에서 빈혈이 심하고 혈변 증상이 있어 위험 응급 처치로 수혈 진행 이후 상태에 따라 ct 촬영후 수술 결정 예정 처치 수액 처치 유지수액 타우린 오르니푸랄 헤파밀즈 암피실린 time kg 파모티딘 time kg tid 엔로 time kg sid 내복약 투약 메트로니다졸 time kg 파모티딘 time kg 베스타제 bid po 응급 오후 time time 경 의식 저하 동공 반응과 안검 반사에 반응 안함 미약한 안구 진탕 보임 bradycardia 호흡수 감소 체온 감소 응급 처치 heating atropine sc 수혈 volus 응급 처치 time 정도후 의식 호전 안검 반사 보임 보호자분 면회 상담 응급 상태 ct 촬영전에 충분히 몸 컨디션을 올릴 필요 있음 상태에 따라 ct 촬영은 미룰수 있음 설명 ,,42, 췌장염 , 간 · 담도계 및 췌장 질환,혈변,혈변,664,19
Yorkshire Terrier(요크셔 테리어),FS              ,"2082,2087",E_24시아이, 접종 내외부 기록 확인해주세요 대소변을 아무데나 봅니다. 변기뒤에 숨어서 변을 봄 화장실 문짝 또는 변기뒤에 숨어서 변을 봄 용변보고 숨어있음 밥 잘 안먹음 간식위주의 식생활 근래 체중감소되고 식욕 떨어짐 pe 유선종양 있음 기관협착성 기침 심함 복압상승 하복부통증있는듯 식욕 활기 백신 사상충 rad 기관협착 . 간종대 cpl kit positive crp buncre ca ip gptalpnh 신부전 췌장염 간부전 mods 폐사율 고지 수치하락여부 관건임 고지 month month 까지 입원조치 ,,9,,,배뇨실금,배뇨실금,282,7
Maltese(말티즈),FS,2079,B_W, time 전부터 다음 다뇨증. day 부터 기운이 없음. 기침 없음. 심장약을 먹이지 않았음. pe cachexia bcs mild to moderate icteric skin. pallor. 요천자시 경미한 복수 관찰. 담석이 총담관의 십이지장 개구부를 막고 있음. 수술할 지 결정. 수술은 안하기로 함. 필요시 수액처치와 진통제 투여. ,,10, 담석증 , 간 · 담도계 및 췌장 질환,다뇨/다발(다음),다뇨/다발(다음),191,5
K.C(Korean Cat),F,2028,B_W, day 에 길냥이 구조하심 밥 잘 먹고 잘 놀았으나 어제부터 식욕 다소 감퇴 어제보다 잘 놀지 않음 고개를 양옆으로 흔드는 듯한 증상 관찰되어 내원 내원시는 상기 증상은 없으며 mild한 shivering 관찰됨 고체온 체온 떨어지지 않고 보호자님께서 간혹 재채기 관찰되었다고 하셔서 혈검 및 입원처치함 cbc 특이사항 없음 전해질 na cl으로 감소 종 특,,"3,5,13", 고양이 칼리시 바이러스 FCV , 호흡기 질환 ,"발열/고열,기침,허탈(붕괴)",발열/고열,201,6
Siamese Cat(샴 고양이),MN,2170,D_VIP,cc 치주염 상담 귀 끝 수포 크기 커짐 입냄새 너무 심함 구취 심함 supereruption 구강 전반적으로 치주염 있을 것으로 생각됨 마른 편 근육량 부족해보임. bcs 마취 전 검사 bw mild한 전해질 불균형 crea 복부초음파 full scan o gi tract imaging dx ddx chronic kidney disease acute tubular necrosis comment 양측 신장 크기 모양 양호하나 피질 에코의 심한 상승 확인됨 그 외 복강 내 이상소견 관찰되지 않음 radiologist 이현아 dvm ms ce 마취는 가능할 것으로 생각됨. 치과치료 일정 잡기 를 포함한 다수의 치아 발치 예상됨 귀 끝 수포는 약간 더 커진 양상이나 fna 하기에는 샘플의 양이 충분하지 않을 만큼 작아서 좀 더 모니터링 하기로 함 치과치료 예약 ,,26, 치주 질환 / 치주염 (젖니 유전자 좌로 유래하는 것 포함),치아 및 구강 질환 ,구취,구취,428,4
Maltese(말티즈),M,2244,B_W,오늘 새벽부터 몸을 못 움직이고 상태가 안좋아 내원 month 전부터 식욕저하와 구토 동반 점막 창백하고 혈압이 측정불가 저혈압 쇼크상태 침을 흘리고 몸을 못 가눔 당뇨 케톤 산증으로 인한 쇼크 고암모니아 혈증 dimer lactate 간헐적으로 경련증상 있음 예후 불량할수 있다고 설명 전체적인 검사 비용 money 말씀 드리고 검사 진행 보호자 비용 문제로 안락사 요구 안락사 대상으로 인정하기 어렵다고 설명 하루 정도 입원후 예후 판단하기로 함 초음파상에서 우측 부신의 종양. cvc 침습된 것으로 보이나 환자가 아파하고 호흡곤란으로 정확하게 판단하기는 어려움. 췌장 부종이 심하고 복막염 소견 관찰. na이 지속적으로 상승해서 ns로 교체하여 투여. 혈압이 낮게 유지되어 dobu vasopressin cri. 혈당 농도에 따라 인슐린 cri 투여. ,"2082, 2126",13, 당뇨병 ,내분비 질환 ,허탈(붕괴),허탈(붕괴),424,18
,MN              ,2039,D_VIP,cc 걷다 픽픽 쓰러짐 기운도 없고 밥도 어제부터 안먹음 어제까지는 똥오줌 쌌는데 오늘은 확인 하지 못하심 특별한 사건 없음 체온도 높고 애기 밥도 못먹었으므로 탈수 오지 않게 하루 수액 처치 하면서 여러가지 검사 실시해보기로 하루 입원비 검사비 money 완납하심 하루만 입원하면 되냐고 질문하심 내일 담당선생님과 상의해보시라 말씀드림 야간 by 박찬수 밤사이 특이 사항 없음 아침 식욕 없음 추가 보호자 상담 by 조 일주일 전 사료 교체 했음 이후 식욕 없음 felv fiv 음성 tx ds 유지 배로 변경 cefa iv 단푸론 sc 주간 by 조 참치캔 d 핸드피딩시 식욕 양호 배뇨 회 후지 파행 관찰됨 고체온 지속 보호자 상담 by 조 현재 히스토리와 검사상 가장 가능성이 높은것은 calici virus에 의한 고체온증 관절염 식욕부진으로 보임 이외에 폴드 관절이형성증 복막염등 잠재적 가능성 배제하지 못함 입원하에 수액처치 항생제 처치 진행 하며 현재 파행 지속되어 입원 치료 지속될 것으로 생각됨 보호자분 time 경 내원 하실 예정 ,,"6,5,41", 상기에 해당하지 않는 호흡기 질환 , 호흡기 질환 ,"비강 분비 및 비출혈,기침",비강 분비 및 비출혈,532,9
K.C(Korean Cat),F,2028,A_라라,s 중성화로 내원 컨디션 양호 청진 정상 흉부방사선 이상없음. 중성화 month 입원 내일 퇴원 내복약 챙겨드리고 수술 사진 보여드려야 함. 내복약 bid 내일 후처치 바이트릴 드레싱 내일모레 time 로 후처치 예약 함. ,2053.0,3,,,발열/고열,발열/고열,125,6
Bedlington Terrier(베드링톤 테리어),MN              ,,D_VIP,cc 혈변 구토 어제부터 혈변 구토 day 부터 기력 저하 어제부터 식욕없음 물만 먹음 물먹어도 구토 기초접종 완료 심장사상충 하고 계심 특별히 먹인거 없으심 타 병원에서 파보 코로나 검사 했는데 이상 없다고 들으심 alert bcs 내원시 계속해서 변을 보는 자세를 취하고 계속해서 혈변 약간 나옴 gia cdv both negative 위 검사에서 구토 혈변에 대한 원인이 밝혀지지 않았으니 입원 처치후 종합검사 해보자 말씀드렸으나 입원은 원치 않으심 일단 혈액검사 진행하고 내일이나 모레 다시 나오시기로 am 전화통화 혈액검사 결과 수치 알려드림 구리중독때문에 간수치를 많이 걱정하시나 간수치 자체들은 정상범위에 있고 bun 수치가 낮은것이 약간 문제가 되므로 이 수치는 추후에 다시 검사해보라 말씀드림 피하 킹벨린 내복약 metro famo bestase bid for dys ,,"42,1,28",,,"혈변,구토(급성/만성),기력저하",혈변,439,19
Yorkshire Terrier(요크셔 테리어),FS,2021,D_VIP, refer.서울종합 의뢰병원관련 진료후 전화완료 주호소 빈호흡 호흡곤란 현증경과 month 전부터 호흡 안좋았는데 어제 밤부터 헉헉거림 심함. 잠을 못잘정도. 여름이 되면 호흡 안좋아지는 편. 이전에는 사무실에 있었고 작년에 집에 데리고 오심. 사무실은 시원한데 집에는 에어컨 없음. 호흡 외에는 식욕 배변 배뇨 모두 양호. 사육환경 indoor. 사료 식욕 좋음. 신체검사 mental alert severe cyanosis hr rr panting. bcs 혈액검사 cbc wbc hct lactate crp 영상검사 방사선검사 finding ddx cardiomegaly of rt rt and lt heart vhs la bulge increased sternal contract tracheal collapse grade severe bronchial collapse ivdd 과대평가 되었을 수 있음 spondylosis infiltrative liver disease nodular liver disease hepatomegaly pulmonary edema pneumonia interstital pattern overall lung field alveolar pattern of left cranial lung comment 심한 기관 기관지 허탈로 저산소증을 겪고 있을 가능성이 매우 높음. 심장 초음파 및 tfast and vet blue crp를 통한 폐수종 유무와 심인성 비심인성 원인 감별 필요할 수 있음. radiologist 윤학영 dvm phd dx ddx tc bc noncardiogeni pulmonary edema 심한 호흡곤란 빈호흡 및 청색증 보이며 내원. 의 기관 협착 및 기관지 협착 확인되었으며 최근 더워지며 실내 환경으로 인해 증상 촉발되었을 가능성. 산소마스크 및 buto aminophylline 처치 후 호흡 다소 안정되는 양상 호흡 안정화에 따라 익일 tfast 심초 등 추가 검사 진행 여부 결정. rx 식이 low fat tx 수액처치 s time kg hr 주사제 ampicillin time kg iv bid famotidine time kg iv bid butorphanol time kg sc aminophylline time kg iv ns dilution for time 입원 처치 crp 흉방 가능시 tfast 심초 ,기관지협착증 ,1401, 기관 허탈 , 호흡기 질환 ,빈호흡,빈호흡,1170,11
Scottich Fold Cat(스코티쉬 폴더 고양이),M               ,2039(비건강검진,G_부천이지,좌측 코에서 비출혈 작년부터 증상 보임 최근에 들어 더 심하게 증상 나타남 허피스 감염 의심 진단 받음 처음 입양후 year 전 증상 나타남 예방접종 완료 수면중 코골이 기침 증상 있음 식욕 양호 검사 혈액 검사 nrf 방사선 검사 vd 촬영상 미약한 심비대 흉부 방사선 심장은 ics 로 정상이나 복배상에서 심장 단축의 너비가 다소 넓어 보이므로 초기 hcm 가능성을 배제하기 어려움. 전반적인 폐에 특이적인 소견 관찰되지 않는다. 복강 내 serosal detail 소실은 환축의 마른 체형때문으로 생각됨. 간이 늑골궁 밖으로 뚜렷하게 뻗어나와 관찰되나 normal variation 가능성이 있음. 임시 echo 상 심벽이 다소 두꺼워 보였으나 탈수 있으므로 정확한 평가 불가. 탈수 교정 후 재평가가 필요 상담 심장 초음파 검사 권유 흉부 촬영 권유 ct 촬영중 사망 위험성 설명 드림 처치 수액 처치 ct 촬영 마취 프로포폴 cc ,,6,,,비강 분비 및 비출혈,비강 분비 및 비출혈,470,9
Yorkshire Terrier(요크셔 테리어),MN,2248,B_W,보호자와 함께 있는 동안에 pu pd를 나타냄. 요색깔이 물처럼 나옴. 오늘 levothyroxine 비용은 이전에 지불한 것으로 대체. 약봉투에 씩 쪼개서 포장. 혈액검사상 특이소견 없으나 만성신부전 초기 증상일 수 있음. ,,10, 갑상선 기능 저하증 ,내분비 질환 ,다뇨/다발(다음),다뇨/다발(다음),126,5
Schnauzers( 슈나우져),FS              ,2001,D_VIP, money 선납 고한아 cc syncope 의심 그제 닭고기 급여 후 목에 뭐가 걸린 것처럼 기침 보였음. 오늘도 기침과 함께 헛구역질 계속 보이다 경직되면서 쓰러짐. 당시 의식이 있었음. 쓰러지고 바로 회복됨. 초도 안 되는 것처럼 느끼심. 차 타고 오면서도 계속 헛구역질 보이고 유연증상 보임. 본 증상 보일 때 약간 흥분 상황 이었음. 본원 이전 내원하고 나서 다른 질병으로 관리 받은 적 없음. 배변 양호. 구토 없음. 기침은 이번이 처음. p panting 청진 시 좌우측 murmur muffled sound. 폐음은 양호. bp a cbc nrf c nrf lactate dimer ray 흉부 심종대 폐야의 전반적인 기관지 간질 침윤. lateral 상 연부조직 밀도의 동그란 음영 보이는 바 내일 재검 필요함. 복부 비장의 신장되어 있음. 비장종대되어 있는지 재검 필요함. 복부 전반적으로 지방 다수 확인됨. echo 유선부 fna mr tr syncope. 폐야 침윤 심초 진행 중 서맥 확인되며 긴장하면 다시 심박 회복 확인됨. 미주신경성에 의한 서맥 가능성 있으며 atropine response test 필요함. 이로인해 syncope 증상 발생했을 가능성 있음. 이에 준해 theophylline 처방하였음. 심장약물 복용 시작. lactate 양호하였기에 호흡곤란에 의한 syncope일 가능성 적음. 체표 전반적인 mass 보이는 바 폐야의 침윤이 전이성일 가능성 배제할 수 없음. 익일 복부 초음파 촬영하여 종양 전이 가능성 배제해야함. 또한 유선 종양 fna 샘플링 원활하지 않았기에 익일 초음파 유도하 fna 가능할 시 진행 예정. 보호자 분 어머님께서 슈나를 본인의 건강과 연관되어 생각하시므로 신중히 예후판정 원하심. 갑작스럽게 나빠지는 질병이라면 안락사도 생각하고 계심. 우선 심장병과 종양에 대한 정확한 감별 필요하며 익일 종양에 대한 재평가 진행 예정. 입원하여 하루간 기침 or syncope 증상 확인 예정. 진료비 money 발생 말씀드렸음. ,,1601, 판막증 (의심 포함한 심장 잡음 + 심부전 증후 자), 순환기 질환 ,실신,실신,1004,13
K.C(Korean Cat),FS              ,2029,D_VIP, 금일 비용 결제완료 money 결제완료 구조하였는데 얼굴에서 콧물 고름 등 나온다고 내원하였음 작년 month 부터 돌보던 아이 month 까지 괜찮았으나 month 초부터 감기기운 있는 것으로 보였음 최근에 확인하였을 때 마르고 증상 심해져보여 구조하여 오심 길고양이라 아이상태에 대해 잘 모르심 식욕 활력 배변 배뇨 등 알지 못하심 alert dehydration bt hr청진 이상없음 식욕 양호 양측 결막염 코 앞부분 딱지 및 궤양 cbc wbc plt chem glob felv fiv negative 항체가 검사 fpv fhv fcv 명일 pcr 검사 보낼 예정 furd 에 준해 치료 복부초음파 및 방사선 검사는 내일 진행 예정 입원기간 대략 month 일 하루에 money 정도 나올 것이라고 설명 할인 포함하여 ,,"6,27", 상기에 해당하지 않는 호흡기 감염 , 호흡기 질환 ,"비강 분비 및 비출혈,체중 변화, 체중 증가, 체중 감소 ",비강 분비 및 비출혈,408,9
